"","Cites","Authors","Title","Year","Source","Publisher","ArticleURL","CitesURL","GSRank","QueryDate","Type","DOI","ISSN","CitationURL","Volume","Issue","StartPage","EndPage","ECC","CitesPerYear","CitesPerAuthor","AuthorCount","Age","Abstract","generic_drug_name"
"1",0,"W. Han","Sitagliptin improves functional recovery via GLP-1R-induced anti-apoptosis and facilitation of axonal regeneration after spinal cord injury",2020,"Journal of Cellular and Molecular Medicine",NA,"https://www.scopus.com/inward/record.uri?partnerID=HzOxMe3b&scp=85087307704&origin=inward","https://www.scopus.com/inward/citedby.uri?partnerID=HzOxMe3b&scp=85087307704&origin=inward",5,"2021-01-16 15:32:07","Article","10.1111/jcmm.15501","1582-1838","https://api.elsevier.com/content/abstract/scopus_id/85087307704",24,15,8687,8702,0,0,0,1,1,NA,"glucagon"
"2",0,"D. Zhang","Liraglutide provides neuroprotection by regulating autophagy through the AMPK-FOXO3 signaling pathway in a spinal contusion injury rat model",2020,"Neuroscience Letters",NA,"https://www.scopus.com/inward/record.uri?partnerID=HzOxMe3b&scp=85077744990&origin=inward","https://www.scopus.com/inward/citedby.uri?partnerID=HzOxMe3b&scp=85077744990&origin=inward",6,"2021-01-16 15:32:07","Article","10.1016/j.neulet.2020.134747","0304-3940","https://api.elsevier.com/content/abstract/scopus_id/85077744990",720,NA,NA,NA,0,0,0,1,1,NA,"glucagon"
"3",2,"Z. Sun","Exendin-4 Plays a Protective Role in a Rat Model of Spinal Cord Injury Through SERCA2",2018,"Cellular Physiology and Biochemistry",NA,"https://www.scopus.com/inward/record.uri?partnerID=HzOxMe3b&scp=85047436363&origin=inward","https://www.scopus.com/inward/citedby.uri?partnerID=HzOxMe3b&scp=85047436363&origin=inward",4,"2021-01-16 15:32:07","Article","10.1159/000490017","1015-8987","https://api.elsevier.com/content/abstract/scopus_id/85047436363",47,2,617,629,2,0.67,2,1,3,NA,"glucagon"
"4",10,"J. Chen","Liraglutide activates autophagy via GLP-1R to improve functional recovery after spinal cord injury",2017,"Oncotarget",NA,"https://www.scopus.com/inward/record.uri?partnerID=HzOxMe3b&scp=85031491712&origin=inward","https://www.scopus.com/inward/citedby.uri?partnerID=HzOxMe3b&scp=85031491712&origin=inward",3,"2021-01-16 15:32:07","Article","10.18632/oncotarget.20791","1949-2553","https://api.elsevier.com/content/abstract/scopus_id/85031491712",8,49,85949,85968,10,2.5,10,1,4,NA,"glucagon"
"5",42,"R.P. Hoffman","Sympathetic mechanisms of hypoglycemic counterregulation",2007,"Current Diabetes Reviews",NA,"https://www.scopus.com/inward/record.uri?partnerID=HzOxMe3b&scp=34547837415&origin=inward","https://www.scopus.com/inward/citedby.uri?partnerID=HzOxMe3b&scp=34547837415&origin=inward",2,"2021-01-16 15:32:07","Review","10.2174/157339907781368995","1573-3998","https://api.elsevier.com/content/abstract/scopus_id/34547837415",3,3,185,193,42,3,42,1,14,NA,"glucagon"
"6",48,"H. Li","Exendin-4 Enhances Motor Function Recovery via Promotion of Autophagy and Inhibition of Neuronal Apoptosis After Spinal Cord Injury in Rats",2016,"Molecular Neurobiology",NA,"https://www.scopus.com/inward/record.uri?partnerID=HzOxMe3b&scp=84937709277&origin=inward","https://www.scopus.com/inward/citedby.uri?partnerID=HzOxMe3b&scp=84937709277&origin=inward",1,"2021-01-16 15:32:07","Article","10.1007/s12035-015-9327-7","0893-7648","https://api.elsevier.com/content/abstract/scopus_id/84937709277",53,6,4073,4082,48,9.6,48,1,5,NA,"glucagon"
