"","Cites","Authors","Title","Year","Source","Publisher","ArticleURL","CitesURL","GSRank","QueryDate","Type","DOI","ISSN","CitationURL","Volume","Issue","StartPage","EndPage","ECC","CitesPerYear","CitesPerAuthor","AuthorCount","Age","Abstract","generic_drug_name"
"1",0,"X.Y. Shen","Influence of spinal cord injury on core regions of motor function",2021,"Neural Regeneration Research",NA,"https://www.scopus.com/inward/record.uri?partnerID=HzOxMe3b&scp=85092652009&origin=inward","https://www.scopus.com/inward/citedby.uri?partnerID=HzOxMe3b&scp=85092652009&origin=inward",6,"2021-01-15 16:50:22","Article","10.4103/1673-5374.293158","1673-5374","https://api.elsevier.com/content/abstract/scopus_id/85092652009",16,3,567,572,0,0,0,1,1,NA,"propylene_glycol"
"2",0,"S. Hendrix","HDAC8 inhibition reduces lesional iba-1+ cell infiltration after spinal cord injury without effects on functional recovery",2020,"International Journal of Molecular Sciences",NA,"https://www.scopus.com/inward/record.uri?partnerID=HzOxMe3b&scp=85087667182&origin=inward","https://www.scopus.com/inward/citedby.uri?partnerID=HzOxMe3b&scp=85087667182&origin=inward",7,"2021-01-15 16:50:22","Article","10.3390/ijms21124539","1661-6596","https://api.elsevier.com/content/abstract/scopus_id/85087667182",21,12,1,15,0,0,0,1,1,NA,"propylene_glycol"
"3",14,"J. Liu","Honokiol downregulates kruppel-like factor 4 expression, attenuates inflammation, and reduces histopathology after spinal cord injury in rats",2015,"Spine",NA,"https://www.scopus.com/inward/record.uri?partnerID=HzOxMe3b&scp=84952950830&origin=inward","https://www.scopus.com/inward/citedby.uri?partnerID=HzOxMe3b&scp=84952950830&origin=inward",5,"2021-01-15 16:50:22","Article","10.1097/BRS.0000000000000758","0362-2436","https://api.elsevier.com/content/abstract/scopus_id/84952950830",40,6,363,368,14,2.33,14,1,6,NA,"propylene_glycol"
"4",19,"Z. Jie","Treatment with immunosuppressants FTY720 and tacrolimus promotes functional recovery after spinal cord injury in rats",2009,"Tohoku Journal of Experimental Medicine",NA,"https://www.scopus.com/inward/record.uri?partnerID=HzOxMe3b&scp=73849117209&origin=inward","https://www.scopus.com/inward/citedby.uri?partnerID=HzOxMe3b&scp=73849117209&origin=inward",4,"2021-01-15 16:50:22","Article","10.1620/tjem.219.295","0040-8727","https://api.elsevier.com/content/abstract/scopus_id/73849117209",219,4,295,302,19,1.58,19,1,12,NA,"propylene_glycol"
"5",45,"L. Lu","Fingolimod exerts neuroprotective effects in a mouse model of intracerebral hemorrhage",2014,"Brain Research",NA,"https://www.scopus.com/inward/record.uri?partnerID=HzOxMe3b&scp=84895532380&origin=inward","https://www.scopus.com/inward/citedby.uri?partnerID=HzOxMe3b&scp=84895532380&origin=inward",3,"2021-01-15 16:50:22","Article","10.1016/j.brainres.2014.01.048","0006-8993","https://api.elsevier.com/content/abstract/scopus_id/84895532380",1555,NA,89,96,45,6.43,45,1,7,NA,"propylene_glycol"
"6",46,"Y. Norimatsu","FTY720 improves functional recovery after spinal cord injury by primarily nonimmunomodulatory mechanisms",2012,"American Journal of Pathology",NA,"https://www.scopus.com/inward/record.uri?partnerID=HzOxMe3b&scp=84859111081&origin=inward","https://www.scopus.com/inward/citedby.uri?partnerID=HzOxMe3b&scp=84859111081&origin=inward",2,"2021-01-15 16:50:22","Article","10.1016/j.ajpath.2011.12.012","0002-9440","https://api.elsevier.com/content/abstract/scopus_id/84859111081",180,4,1625,1635,46,5.11,46,1,9,NA,"propylene_glycol"
"7",48,"K. Lee","FTY720 reduces inflammation and promotes functional recovery after spinal cord injury",2009,"Journal of Neurotrauma",NA,"https://www.scopus.com/inward/record.uri?partnerID=HzOxMe3b&scp=75449116198&origin=inward","https://www.scopus.com/inward/citedby.uri?partnerID=HzOxMe3b&scp=75449116198&origin=inward",1,"2021-01-15 16:50:22","Article","10.1089/neu.2008.0840","0897-7151","https://api.elsevier.com/content/abstract/scopus_id/75449116198",26,12,2335,2344,48,4,48,1,12,NA,"propylene_glycol"
