"","Cites","Authors","Title","Year","Source","Publisher","ArticleURL","CitesURL","GSRank","QueryDate","Type","DOI","ISSN","CitationURL","Volume","Issue","StartPage","EndPage","ECC","CitesPerYear","CitesPerAuthor","AuthorCount","Age","Abstract","generic_drug_name"
"1",1,"M. Hosseini","Effect of vitamins C and e on recovery of motor function after spinal cord injury: Systematic review and meta-analysis of animal studies",2020,"Nutrition Reviews",NA,"https://www.scopus.com/inward/record.uri?partnerID=HzOxMe3b&scp=85084692933&origin=inward","https://www.scopus.com/inward/citedby.uri?partnerID=HzOxMe3b&scp=85084692933&origin=inward",6,"2021-01-12 11:46:08","Review","10.1093/nutrit/nuz076","0029-6643","https://api.elsevier.com/content/abstract/scopus_id/85084692933",78,6,465,473,1,1,1,1,1,NA,"vitamin_c"
"2",1,"B. Pourheydar","Effect of co-administration of ubiquinone and vitamin C on changes of behavioral, histological and biochemical parameters in contusion model of rat spinal cord injury",2018,"Journal of Mazandaran University of Medical Sciences",NA,"https://www.scopus.com/inward/record.uri?partnerID=HzOxMe3b&scp=85041417305&origin=inward","https://www.scopus.com/inward/citedby.uri?partnerID=HzOxMe3b&scp=85041417305&origin=inward",7,"2021-01-12 11:46:08","Article","","1735-9279","https://api.elsevier.com/content/abstract/scopus_id/85041417305",27,157,17,34,1,0.33,1,1,3,NA,"vitamin_c"
"3",1,"G. Fugazza","Contribution to pharmacological treatment of decubitu's lesions",1995,"European Review for Medical and Pharmacological Sciences",NA,"https://www.scopus.com/inward/record.uri?partnerID=HzOxMe3b&scp=0029556278&origin=inward","https://www.scopus.com/inward/citedby.uri?partnerID=HzOxMe3b&scp=0029556278&origin=inward",8,"2021-01-12 11:46:08","Article","","0392-291X","https://api.elsevier.com/content/abstract/scopus_id/0029556278",17,5,197,202,1,0.04,1,1,26,NA,"vitamin_c"
"4",2,"A. Navarrete-Opazo","Effectiveness of dietary supplements in spinal cord injury subjects",2017,"Disability and Health Journal",NA,"https://www.scopus.com/inward/record.uri?partnerID=HzOxMe3b&scp=85008354369&origin=inward","https://www.scopus.com/inward/citedby.uri?partnerID=HzOxMe3b&scp=85008354369&origin=inward",5,"2021-01-12 11:46:08","Review","10.1016/j.dhjo.2016.12.002","1936-6574","https://api.elsevier.com/content/abstract/scopus_id/85008354369",10,2,183,197,2,0.5,2,1,4,NA,"vitamin_c"
"5",5,"N. Salem","Does Vitamin C have the ability to augment the therapeutic effect of bone marrow-derived mesenchymal stem cells on spinal cord injury?",2017,"Neural Regeneration Research",NA,"https://www.scopus.com/inward/record.uri?partnerID=HzOxMe3b&scp=85049851511&origin=inward","https://www.scopus.com/inward/citedby.uri?partnerID=HzOxMe3b&scp=85049851511&origin=inward",4,"2021-01-12 11:46:08","Article","10.4103/1673-5374.221163","1673-5374","https://api.elsevier.com/content/abstract/scopus_id/85049851511",12,12,2050,2058,5,1.25,5,1,4,NA,"vitamin_c"
"6",11,"J. Lee","Fluoxetine and vitamin C synergistically inhibits blood-spinal cord barrier disruption and improves functional recovery after spinal cord injury",2016,"Neuropharmacology",NA,"https://www.scopus.com/inward/record.uri?partnerID=HzOxMe3b&scp=84976569505&origin=inward","https://www.scopus.com/inward/citedby.uri?partnerID=HzOxMe3b&scp=84976569505&origin=inward",3,"2021-01-12 11:46:08","Article","10.1016/j.neuropharm.2016.05.018","0028-3908","https://api.elsevier.com/content/abstract/scopus_id/84976569505",109,NA,78,87,11,2.2,11,1,5,NA,"vitamin_c"
"7",19,"H. Chen","Effects of the combined administration of vitamins C and e on the oxidative stress status and programmed cell death pathways after experimental spinal cord injury",2014,"Spinal Cord",NA,"https://www.scopus.com/inward/record.uri?partnerID=HzOxMe3b&scp=84891745971&origin=inward","https://www.scopus.com/inward/citedby.uri?partnerID=HzOxMe3b&scp=84891745971&origin=inward",2,"2021-01-12 11:46:08","Article","10.1038/sc.2013.140","1362-4393","https://api.elsevier.com/content/abstract/scopus_id/84891745971",52,1,24,28,19,2.71,19,1,7,NA,"vitamin_c"
"8",28,"M. Buehner","Oxalate nephropathy after continuous infusion of high-dose Vitamin C as an adjunct to burn resuscitation",2016,"Journal of Burn Care and Research",NA,"https://www.scopus.com/inward/record.uri?partnerID=HzOxMe3b&scp=84978033993&origin=inward","https://www.scopus.com/inward/citedby.uri?partnerID=HzOxMe3b&scp=84978033993&origin=inward",1,"2021-01-12 11:46:08","Article","10.1097/BCR.0000000000000233","1559-047X","https://api.elsevier.com/content/abstract/scopus_id/84978033993",37,4,NA,NA,28,5.6,28,1,5,NA,"vitamin_c"
