"","Cites","Authors","Title","Year","Source","Publisher","ArticleURL","CitesURL","GSRank","QueryDate","Type","DOI","ISSN","CitationURL","Volume","Issue","StartPage","EndPage","ECC","CitesPerYear","CitesPerAuthor","AuthorCount","Age","Abstract","generic_drug_name"
"40",0,"Jose A Roman, Tracy L Niedzielko, Robert C Haddon, Vladimir Parpura, Candace L Floyd","Single-walled carbon nanotubes chemically functionalized with polyethylene glycol promote tissue repair in a rat model of spinal cord injury.",2011,"Journal of neurotrauma",NA,NA,NA,40,"2021-01-18 11:40:20","Journal Article","10.1089/neu.2010.1409","1557-9042",NA,28,11,2349,2362,0,0,0,5,10,"Traumatic spinal cord injury (SCI) induces tissue damage and results in the formation of a cavity that inhibits axonal regrowth. Filling this cavity with a growth-permissive substrate would likely promote regeneration and repair. Single-walled carbon nanotubes functionalized with polyethylene glycol (SWNT-PEG) have been shown to increase the length of selected neurites in vitro. We hypothesized that administration of SWNT-PEG after experimental SCI will promote regeneration of axons into the lesion cavity and functional recovery of the hindlimbs. To evaluate this hypothesis, complete transection SCI was induced at the T9 vertebral level in adult female rats. One week after transection, the epicenter of the lesion was injected with 25??L of either vehicle (saline), or 1??g/mL, 10??g/mL, or 100??g/mL of SWNT-PEG. Behavioral analysis was conducted before injury, before treatment, and once every 7 days for 28 days after treatment. At 28 days post-injection the rats were euthanized and spinal cord tissue was extracted. Immunohistochemistry was used to detect the area of the cyst, the extent of the glial scar, and axonal morphology. We found that post-SCI administration of SWNT-PEG decreased lesion volume, increased neurofilament-positive fibers and corticospinal tract fibers in the lesion, and did not increase reactive gliosis. Additionally, post-SCI administration of SWNT-PEG induced a modest improvement in hindlimb locomotor recovery without inducing hyperalgesia. These data suggest that SWNT-PEG may be an effective material to promote axonal repair and regeneration after SCI.","polyethylene_glycol"
"41",0,"Brian K Kwon, Lali H Sekhon, Michael G Fehlings","Emerging repair, regeneration, and translational research advances for spinal cord injury.",2010,"Spine",NA,NA,NA,41,"2021-01-18 11:40:20","Journal Article","10.1097/BRS.0b013e3181f3286d","1528-1159",NA,35,21,NA,NA,0,0,0,3,11,"Literature review of basic scientific and clinical research in spinal cord injury (SCI). To provide physicians with an overview of the neurobiologic challenges of SCI, the current status of investigation for novel therapies that have been translated to human clinical trials, and the preclinical, scientific basis for each of these therapies. An abundance of recent scientific and clinical research activity has revealed numerous insights into the neurobiology of SCI, and has generated an abundance of potential therapies. An increasing number of such therapies are being translated into human SCI trials. Clinicians who attend to SCI patients are increasingly asked about potential treatments and clinical trials. Published data review of novel treatments that are either currently in human clinical trials for acute SCI or about to initiate clinical evaluation. A number of treatments have bridged the ""translational gap"" and are currently either in the midst of human SCI trials, or are about to begin such clinical evaluation. These include minocycline, Cethrin, anti-Nogo antibodies, systemic hypothermia, Riluzole, magnesium chloride in polyethylene glycol, and human embryonic stem cell derived oligodendrocyte progenitors. A systematic review of the preclinical literature on these specific therapies reveals promising results in a variety of different SCI injury models. The SCI community is encouraged by the progression of novel therapies from ""bench to bedside"" and the initiation of clinical trials for a number of different treatments. The task of clinical evaluation, however, is substantial, and many years will be required before the actual efficacy of the treatments currently in evaluation will be determined.","polyethylene_glycol"
"42",0,"Jae H T Lee, Josee Roy, Hong Moon Sohn, Mi Cheong, Jie Liu, Anthea T Stammers, Wolfram Tetzlaff, Brian K Kwon","Magnesium in a polyethylene glycol formulation provides neuroprotection after unilateral cervical spinal cord injury.",2010,"Spine",NA,NA,NA,42,"2021-01-18 11:40:20","Journal Article","10.1097/BRS.0b013e3181d2d6c5","1528-1159",NA,35,23,2041,2048,0,0,0,8,11,"Experimental animal study. To investigate the neuroprotective efficacy of this magnesium in polyethylene glycol (PEG) formulation in a contusive model of cervical spinal cord injury (SCI). Intravenously administered magnesium has been extensively investigated as a neuroprotective agent in animal models of SCI, stroke, and traumatic brain injuries, and has been evaluated in large scale clinical trials for the latter 2 indications. We have developed a novel formulation of magnesium chloride (MgCl₂) within PEG, and have previously demonstrated the neuroprotective benefit of this formulation in animal models of thoracic SCI. Twenty-two Sprague Dawley rats underwent a unilateral cervical hemicontusion at C4-C5 and were randomized 2 hours later to either the MgCl₂ in PEG formulation, or normal saline. Each treatment was administered in 5 intravenous infusions spaced 6 hours apart. Behavioral recovery was assessed over 6 weeks, after which the cord was analyzed to measure the extent of gray matter and white matter sparing through the injury site. In the horizontal ladder test, the percentage of forelimb errors made by the animals treated with MgCl₂ in PEG formulation was significantly lower than the saline-treated controls. Histologic analysis also revealed a significantly higher cumulative white matter sparing through the injury site in the MgCl₂ in PEG group. MgCl₂ in a PEG formulation reduced secondary damage and improved behavioral recovery when administered 2 hours after a unilateral cervical hemicontusion injury. These findings are consistent with the neurologic benefit observed when administering this magnesium formulation in contusive and compressive models of thoracic SCI. Demonstrating the robustness of this neuroprotective effect in multiple injury models (and in the cervical injury model in particular) is important when considering the applicability of such a therapy for human SCIs.","polyethylene_glycol"
"43",0,"Youngnam Cho, Riyi Shi, Albena Ivanisevic, Richard Ben Borgens","Functional silica nanoparticle-mediated neuronal membrane sealing following traumatic spinal cord injury.",2010,"Journal of neuroscience research",NA,NA,NA,43,"2021-01-18 11:40:20","Journal Article","10.1002/jnr.22309","1097-4547",NA,88,7,1433,1444,0,0,0,4,11,"The mechanical damage to neurons and their processes induced by spinal cord injury (SCI) causes a progressive cascade of pathophysiological events beginning with the derangement of ionic equilibrium and collapse of membrane permeability. This leads to a cumulative deterioration of neurons, axons, and the tissue architecture of the cord. We have previously shown that the application of the hydrophilic polymer polyethylene glycol (PEG) following spinal cord or brain injury can rapidly restore membrane integrity, reduce oxidative stress, restore impaired axonal conductivity, and mediate functional recovery in rats, guinea pigs, and dogs. However there are limits to both the concentration and the molecular weight of the application that do not permit the broadest recovery across an injured animal population. In this study, PEG-decorated silica nanoparticles (PSiNPs) sealed cells, as shown by the significantly reduced leakage of lactate dehydrogenase from damaged cells compared with uncoated particles or PEG alone. Further in vivo tests showed that PSiNPs also significantly reduced the formation of reactive oxygen species and the process of lipid peroxidation of the membrane. Fabrication of PSiNPs containing embedded dyes also revealed targeting of the particles to damaged, but not undamaged, spinal cord tissues. In an in vivo crush/contusion model of guinea pig SCI, every animal but one injected with PSiNPs recovered conduction through the cord lesion, whereas none of the control animals did. These findings suggest that the use of multifunctional nanoparticles may offer a novel treatment approach for spinal cord injury, traumatic brain injury, and possibly neurodegenerative disorders.","polyethylene_glycol"
"44",0,"Ashley Nehrt, Kristin Hamann, Hui Ouyang, Riyi Shi","Polyethylene glycol enhances axolemmal resealing following transection in cultured cells and in ex vivo spinal cord.",2010,"Journal of neurotrauma",NA,NA,NA,44,"2021-01-18 11:40:20","Journal Article","10.1089/neu.2009.0993","1557-9042",NA,27,1,151,161,0,0,0,4,11,"The integrity of the neuronal membrane is critical for its function as well as survival, and ineffective repair of damaged membranes may be one of the key factors underlying the neuronal degeneration and overall functional loss that occurs after spinal cord injury and traumatic brain injury. Previously, we showed that polyethylene glycol (PEG) can reseal axonal membranes following compression in isolated guinea pig spinal cord white matter. We now report that 10 mM PEG can also significantly enhance membrane resealing following transection in the clinically relevant conditions of low extracellular Ca(2+) and low temperature. Such beneficial effects were demonstrated both functionally, through membrane potential measured by double sucrose gap apparatus, and anatomically, through horseradish peroxidase and tetramethyl rhodamine dextran dye exclusion assays. We further noted that axons with small diameters preferentially benefited from PEG-mediated axolemmal resealing. Using atomic force microscopy, we further showed that PEG can effectively reduce neuronal membrane surface tension. We hypothesize that PEG may promote axolemmal resealing by increasing membrane line tension and reducing membrane tension, thus creating conditions more favorable to membrane resealing. In summary, these studies suggest that PEG is effective under the clinically relevant conditions of low Ca(2+) and temperature, and thus has the potential to be used in combination with other more established interventions in spinal cord and traumatic brain injury.","polyethylene_glycol"
"45",0,"Darryl C Baptiste, James W Austin, William Zhao, Adrian Nahirny, Shuzo Sugita, Michael G Fehlings","Systemic polyethylene glycol promotes neurological recovery and tissue sparing in rats after cervical spinal cord injury.",2009,"Journal of neuropathology and experimental neurology",NA,NA,NA,45,"2021-01-18 11:40:20","Journal Article","10.1097/NEN.0b013e3181a72605","0022-3069",NA,68,6,661,676,0,0,0,6,12,"Polyethylene glycol (PEG) has been reported to possess fusogenic properties that may confer neuroprotection after spinal cord injury (SCI), but there is uncertainty regarding the mechanisms of PEG in vivo and the robustness of its protective effects. We hypothesized that PEG promotes preservation of cytoskeletal proteins associated with white matter protection and neurobehavioral recovery after SCI. In proof-of-principle experiments using a pin-drop organotypic culture model of SCI, PEG attenuated neural cell death. Adult rats underwent 35-g clip compression SCI at C8 and were randomized postinjury to receive intravenous 30% PEG or sterile Ringer's lactate solution. Confocal microscopy and high-performance liquid chromatography of fluorescein-conjugated PEG permitted in vivo quantification of PEG concentrations in the injured and uninjured spinal cord. Western blot, immunohistochemistry, and terminal deoxynucleotidyl transferase mediated dUTP nick end labeling staining demonstrated that PEG reduced 200-kd neurofilament degradation and apoptotic cell death. Polyethylene glycol also promoted spinal cord tissue sparing based on retrograde axonal Fluoro-Gold tracing and morphometric histological assessment. Polyethylene glycol also promoted significant, although modest, neurobehavioral recovery after SCI. Collectively, these results indicate that PEG protects key axonal cytoskeletal proteins after SCI, and that the protection is associated with axonal preservation. The modest extent of locomotor recovery after treatment with PEG suggests, however, that this compound may notconfer sufficient neuroprotection to be used clinically as a single treatment.","polyethylene_glycol"
"46",0,"Brian K Kwon, Josee Roy, Jae H T Lee, Elena Okon, Hongbin Zhang, Jeffrey C Marx, Mark S Kindy","Magnesium chloride in a polyethylene glycol formulation as a neuroprotective therapy for acute spinal cord injury: preclinical refinement and optimization.",2009,"Journal of neurotrauma",NA,NA,NA,46,"2021-01-18 11:40:20","Journal Article","10.1089/neu.2009.0884","1557-9042",NA,26,8,1379,1393,0,0,0,7,12,"Intravenously administered magnesium has been extensively investigated as a neuroprotective agent traumatic brain injuries and stroke. Numerous investigators have reported the neuroprotective benefits of magnesium in animal models of spinal cord injury (SCI) as well, but typically with doses that far exceed human tolerability. To develop magnesium into a clinically relevant therapy for SCI, further refinement and improvement of the magnesium formulation is necessary. In this series of experiments, we evaluated the neuroprotective efficacy of magnesium in a polyethylene glycol (PEG) formulation using an acute model of thoracic SCI. Following thoracic contusion (Infinite Horizon) rat SCI model, we independently confirmed the neuroprotective efficacy of the magnesium and PEG combination which had been previously reported in a thoracic clip compression model of SCI (Ditor et al., 2007). We established that the 254 micromol/kg dose of MgCl(2) was superior to 127 micromol/kg MgCl(2) with respect to tissue sparing and locomotor recovery. Additionally, the number of infusions (2, 4, or 6), time between infusions (6 vs 8 hours), and different magnesium salts (MgCl(2) vs MgSO(4)) were evaluated to determine an ""optimal"" treatment regimen. We observed that an ""optimized"" regimen of MgCl(2) within PEG conferred greater tissue neuroprotection and improved locomotor recovery compared to methylprednisolone. Further a 4 hour time window of histologic and behavioral efficacy was established. The goal of these experiments was to help guide the treatment parameters for a clinical trial of magnesium within a polyethylene glycol formulation in acute human spinal cord injury.","polyethylene_glycol"
"47",0,"Andrew O Koob, Julia M Colby, Richard B Borgens","Behavioral recovery from traumatic brain injury after membrane reconstruction using polyethylene glycol.",2008,"Journal of biological engineering",NA,NA,NA,47,"2021-01-18 11:40:20","Journal Article","10.1186/1754-1611-2-9","1754-1611",NA,2,NA,9,NA,0,0,0,3,13,"Polyethylene glycol (PEG; 2000 MW, 30% by volume) has been shown to mechanically repair damaged cellular membranes and reduce secondary axotomy after traumatic brain and spinal cord injury (TBI and SCI respectively). This repair is achieved following spontaneous reassembly of cell membranes made possible by the action of targeted hydrophilic polymers which first seal the compromised portion of the plasmalemma, and secondarily, allow the lipidic core of the compromised membranes to resolve into each other. Here we compared PEG-treated to untreated rats using a computer-managed open-field behavioral test subsequent to a standardized brain injury. Animals were evaluated after a 2-, 4-, and 6-hour delay in treatment after TBI. Treated animals receive a single subcutaneous injection of PEG. When treated within 2 hours of the injury, injured PEG-treated rats showed statistically significant improvement in their exploratory behavior recorded in the activity box when compared to untreated but brain-injured controls. A delay of 4 hours reduced this level of achievement, but a statistically significant improvement due to PEG injection was still clearly evident in most outcome measures compared at the various evaluation times. A further delay of 2 more hours, however, eradicated the beneficial effects of PEG injection as revealed using this behavioral assessment. Thus, there appears to be a critical window of time in which PEG administration after TBI can provide neuroprotection resulting in an enhanced functional recovery. As is often seen in clinically applied acute treatments for trauma, the earlier the intervention can be applied, the better the outcome.","polyethylene_glycol"
"48",0,"David S Ditor, Sunil M John, Josee Roy, Jeffrey C Marx, Colin Kittmer, Lynne C Weaver","Effects of polyethylene glycol and magnesium sulfate administration on clinically relevant neurological outcomes after spinal cord injury in the rat.",2007,"Journal of neuroscience research",NA,NA,NA,48,"2021-01-18 11:40:20","Journal Article","10.1002/jnr.21283","0360-4012",NA,85,7,1458,1467,0,0,0,6,14,"The purpose of this study was to determine the long-term effects of polyethylene glycol (PEG) and magnesium sulfate (MgSO(4)) on clinically relevant motor, sensory, and autonomic outcomes after spinal cord injury (SCI). Rats were injured by clip compression (50 g; T4) and treated 15 min and 6 hr postinjury intravenously (tail vein) with PEG (1 g/kg, 30% w/w in saline; n = 11), MgSO(4) (300 mg/kg; n = 5), PEG + MgSO(4) (n = 6), or saline (n = 10). Behavioral testing lasted for 6 weeks, followed by histological analysis of the spinal cord. Both PEG and MgSO(4) resulted in enhanced locomotor recovery and lower susceptibility to neuropathic pain (mechanical allodynia) compared with saline. At 6 weeks, BBB scores were 7.3 +/- 0.2, 7.7 +/- 0.4, and 6.4 +/- 0.6 in PEG-treated, MgSO(4)-treated, and saline-treated control groups, respectively. Likewise, at 6 weeks PEG-, MgSO(4)-, and saline-treated control animals showed 3.5 +/- 0.4, 2.8 +/- 0.9, and 5.0 +/- 0.5 avoidance responses to at-level touch, respectively. PEG + MgSO(4) improved locomotor recovery and reduced pain but did not provide additional benefit compared with either treatment alone. Neither treatment, nor their combination, attenuated mean arterial pressure (MAP) increases during autonomic dysreflexia. However, saline-treated controls had significantly lower resting MAP than PEG-treated rats and tended to have lower resting MAP than MgSO(4)-treated rats 6 weeks postinjury. MgSO(4) treatment and PEG + MgSO(4) treatment resulted in significant increases in dorsal myelin sparing, and the latter resulted in significant reductions in lesion volume, compared with saline-treated controls. Furthermore, mean lesion volumes correlated negatively with the corresponding mean BBB scores and positively with the corresponding mean pain scores. In conclusion, both PEG and MgSO(4) enhanced long-term clinical outcomes after SCI.","polyethylene_glycol"
"49",0,"Peter H Laverty, Alenka Leskovar, Gert J Breur, Joan R Coates, Robert L Bergman, William R Widmer, James P Toombs, Scott Shapiro, Richard B Borgens","A preliminary study of intravenous surfactants in paraplegic dogs: polymer therapy in canine clinical SCI.",2004,"Journal of neurotrauma",NA,NA,NA,49,"2021-01-18 11:40:20","Journal Article","10.1089/neu.2004.21.1767","0897-7151",NA,21,12,1767,1777,0,0,0,9,17,"Hydrophilic polymers, both surfactants and triblock polymers, are known to seal defects in cell membranes. In previous experiments using laboratory animals, we have exploited this capability using polyethylene glycol (PEG) to repair spinal axons after severe, standardized spinal cord injury (SCI) in guinea pigs. Similar studies were conducted using a related co-polymer Poloxamer 188 (P 188). Here we carried out initial investigations of an intravenous application of PEG or P 188 (3500 Daltons, 30% w/w in saline; 2 mL/kg I.V. and 2 mL/kg body weight or 300 mL P 188 per kg, respectively) to neurologically complete cases of paraplegia in dogs. Our aim was to first determine if this is a clinically safe procedure in cases of severe naturally occurring SCI in dogs. Secondarily, we wanted to obtain preliminary evidence if this therapy could be of clinical benefit when compared to a larger number of similar, but historical, control cases. Strict entry criteria permitted recruitment of only neurologically complete paraplegic dogs into this study. Animals were treated by a combination of conventional and experimental techniques within approximately 72 h of admission for spinal trauma secondary to acute, explosive disk herniation. Outcome measures consisted of measurements of voluntary ambulation, deep and superficial pain perception, conscious proprioception in hindlimbs, and evoked potentials (somatosensory evoked potentials [SSEP]). We determined that polymer injection is a safe adjunct to the conventional management of severe neurological injury in dogs. We did not observe any unacceptable clinical response to polymer injection; there were no deaths, nor any other problem arising from, or associated with, the procedures. Outcome measures over the 6-8-week trial were improved by polymer injection when compared to historical cases. This recovery was unexpectedly rapid compared to these comparator groups. The results of this pilot trial provides evidence consistent with the notion that the injection of inorganic polymers in acute neurotrauma may be a simple and useful intervention during the acute phase of the injury.","polyethylene_glycol"
"50",0,"Jian Luo, Richard Borgens, Riyi Shi","Polyethylene glycol improves function and reduces oxidative stress in synaptosomal preparations following spinal cord injury.",2004,"Journal of neurotrauma",NA,NA,NA,50,"2021-01-18 11:40:20","Journal Article","10.1089/0897715041651097","0897-7151",NA,21,8,994,1007,0,0,0,3,17,"Spinal cord injury (SCI) results in rapid and significant oxidative stress. We have previously demonstrated that administration of polyethylene glycol (PEG) inhibits oxidative stress using an in vitro model of SCI. In this study we tested the effects of PEG in vivo, to elucidate the mechanism of PEG-mediated neuroprotection. We show that a compression injury at T10-11 induced diffusive oxidative stress in crude synaptosomal preparations, correlated with synaptosomal dysfunction and increased intrasynaptosomal calcium. Administration of PEG immediately post-injury produced a marked decrease in synaptosomal oxidative stress and calcium, associated with an increase in synaptosomal function. Confocal microscopy using fluorescein conjugated PEG revealed that PEG entered the cells of the injured spinal cord, placing the polymer in a position to directly interact with cellular organelles. PEG attenuates calcium-induced functional compromise of normal spinal cord synaptosomes and mitochondria in vitro. These results indicate that PEG may exert its neuroprotective effect through direct interaction with mitochondria, besides its known ability to rescue neurons and their axons by repairing the plasma membranes. We submit that PEG is likely to interfere with the cascade of secondary injury by several mechanisms of action that in concert reduce oxidative stress.","polyethylene_glycol"
"51",0,"Richard B Borgens, Debbie Bohnert, Brad Duerstock, Daniel Spomar, Raphael C Lee","Subcutaneous tri-block copolymer produces recovery from spinal cord injury.",2004,"Journal of neuroscience research",NA,NA,NA,51,"2021-01-18 11:40:20","Journal Article","10.1002/jnr.20053","0360-4012",NA,76,1,141,154,0,0,0,5,17,"We have studied the ability of nonionic detergents and hydrophilic polymers to seal permeabilized membranes of damaged cells, rescuing them from progressive dissolution, degeneration, and death. We report that a single subcutaneous injection of the tri-block copolymer, Poloxamer 188 (P188) 6 hr after a severe compression of the adult guinea pig spinal cord is able to: (1). preserve the anatomic integrity of the cord; (2). produce a rapid recovery of nerve impulse conduction through the lesion; and (3). produce a behavioral recovery of a spinal cord dependent long tract spinal cord reflex. These observations stood out against a control group in blinded evaluation. Conduction through the lesion was monitored by stimulating the tibial nerve of the hind limb, and measuring the arrival of evoked potentials at the contralateral sensory cortex of the brain (somatosensory evoked potentials; SSEP). Behavioral recovery was determined by a return of sensitivity of formerly areflexic receptive fields of the cutaneous trunchi muscle (CTM) reflex. This contraction of back skin in response to tactile stimulation is totally dependent on the integrity of an identified bilateral column of ascending long tract axons. A statistically significant recovery of both SSEP conduction through the lesion and the CTM reflex occurred in P188-treated animals compared to vehicle-treated controls. Quantitative 3D computer reconstruction of the lesioned vertebral segment of spinal cord revealed a statistically significant sparing of spinal cord parenchyma and a significant reduction in cavitation of the spinal cord compared to control animals We determined that the proportion of P188-treated animals that recovered evoked potentials were nearly identical to that produced by a subcutaneous injection of polyethylene glycol (PEG). In contrast, P188 was not as effective as PEG in producing a recovery of CTM functioning. We discuss the likely differences in the mechanisms of action of these two polymers, and the possibilities inherent in a combined treatment.","polyethylene_glycol"
