"","Cites","Authors","Title","Year","Source","Publisher","ArticleURL","CitesURL","GSRank","QueryDate","Type","DOI","ISSN","CitationURL","Volume","Issue","StartPage","EndPage","ECC","CitesPerYear","CitesPerAuthor","AuthorCount","Age","Abstract","generic_drug_name"
"1",0,"Mostafa Hosseini, Arash Sarveazad, Asrin Babahajian, Masoud Baikpour, Alexander R Vaccaro, Jens R Chapman, Mahmoud Yousefifard, Vafa Rahimi-Movaghar","Effect of vitamins C and E on recovery of motor function after spinal cord injury: systematic review and meta-analysis of animal studies.",2020,"Nutrition reviews",NA,NA,NA,1,"2021-01-12 11:43:03","Journal Article","10.1093/nutrit/nuz076","1753-4887",NA,78,6,465,473,0,0,0,8,1,"Many animal studies have evaluated the role of vitamins in the recovery of motor function after spinal cord injury, but their results have been contradictory and no consensus has been reached. This meta-analysis aimed to investigate the effects of vitamin C and vitamin E on recovery of motor function after spinal cord injury in animal models. Two authors independently collected the records of relevant articles published in MEDLINE, Embase, Scopus, and Web of Science through November 2018. All studies conducted in animal models to evaluate the therapeutic effects of vitamin C or vitamin E or both on recovery of motor function after spinal cord injury were included. Studies that lacked a control group or a standard treatment, lacked an assessment of motor function, included genetically modified/engineered animals, included animals pretreated with vitamin C or vitamin E, or combined vitamin treatment with other methods, such as cell therapies, were excluded. Data from 10 articles met the inclusion criteria for meta-analysis, conducted in accordance with PRISMA guidelines. Daily supplementation with vitamin C (P < 0.0001) and vitamin E (P < 0.0001) significantly improved the recovery of motor function in animals affected by spinal cord injury. Vitamin C supplementation is effective only when administered intraperitoneally (P < 0.0001). Concurrent supplementation with both vitamins does not show better efficacy than treatment with either one alone. Administration of vitamin C and vitamin E in animal models of spinal cord injury significantly improves the recovery of motor function.","vitamin_e"
"2",0,"Kathia Cordero, Gemma G Coronel, Miguel Serrano-Illán, Jennifer Cruz-Bracero, Johnny D Figueroa, Marino De León","Effects of Dietary Vitamin E Supplementation in Bladder Function and Spasticity during Spinal Cord Injury.",2018,"Brain sciences",NA,NA,NA,2,"2021-01-12 11:43:03","Journal Article","10.3390/brainsci8030038","2076-3425",NA,8,3,NA,NA,0,0,0,6,3,"Traumatic spinal cord injury (SCI) results in debilitating autonomic dysfunctions, paralysis and significant sensorimotor impairments. A key component of SCI is the generation of free radicals that contributes to the high levels of oxidative stress observed. This study investigates whether dietary supplementation with the antioxidant vitamin E (alpha-tocopherol) improves functional recovery after SCI. Female adult Sprague-Dawley rats were fed either with a normal diet or a dietary regiment supplemented with vitamin E (51 IU/g) for eight weeks. The rats were subsequently exposed either to a contusive SCI or sham operation, and evaluated using standard functional behavior analysis. We report that the rats that consumed the vitamin E-enriched diet showed an accelerated bladder recovery and significant improvements in locomotor function relative to controls, as determined by residual volumes and Basso, Beatie, and Bresnaham BBB scores, respectively. Interestingly, the prophylactic dietary intervention did not preserve neurons in the ventral horn of injured rats, but it significantly increased the numbers of oligodendrocytes. Vitamin E supplementation attenuated the depression of the H-reflex (a typical functional consequence of SCI) while increasing the levels of supraspinal serotonin immunoreactivity. Our findings support the potential complementary use of vitamin E to ameliorate sensory and autonomic dysfunctions associated with spinal cord injury, and identified promising new cellular and functional targets of its neuroprotective effects.","vitamin_e"
"3",0,"Nitin Seth, Heather A Simmons, Farah Masood, William A Graham, Douglas L Rosene, Susan V Westmoreland, Sheila M Cummings, Basia Gwardjan, Ervin Sejdic, Amber F Hoggatt, Dane R Schalk, Hussein A Abdullah, John B Sledge, Shanker Nesathurai","Model of Traumatic Spinal Cord Injury for Evaluating Pharmacologic Treatments in Cynomolgus Macaques (Macaca fasicularis).",2018,"Comparative medicine",NA,NA,NA,3,"2021-01-12 11:43:03","Journal Article","","1532-0820",NA,68,1,63,73,0,0,0,14,3,"Here we present the results of experiments involving cynomolgus macaques, in which a model of traumatic spinal cord injury (TSCI) was created by using a balloon catheter inserted into the epidural space. Prior to the creation of the lesion, we inserted an EMG recording device to facilitate measurement of tail movement and muscle activity before and after TSCI. This model is unique in that the impairment is limited to the tail: the subjects do not experience limb weakness, bladder impairment, or bowel dysfunction. In addition, 4 of the 6 subjects received a combination treatment comprising thyrotropin releasing hormone, selenium, and vitamin E after induction of experimental TSCI. The subjects tolerated the implantation of the recording device and did not experience adverse effects due the medications administered. The EMG data were transformed into a metric of volitional tail moment, which appeared to be valid measure of initial impairment and subsequent natural or treatment-related recovery. The histopathologic assessment demonstrated widespread axon loss at the site of injury and areas cephalad and caudad. Histopathology revealed evidence of continuing inflammation, with macrophage activation. The EMG data did not demonstrate evidence of a statistically significant treatment effect.","vitamin_e"
"4",0,"Parastoo Mojtahed Zadeh-Ardabili, Sima Kianpour Rad, Soheila Kianpour Rad, Huzwah Khazaài, Junedah Sanusi, Musa-Al-Reza Haji Zadeh","Palm vitamin E reduces locomotor dysfunction and morphological changes induced by spinal cord injury and protects against oxidative damage.",2017,"Scientific reports",NA,NA,NA,4,"2021-01-12 11:43:03","Journal Article","10.1038/s41598-017-14765-3","2045-2322",NA,7,1,14365,NA,0,0,0,6,4,"Spinal cord injury (SCI) occurs following different types of crushes. External and internal outcomes of SCI are including paralysis, cavity, and cyst formation. Effects of dietary derived antioxidants, such as palm vitamin E on central nervous system (CNS) encourage researchers to focus on the potential therapeutic benefits of antioxidant supplements. In the present study, experiments were carried out to evaluate the neuro-protective effect of the palm vitamin E on locomotor function and morphological damages induced SCI. Seventy-two male rats (Sprague-Dawley) were randomly divided into four groups: sham (laminectomy); control (supplemented with the palm vitamin E at a dose of 100 mg/kg/day); untreated-SCI (partial crush, 30-33% for 20 sec); treated-SCI (partial crush, 30-33% for 20 sec supplemented with the palm vitamin E at a dose of 100 mg/kg/day). The treatment with the palm vitamin E significantly improved the hind limb locomotor function, reduced the histopathological changes and the morphological damage in the spinal cord. Also, the palm vitamin E indicated a statistically significant decrease in the oxidative damage indicators, malondialdehyde (MDA) level and glutathione peroxidase (GPx) activity in the treated-SCI compared to the untreated-SCI.","vitamin_e"
"5",0,"H-C Chen, P-W Hsu, W-C Tzaan, A-W Lee","Effects of the combined administration of vitamins C and E on the oxidative stress status and programmed cell death pathways after experimental spinal cord injury.",2014,"Spinal cord",NA,NA,NA,5,"2021-01-12 11:43:03","Journal Article","10.1038/sc.2013.140","1476-5624",NA,52,1,24,28,0,0,0,4,7,"Experimental, controlled, animal study. To assess the effects of vitamins C and E (VCE) treatment on oxidative stress and programmed cell deaths after rat spinal cord injury (SCI), as well as functional recovery. Taiwan. Fifty-four Sprague-Dawley rats were used for the experimental procedure. In the sham group, laminectomy at T10 was performed, followed by impactor contusion of the spinal cord. In the control group, only a laminectomy was performed without contusion. Oxidative stress status was assessed by measuring the spinal cord tissue content of superoxide dismutase (SOD) and gluthatione peroxidase (GSH-Px) activities. We also evaluated the effects of combined VCE treatment using western blot to analyze expression of cleaved caspase-3 and microtubule-associated protein light chain 3 (LC3), and the Basso, Beattie and Bresnahan (BBB) scale to evaluate functional outcomes. Combined treatment of VCE significantly counteracted the effects of spinal cord contusion on oxidative stress represented by activities of SOD and GSH-Px (P<0.05). The VCE treatment also significantly enhanced LC3-II expression and decreased cleaved caspase-3 compared with the sham (P<0.05). Furthermore, BBB scores significantly improved in the VCE-treated group compared with the sham group (on day 14 and 28 after SCI; P<0.05). The combined administration of VCE was clearly capable of modulating the antioxidant effects, and of reducing apoptosis and increasing autophagy at the lesion epicenter leading to an improved functional outcome. Use of such clinically ready drugs could help earlier clinical trials in selected cases of human SCIs.","vitamin_e"
"6",0,"Mohamed D Morsy, Ossama A Mostafa, Waleed N Hassan","A potential protective effect of alpha-tocopherol on vascular complication in spinal cord reperfusion injury in rats.",2010,"Journal of biomedical science",NA,NA,NA,6,"2021-01-12 11:43:03","Journal Article","10.1186/1423-0127-17-55","1423-0127",NA,17,NA,55,NA,0,0,0,3,11,"Paraplegia remains a potential complication of spinal cord ischemic reperfusion injury (IRI) in which oxidative stress induced cyclooxygenase activities may contribute to ischemic neuronal damage. Prolonged administration of vitamin E (alpha-TOL), as a potent biological antioxidant, may have a protective role in this oxidative inflammatory ischemic cascade to reduce the incidence of paraplegia. The present study was designed to evaluate the preventive value of alpha-TOL in IRI of spinal cord. For this study, 50 male Sprague-Dawley rats were used and divided into five experimental groups (n = 10): Control group (C); alpha-TOL control group (CE) which received intramuscular (i.m.) alpha-TOL injections (600 mg/kg); Sham operated group (S), IRI rats were subjected to laparotomy and clamping of the aorta just above the bifurcation for 45 min, then the clamp was released for 48 hrs for reperfusion; and IRIE rats group, received 600 mg/kg of alpha-TOL i.m. twice weekly for 6 weeks, followed by induction of IRI similar to the IRI group. At the end of the experimental protocol; motor, sensory and placing/stepping reflex evaluation was done. Plasma nitrite/nitrate (NOx) was measured. Then animals' spinal cord lumbar segments were harvested and homogenized for measurement of the levels of prostaglandin E2 (PGE2), malondialdehyde (MDA) and advanced oxidation products (AOPP), while superoxide dismutase (SOD) and catalase (CAT) activity were evaluated. Induction of IRI in rats resulted in significant increases in plasma levels of nitrite/nitrate (p < 0.001) and spinal cord homogenate levels of PGE2, MDA, advanced oxidation protein products AOPP and SOD with significant reduction (p < 0.001) in CAT homogenate levels. Significant impairment of motor, sensory functions and placing/stepping reflex was observed with IRI induction in the spinal cord (p < 0.001). alpha-TOL administration in IRIE group significantly improved all the previously measured parameters compared with IRI group. alpha-TOL administration significantly prevents the damage caused by spinal cord IRI in rats with subsequent recovery of both motor and sensory functions. Alpha-tocopherol improves the oxidative stress level with subsequent reduction of the incidence of neurological deficits due to spinal cord IRI conditions.","vitamin_e"
"7",0,"K Al Moutaery, S Al Deeb, N Biary, C Morais, H Ahmad Khan, M Tariq","Effect of aluminum on neurological recovery in rats following spinal cord injury.",2000,"Journal of neurosurgery",NA,NA,NA,7,"2021-01-12 11:43:03","Journal Article","10.3171/spi.2000.93.2.0276","0022-3085",NA,93,2,276,282,0,0,0,6,21,"This investigation was undertaken to study the effect of aluminum on neurobehavioral, electrophysiological, structural, and biochemical changes in rats following spinal cord injury (SCI). Adult male Sprague-Dawley rats classified into different groups were given aluminum sulfate-dosed drinking water in the concentrations of 0%, 0.25%, 0.5% and 1%, respectively. After 30 days of aluminum treatment, the animals were subjected to spinal cord trauma. Laminectomy was performed at T7-8 in anesthetized rats, followed by placement of a compression plate (2.2 x 5 mm) loaded with a 35-g weight over the exposed spinal cord for 5 minutes. Control animals underwent the same surgical procedure, but the compression injury was not induced (sham). Postoperative neurological function was assessed using the inclined-plane test and by obtaining a modified Tarlov score and vocal/sensory score daily for 10 days. Electrophysiological changes were assessed using corticomotor evoked potentials, whereas pathological changes were assessed by light microscopy. The level of vitamin E in the spinal cord was measured as an index of antioxidant defense. The behavioral, biochemical, and histological analyses were performed in a blinded fashion. Analysis of results obtained in the behavioral studies revealed that the compression of spinal cord produced transient paraparesis in which a maximum motor deficit occurred at Day 1 following SCI and resolved over a period of 10 days. Administration of aluminum significantly impaired the recovery following SCI. Analysis of the results of the biochemical, electrophysiological, and histopathological studies also confirmed the deleterious effects of aluminum on recovery from SCI in rats.","vitamin_e"
"8",0,"T Fujimoto, T Nakamura, T Ikeda, Y Taoka, K Takagi","Effects of EPC-K1 on lipid peroxidation in experimental spinal cord injury.",2000,"Spine",NA,NA,NA,8,"2021-01-12 11:43:03","Journal Article","10.1097/00007632-200001010-00006","0362-2436",NA,25,1,24,29,0,0,0,5,21,"A study in which levels of lipid peroxidation were measured, the thiobarbituric acid-reactive substances were estimated in an experimental rat model, and the recovery was assessed. To ascertain the occurrence of thiobarbituric acid-reactive substances in the damaged spinal cord, and to investigate the effectiveness of a hydroxyl radical scavenger EPC-K1, a phosphate diester linkage of vitamins E and C, in attenuating the severity of spinal cord injury. Lipid peroxidation has been reported to play an important role in spinal cord injury. There is no report on the use of EPC-K1 to attenuate the severity of spinal cord injury in either animal or human studies. Spinal cord injury was induced by placing a 25-g weight on T12, and the animals were divided into six groups. Group 1 (sham) received only laminectomy. Group 2 (control) received spinal cord injury. Group 3 received EPC-K1 5 minutes before injury. Group 4 received it 5 minutes after injury. Group 5 received it 3 hours after injury. Group 6 received it five times, respectively: at 5 minutes, then 1, 2, 3, and 4 hours after injury. The levels of thiobarbituric acid-reactive substances were measured in the spinal cord, and the recovery was assessed. The thiobarbituric acid-reactive substances content increased after injury, with two peaks, at 1 and 4 hours. Concentration at the 4-hour peak was lower in nitrogen mustard-induced leukocytopenia rats than in the control rats. The EPC-K1 injection reduced thiobarbituric acid-reactive substances content at 1 and 4 hours after injury in Group 3 (respectively, 34.3% and 42.7% vs. control) and only that at 4 hours in Group 6 (24.9% vs. control). Motor function recovery and histologic findings were better in these two groups than in Group 2. Repeated injection of EPC-K1 attenuated the severity of spinal cord injury.","vitamin_e"
"9",0,"M Tariq, C Morais, P N Kishore, N Biary, S Al Deeb, K Al Moutaery","Neurological recovery in diabetic rats following spinal cord injury.",1998,"Journal of neurotrauma",NA,NA,NA,9,"2021-01-12 11:43:03","Journal Article","10.1089/neu.1998.15.239","0897-7151",NA,15,4,239,251,0,0,0,6,23,"This study was designed to assess the effect of spinal cord injury on neurobehavioral, electrophysiological, structural, and biochemical changes in normal and diabetic rats. Experimental diabetes was induced in Sprague-Dawley male rats (weighing 250-280 g) with streptozotocin (50 mg/kg i.p.). Eight weeks after the treatment with streptozotocin the animals were anaesthetized with chloral hydrate and laminectomy was performed at T 7-8 level leaving the dura intact. A compression plate (2.2 x 5.0 mm) loaded with a weight of 35 g was placed on the exposed spinal cord for 5 min. Postoperative neurological function was assessed using inclined plane test, modified Tarlov score, and vocal and sensory score daily for 10 days. Electrophysiological changes were assessed using somatosensory and corticomotor evoked-potentials. The animals were sacrificed at different time intervals and injured site of the spinal cord was analyzed for changes in vitamin E and glutathione levels (as markers of oxidative stress). Pathological changes in spinal cord were also studied using light microscopy. The data on neurobehavioral study clearly indicated that the compression of spinal cord produced highly significant neurological deficit and poor recovery in diabetic rats as compared to nondiabetic rats. Our histopathological and electrophysiological results also confirmed that diabetic animals are more susceptible to compressive spinal cord injury as compared to nondiabetic animals. A higher depletion of antioxidant defense markers (vitamin E and glutathione) was observed in diabetic rats as compared to nondiabetic rats. These results point toward the role of free radicals in poor recovery in diabetic rats following neurotrauma. Further studies are warranted to assess the neuroprotective potential of antioxidants to retard the secondary pathophysiological events following neurotrauma and to enhance the recovery.","vitamin_e"
"10",0,"E D Hall","Inhibition of lipid peroxidation in central nervous system trauma and ischemia.",1995,"Journal of the neurological sciences",NA,NA,NA,10,"2021-01-12 11:43:03","Journal Article","10.1016/0022-510x(95)00211-j","0022-510X",NA,134,NA,79,83,0,0,0,1,26,"A novel group of compounds, the 21-aminosteroids (""lazaroids""), have been designed that are potent inhibitors of oxygen free radical-induced, iron-catalyzed lipid peroxidation (LP) in microvascular and nervous tissue. One of these, tirilazad mesylate (U-74006F), has been selected for clinical evaluation as a cerebroprotective agent. In vitro studies suggest that tirilazad exerts its antioxidant activity by multiple mechanisms including: increasing membrane stability, scavenging of lipid peroxyl radicals, reducing LP-induced arachidonic acid release, decreased formation or scavenging of hydroxyl radicals, and maintenance of the levels of endogenous vitamin E. The major site of action appears to be the blood-brain barrier based upon its known localization in cerebrovascular endothelium and numerous studies showing an attenuation of subarachnoid hemorrhage (SAH), injury, and ischemia-induced blood-brain barrier permeability. Tirilazad has demonstrated neuroprotective efficacy in multiple preclinical models of spinal cord and head injury, SAH, and focal cerebral ischemia, as measured by a decrease in cerebral vasospasm, blood-brain barrier compromise, post-traumatic ischemia, edema, ischemic neuronal necrosis and infarction, and improved neurological recovery. This efficacy is correlated with a reduction in markers of oxygen radical-induced LP. Phase III clinical trials are currently ongoing in spinal cord and head injury, SAH, and ischemic stroke. Initial results from a European/Australian/New Zealand trial in SAH have shown a significant decrease in mortality and an increase in the incidence of good recovery.","vitamin_e"
"11",0,"E D Hall, P A Yonkers, P K Andrus, J W Cox, D K Anderson","Biochemistry and pharmacology of lipid antioxidants in acute brain and spinal cord injury.",1992,"Journal of neurotrauma",NA,NA,NA,11,"2021-01-12 11:43:03","Journal Article","","0897-7151",NA,9,NA,NA,NA,0,0,0,5,29,"Oxygen radical-mediated lipid peroxidation (LP) has been suggested increasingly to be an important factor in posttraumatic neuronal degeneration. Thus, numerous studies have evaluated the neuroprotective efficacy of pharmacological agents with lipid antioxidant activity in models of spinal cord and brain injury. Intensive pretreatment of animals with the endogenous lipid peroxyl radical scavenger vitamin E (i.e., alpha-tocopherol) has been shown to decrease posttraumatic spinal cord ischemia and to enhance chronic neurological recovery. However, the slow CNS tissue uptake of vitamin E requires chronic dosing, making it an impractical agent for treatment of acute neural injury. The glucocorticoid steroid, methyl-prednisolone (MP), has been shown to possess significant antioxidant efficacy and, when administered to animals or humans in antioxidant doses, improves chronic neurological recovery after spinal cord injury. This activity of MP is independent of the steroid's glucocorticoid receptor-mediated actions, as evidenced by the efficacy of the novel antioxidant 21-aminosteroids, which are devoid of glucocorticoid activity but have greater antioxidant efficacy than MP. One of these, tirilazad mesylate (U-74006F), has been shown to be effective in animal models of brain and spinal cord injury and is currently the subject of phase II clinical trials. Recently, compounds that combine the amino functionality of the 21-amino-steroids with the peroxyl radical scavenging chromanol portion of vitamin E (i.e., 2-methylaminochromans) also have shown promise as neuroprotective agents. The consistent benefit afforded by antioxidant compounds further supports the concept that LP is an important therapeutic target for acute pharmacological neuroprotection.","vitamin_e"
"12",0,"E D Hall, J M Braughler, J M McCall","Antioxidant effects in brain and spinal cord injury.",1992,"Journal of neurotrauma",NA,NA,NA,12,"2021-01-12 11:43:03","Journal Article","","0897-7151",NA,9,NA,NA,NA,0,0,0,3,29,"Oxygen radical-mediated lipid peroxidation appears to be a critical factor in posttraumatic neuronal degeneration. Thus, numerous studies have evaluated the neuroprotective efficacy of pharmacologic agents with lipid antioxidant activity in models of spinal cord and brain injury. Intensive pretreatment of animals with the endogenous lipid peroxyl radical scavenger alpha tocopherol (i.e., vitamin E) has been shown to decrease posttraumatic spinal cord ischemia and to enhance chronic neurologic recovery. However, the slow CNS tissue uptake of vitamin E requires chronic dosing, making it an impractical agent for the treatment of acute neural injury. The glucocorticoid steroid methylprednisolone has been shown to possess significant antioxidant efficacy and, when administered to animals or humans in antioxidant dosages, improves chronic neurologic recovery after spinal cord injury. This activity of methylprednisolone is independent of the steroid's glucocorticoid receptor-mediated actions. Novel antioxidant 21-aminosteroids have been developed that are devoid of glucocorticoid activity but have greater antioxidant efficacy than methylprednisolone. One of these, U74006F or tirilazed mesylate, has been shown to be effective in animal models of brain and spinal cord injury and is currently undergoing phase II clinical trials. Compounds that combine the amino functionality of the 21-aminosteroids with the peroxyl radical scavenging chromanol portion of vitamin E (i.e., 2-methylaminochromans) have also recently shown promise as neuroprotective agents. The consistent benefit afforded by antioxidant compounds adds further support to the concept that lipid peroxidation is an important therapeutic target for acute pharmacologic neuroprotection.","vitamin_e"
