"","Cites","Authors","Title","Year","Source","Publisher","ArticleURL","CitesURL","GSRank","QueryDate","Type","DOI","ISSN","CitationURL","Volume","Issue","StartPage","EndPage","ECC","CitesPerYear","CitesPerAuthor","AuthorCount","Age","Abstract","generic_drug_name"
"1",0,"Maria Eduarda Baier, Nelson Junior Tagliari, Bruna Zafalon da Silva, Paula Cristina Sieczkowski Gonzalez, Marcelo Meller Alievi, Eduardo Raposo Monteiro","Anesthetic Management of an Orange-Spined-Hairy-Dwarf-Porcupine (Sphiggurus villosus) Undergoing Myelography",2016,"Acta Scientiae Veterinariae","Univ Fed Rio Grande Do Sul",NA,NA,22,"2021-01-16 16:09:44","Article","","1678-0345",NA,44,NA,NA,NA,0,0,0,6,5,"Background: The orange-spined hairy dwarf porcupine (Sphiggurus villosus) is a mammal that belongs to the rodentia order. Accidents involving this porcupine and dogs have become usual in some cities of Brazil. Dog bites may eventually result in spinal injuries. When there is clinical evidence of spinal cord injury, a myelography under general anesthesia may be required to allow identification of the exact location of the injury. To the authors' knowledge, there is only one case report about anesthesia in Sphiggurus villosus where dissociative anesthesia was employed. This paper describes one case report of inhalation anesthesia with isoflurane in a Sphiggurus villosus undergoing myelography.","isoflurane"
"2",1,"Ahmed A. Toreih, Asser A. Sallam, Cherif M. Ibrahim, Ahmed I. Maaty, Mohsen M. Hassan","Intercostal, ilioinguinal, and iliohypogastric nerve transfers for lower limb reinnervation after spinal cord injury: an anatomical feasibility and experimental study",2019,"Journal Of Neurosurgery-Spine","Amer Assoc Neurological Surgeons",NA,NA,21,"2021-01-16 16:09:44","Article","10.3171/2018.8.SPINE181","1547-5654",NA,30,2,268,278,1,0.5,0,5,2,"OBJECTIVE Spinal cord injury (SCI) has been investigated in various animal studies. One promising therapeutic approach involves the transfer of peripheral nerves originating above the level of injury into those originating below the level of injury. The purpose of the present study was to evaluate the feasibility of nerve transfers for reinnervation of lower limbs in patients suffering SCI to restore some hip and knee functions, enabling them to independently stand or even step forward with assistive devices and thus improve their quality of life.","isoflurane"
"3",2,"Marshall T. Bell, T. Brett Reece, Phillip D. Smith, Joshua Mares, Michael J. Weyant, Joseph C. Cleveland, Kirsten A. Freeman, David A. Fullerton, Ferenc Puskas","Reproducable Paraplegia by Thoracic Aortic Occlusion in a Murine Model of Spinal Cord Ischemia-reperfusion",2014,"Jove-Journal Of Visualized Experiments","Journal Of Visualized Experiments",NA,NA,20,"2021-01-16 16:09:44","Article","10.3791/50910","1940-087X",NA,NA,85,NA,NA,2,0.29,0,9,7,"Background","isoflurane"
"4",3,"M. Manthou, K. Nohroudi, S. Moscarino, F. Rehberg, G. Stein, R. Jansen, D. Abdulla, P. Jaminet, O. Semler, E. Schoenau, D. N. Angelov","Functional recovery after experimental spinal cord compression and whole body vibration therapy requires a balanced revascularization of the injured site",2015,"Restorative Neurology And Neuroscience","Ios Press",NA,NA,19,"2021-01-16 16:09:44","Article","10.3233/RNN-140434","0922-6028",NA,33,2,233,249,3,0.5,0,11,6,"Purpose: Based on several positive effects of whole-body-vibration (WBV) therapy on recovery after SCI, we looked for correlations between functional (analysis of locomotion), electrophysiological (H-reflex) and morphological (density of functioning capillaries) measurements after SCI and WBV-treatment.","isoflurane"
"5",5,"Jukka Kortelainen, Ashwati Vipin, Thow Xin Yuan, Hasan Mir, Nitish Thakor, Hasan Al-Nashash, Angelo All","Effect of isoflurane on somatosensory evoked potentials in a rat model",2014,"2014 36th Annual International Conference Of The Ieee Engineering In Medicine And Biology Society (Embc)","Ieee",NA,NA,18,"2021-01-16 16:09:44","Proceedings Paper","","1557-170X",NA,NA,NA,4286,4289,5,0.71,1,7,7,"Somatosensory evoked potentials (SEPs) are widely used in the clinic as well as research to study the functional integrity of the different parts of sensory pathways. However, most general anesthetics, such as isoflurane, are known to suppress SEPs, which might affect the interpretation of the signals. In animal studies, the usage of anesthetics during SEP measurements is inevitable due to which detailed effect of these drugs on the recordings should be known. In this paper, the effect of isoflurane on SEPs was studied in a rat model. Both time and frequency properties of the cortical recordings generated by stimulating the tibial nerve of rat's hindlimb were investigated at three different isoflurane levels. While the anesthetic agent is shown to generally suppress the amplitude of the SEP, the effect was found to be nonlinear influencing more substantially the latter part of waveform. This finding will potentially help us in future work aiming at separating the effects of anesthetics on SEP from those due to injury in the ascending neural pathways.","isoflurane"
"6",6,"TE GRISSOM, HC MITZEL, L BUNEGIN, MS ALBIN","THE EFFECT OF ANESTHETICS ON NEUROLOGIC OUTCOME DURING THE RECOVERY PERIOD OF SPINAL-CORD INJURY IN RATS",1994,"Anesthesia And Analgesia","Williams & Wilkins",NA,NA,17,"2021-01-16 16:09:44","Article","","0003-2999",NA,79,1,66,74,6,0.22,2,4,27,"We evaluated the effects of anesthetics on neurologic outcome in a model of recoverable experimental spinal cord injury (SCI). Adult rats were implanted with various sizes of hygroscopic plastic material at the T12 spinal level to determine the dimensions that would produce a progressive neurologic deficit from which recovery could occur. Neurologic evaluation was conducted on an inclined plane, noting the maximum angle at which an animal was able to maintain orientation perpendicular to the longitudinal midline. Scores were statistically modeled for each group to develop profiles of neurologic deficits. Rats were subjected to a 4-h exposure to isoflurane, fentanyl/nitrous oxide, or ketamine 7 or 8 days postimplantation. Neurologic outcomes were compared to a SCI reference group which received no postimplant anesthesia. An animal weight/desiccated implant volume (W-a/V-i) ratio of 53 to 73 g/mm(3) produced postimplant neurologic deficits which deteriorated to near maximum within 3 days, followed by a gradual improvement beginning at Day 8 and returning to near normal between 22 and 25 days. Final outcome was based on modeled ramp scores for each group and reported in degrees +/- SD: reference, 71.2 +/- 1.1; fentanyl/N2O, 70.4 +/- 0.3; isoflurane, 72.6 +/- 1.1; and ketamine, 64.9 +/- 0.6. The fentanyl group attained maximum recovery first (P > 0.05) but did not recover to a level different on the average from the reference group. The ketamine group demonstrated a poorer (P > 0.05) recovery level relative to the other anesthetic protocols.","isoflurane"
"7",10,"Andres Hurtado, Alexander Marcillo, Beata Frydel, Mary Bartlett Bunge, Helen M. Bramlett, W. Dalton Dietrich","Anti-CD11d monoclonal antibody treatment for rat spinal cord compression injury",2012,"Experimental Neurology","Academic Press Inc Elsevier Science",NA,NA,15,"2021-01-16 16:09:44","Article","10.1016/j.expneurol.2010.11.015","0014-4886",NA,233,2,606,611,10,1.11,2,6,9,"This study was initiated due to an NIH ""Facilities of Research-Spinal Cord Injury"" contract to support independent replication of published studies. Transient blockage of the CD11d/CD18 integrin has been reported to reduce secondary neuronal damage as well as to improve functional recovery after spinal cord injury (SCI) in rats. The purpose of this study was to determine whether treatment with an anti-CD11d monoclonal antibody (mAb) would improve motor performance, reduce pain and histopathological damage in animals following clip-compression injury as reported. Adult male Wistar rats (250 g) were anesthetized with isoflurane, and the T12 spinal cord exposed by T10 and T11 dorsal laminectomies followed by a 60 s period of clip compression utilizing a 35 g clip. Control animals received an isotype-matched irrelevant antibody (1B7) while the treated group received the anti-CD11d mAb (217 L; 1.0 mg/kg) systemically. Open-field locomotion and sensory function were assessed and animals were perfusion-fixed at twelve weeks after injury for quantitative histopathological analysis. As compared to 1B7, 217 L treated animals showed an overall non-significant trend to better motor recovery. All animals showed chronic mechanical allodynia and anti-CD11d mAb treatment did not significantly prevent its development. Histopathological analysis demonstrated severe injury to gray and white matter after compression with a non-significant trend in anti-CD11d protection compared to control animals for preserved myelin. Although positive effects with the anti-CD11d mAb treatment have been reported after compressive SCI, it is suggested that this potential treatment requires further investigation before clinical trials in spinal cord injured patients are implemented. (C) 2010 Elsevier Inc. All rights reserved.","isoflurane"
"8",10,"Tatiana Bezdudnaya, Kristiina M. Hormigo, Vitaliy Marchenko, Michael A. Lane","Spontaneous respiratory plasticity following unilateral high cervical spinal cord injury in behaving rats",2018,"Experimental Neurology","Academic Press Inc Elsevier Science",NA,NA,16,"2021-01-16 16:09:44","Article","10.1016/j.expneurol.2018.03.014","0014-4886",NA,305,NA,56,65,10,3.33,3,4,3,"Unilateral cervical C2 hemisection (C2Hx) is a classic model of spinal cord injury (SCI) for studying respiratory dysfunction and plasticity. However, most previous studies were performed under anesthesia, which significantly alters respiratory network. Therefore, the goal of this work was to assess spontaneous diaphragm recovery post-C2Hx in awake, freely behaving animals. Adult rats were chronically implanted with diaphragm EMG electrodes and recorded during 8 weeks post-C2Hx. Our results reveal that ipsilateral diaphragm activity partially recovers within days post-injury and reaches pre-injury amplitude in a few weeks. However, the full extent of spontaneous ipsilateral recovery is significantly attenuated by anesthesia (ketamine/xylazine, isoflurane, and urethane). This suggests that the observed recovery may be attributed in part to activation of NMDA receptors which are suppressed by anesthesia. Despite spontaneous recovery in awake animals, ipsilateral hemidiaphragm dysfunction still persists: i) Inspiratory bursts during basal (slow) breathing exhibit an altered pattern, ii) the amplitude of sighs or augmented breaths is significantly decreased, and iii) the injured hemidiaphragm exhibits spontaneous events of hyperexcitation. The results from this study offer an under appreciated insight into spontaneous diaphragm activity and recovery following high cervical spinal cord injury in awake animals.","isoflurane"
"9",11,"J. Sedy, K. Likavcanova, L. Urdzikova, J. Zicha, J. Kunes, A. Hejcl, P. Jendelova, E. Sykova","Low degree of anesthesia increases the risk of neurogenic pulmonary edema development",2008,"Medical Hypotheses","Churchill Livingstone",NA,NA,13,"2021-01-16 16:09:44","Article","10.1016/j.mehy.2007.05.031","0306-9877",NA,70,2,308,313,11,0.85,1,8,13,"Neurogenic pulmonary edema is an acute life-threatening complication following central nervous system injury. The exact pathogenic mechanism leading to its development is still unclear. We introduce a new hypothesis that high levels of anesthesia might protect the organism against the development of neurogenic pulmonary edema due to a more pronounced inhibition of the hypothalamic, brainstem and spinal vasoactive sympathetic centers. On the basis of a more pronounced neuronal inhibition of the vasoactive centers, a severe sympathetic discharge does not occur and neurogenic pulmonary edema does not develop. In contrast, an insufficient anesthesia level is not able to inhibit the sympathetic nervous system during an injury of the central nervous system and thus neurogenic pulmonary edema develops. During experiments with central nervous system injury, low-anesthesia-induced neurogenic pulmonary edema might negatively influence the overall recovery of the animal. More importantly, during a neurosurgical intervention, insufficient anesthesia might similarly lead to neurogenic pulmonary edema development in operated patients. Our hypothesis indicates the necessity of precisely monitoring of the level anesthesia during experimental manipulations of the central nervous system in animals or neurosurgical interventions in humans. (C) 2007 Elsevier Ltd. All rights reserved.","isoflurane"
"10",12,"Pradeep Tyagi, Katsumi Kadekawa, Mahendra Kashyap, Subrata Pore, Naoki Yoshimura","Spontaneous Recovery of Reflex Voiding Following Spinal Cord Injury Mediated by Anti-inflammatory and Neuroprotective Factors",2016,"Urology","Elsevier Science Inc",NA,NA,14,"2021-01-16 16:09:44","Article","10.1016/j.urology.2015.10.017","0090-4295",NA,88,NA,57,65,12,2.4,2,5,5,"OBJECTIVE To investigate the time-dependent changes in expression of cytokines that characterizes the spontaneous recovery of reflex voiding after spinal cord injury (SCI). SCI is known to reorganize the neural circuitry of micturition reflex after injury.","isoflurane"
"11",13,"Yvette S. Nout, Michael S. Beattie, Jacqueline C. Bresnahan","Severity of Locomotor and Cardiovascular Derangements after Experimental High-Thoracic Spinal Cord Injury Is Anesthesia Dependent in Rats",2012,"Journal Of Neurotrauma","Mary Ann Liebert, Inc",NA,NA,12,"2021-01-16 16:09:44","Article","10.1089/neu.2011.1845","0897-7151",NA,29,5,990,999,13,1.44,4,3,9,"Anesthetics affect outcomes from central nervous system (CNS) injuries differently. This is the first study to show how two commonly used anesthetics affect continuously recorded hemodynamic parameters and locomotor recovery during a 2-week period after two levels of contusion spinal cord injury (SCI) in rats. We hypothesized that the level of cardiovascular depression and recovery of locomotor function would be dependent upon the anesthetic used during SCI. Thirty-two adult female rats were subjected to a sham, 25-mm or 50-mm SCI at T3-4 under pentobarbital or isoflurane anesthesia. Mean arterial pressure (MAP) and heart rate (HR) were telemetrically recorded before, during, and after SCI. Locomotor function recovered best in the 25-mm-injured isoflurane-anesthetized animals. There was no significant difference in locomotor recovery between the 25-mm-injured pentobarbital-anesthetized animals and the 50-mm-injured isoflurane-anesthetized animals. White matter sparing and extent of intermediolateral cell column loss appeared larger in animals anesthetized with pentobarbital, but this was not significant. There were no differential effects of anesthetics on HR and MAP before SCI, but recovery from anesthesia was significantly slower in pentobarbital-anesthetized animals. At the time of SCI, MAP was acutely elevated in the pentobarbital-anesthetized animals, whereas MAP decreased in the isoflurane-anesthetized animals. Hypotension occurred in the pentobarbital-anesthetized groups and in the 50-mm-injured isoflurane-anesthetized group. In pentobarbital-anesthetized animals, SCI resulted in acute elevation of HR, although HR remained low. Return of HR to baseline was much slower in the pentobarbital-anesthetized animals. Severe SCI at T3 produced significant chronic tachycardia that was injury severity dependent. Although some laboratories monitor blood pressure, HR, and other physiological variables during surgery for SCI, inherently few have monitored cardiovascular function during recovery. This study shows that anesthetics affect hemodynamic parameters differently, which in turn can affect functional outcome measures. This supports the need for a careful evaluation of cardiovascular and other physiological measures in experimental models of SCI. Choice of anesthetic should be an important consideration in experimental designs and data analyses.","isoflurane"
"12",16,"SL Jinks, CL Dominguez, JF Antognini","Drastic decrease in isoflurane minimum alveolar concentration and limb movement forces after lboracic spinal cooling and chronic spinal transection in rats",2005,"Anesthesiology","Lippincott Williams & Wilkins",NA,NA,10,"2021-01-16 16:09:44","Article","10.1097/00000542-200503000-00022","0003-3022",NA,102,3,624,632,16,1,5,3,16,"Background. Individuals with spinal cord injury may undergo multiple surgical procedures; however, it is not clear how spinal cord injury affects anesthetic requirements and movement force under anesthesia during both acute and chronic stages of the injury.","isoflurane"
"13",16,"Shrivats Iyer, Anil Maybhate, Alessandro Presacco, Angelo H. All","Multi-limb acquisition of motor evoked potentials and its application in spinal cord injury",2010,"Journal Of Neuroscience Methods","Elsevier Science Bv",NA,NA,11,"2021-01-16 16:09:44","Article","10.1016/j.jneumeth.2010.08.017","0165-0270",NA,193,2,210,216,16,1.45,4,4,11,"The motor evoked potential (MEP) is an electrical response of peripheral neuro-muscular pathways to stimulation of the motor cortex MEPs provide objective assessment of electrical conduction through the associated neural pathways and therefore detect disruption due to a nervous system injury such as spinal cord injury (SCI)","isoflurane"
"14",17,"Stephen C. D'Amico, Isaiah P. Schuster, III Collins, William F.","Quantification of external urethral sphincter and bladder activity during micturition in the intact and spinally transected adult rat",2011,"Experimental Neurology","Academic Press Inc Elsevier Science",NA,NA,8,"2021-01-16 16:09:44","Article","10.1016/j.expneurol.2010.12.008","0014-4886",NA,228,1,59,68,17,1.7,6,3,10,"The goal of this study was to determine the effect of chronic mid-thoracic spinal cord transection on the time course of external urethral sphincter (BUS) and bladder activity associated with micturition events in the rat. Adult female Sprague-Dawley rats, either spinally intact or transected (T-9-T-10), were anesthetized with urethane and set up for continuous flow urodynamic recording of bladder intravesical pressure (BP) and EUS electromyography (EMG). Spinal transections were performed under isoflurane anesthesia 1-8 weeks prior to the terminal experiment. Four major differences between intact and transected rats were observed: 1) While the frequency of micturition events in the intact rat was dependent upon the rate of bladder filling, the bladder contraction and associated EUS activation in transected rats exhibited an intrinsic rhythm that was independent of the rate of bladder filling and post-transection survival time. 2) EUS activation was augmented at the beginning of active bladder contraction in the transected rat, indicating an amplified guarding reflex. 3) Phasic EUS activity at the peak of bladder contraction (EUS bursting) in the intact rat was markedly reduced or absent in the transected rat. 4) The sustained tonic EUS activity following bladder relaxation in the intact rat was absent in the transected rat. These data are discussed in the context of understanding the pathophysiology of spinal cord injury (SCI) induced destrusor-sphincter dyssynergia (DSD). (C) 2010 Elsevier Inc. All rights reserved.","isoflurane"
"15",18,"WAC MUTCH, MR GRAHAM, WC HALLIDAY, DB THIESSEN, LG GIRLING","USE OF NEUROANESTHESIA ADJUNCTS (HYPERVENTILATION AND MANNITOL ADMINISTRATION) IMPROVES NEUROLOGICAL OUTCOME AFTER THORACIC AORTIC CROSS-CLAMPING IN DOGS",1993,"Stroke","Lippincott Williams & Wilkins",NA,NA,9,"2021-01-16 16:09:44","Article","10.1161/01.STR.24.8.1204","0039-2499",NA,24,8,1204,1211,18,0.64,4,5,28,"Background and Purpose: Using a canine model of thoracic aortic cross-clamping, we compared the incidence and severity of paraplegia with and without standard neuroanesthesia adjuncts (mannitol administration and deliberate hyperventilation). Better outcome was predicted for animals treated with mannitol and hyperventilation.","isoflurane"
"16",23,"Safraaz Mahamed, Kristi A. Strey, Gordon S. Mitchell, Tracy L. Baker-Herman","Reduced respiratory neural activity elicits phrenic motor facilitation",2011,"Respiratory Physiology & Neurobiology","Elsevier",NA,NA,7,"2021-01-16 16:09:44","Article","10.1016/j.resp.2010.12.005","1569-9048",NA,175,3,303,309,23,2.3,6,4,10,"We hypothesized that reduced respiratory neural activity elicits compensatory mechanisms of plasticity that enhance respiratory motor output. In urethane-anesthetized and ventilated rats, we reversibly reduced respiratory neural activity for 25-30 min using: hypocapnia (end tidal CO2=30 mmHg), isoflurane (similar to 1%) or high frequency ventilation (HFV; similar to 100 breaths/min). In all cases, increased phrenic burst amplitude was observed following restoration of respiratory neural activity (hypocapnia: 92+/-22%; isoflurane: 65+/-22%; HFV: 54+/-13% baseline), which was significantly greater than time controls receiving the same surgery, but no interruptions in respiratory neural activity (3+/-5% baseline, p < 0.05). Hypocapnia also elicited transient increases in respiratory burst frequency (9+/-2 versus 1+/-1 bursts/min, p < 0.05). Our results suggest that reduced respiratory neural activity elicits a unique form of plasticity in respiratory motor control which we refer to as inactivity-induced phrenic motor facilitation (iPMF). iPMF may prevent catastrophic decreases in respiratory motor output during ventilatory control disorders associated with abnormal respiratory activity. (C) 2011 Elsevier B.V. All rights reserved.","isoflurane"
"17",28,"Brian T. David, Oswald Steward","Deficits in bladder function following spinal cord injury vary depending on the level of the injury",2010,"Experimental Neurology","Academic Press Inc Elsevier Science",NA,NA,6,"2021-01-16 16:09:44","Article","10.1016/j.expneurol.2010.08.014","0014-4886",NA,226,1,128,135,28,2.55,14,2,11,"Loss of bladder function is an important consequence of a spinal cord injury (SCI) but is rarely assessed in animal studies of SCI. Here, we use a simple outcome measure (volume of retained urine) to assess bladder dysfunction over time following moderate contusion injuries at 3 different thoracic levels (T1. T4, or T9) and complete crush injuries (T1 vs. T9). The volume of urine retained in the bladder was measured daily for fourteen days post injury by anesthetizing the animals with isoflurane, expressing the bladder, and weighing the urine. To compare bladder deficits with the degree of impairment of hindlimb motor function, locomotion was assessed using the BBB open field rating scale. Rats with contusions at T4 and T9 exhibited bladder impairments reflected by increased urine retention from 1 to 12 days post injury. In contrast, rats with contusions at T1 exhibited minimal deficits (smaller volumes of retained urine). Lesion size and overall functional impairment were comparable between groups based on quantitative assessments of lesion area at the epicenter and BBB locomotor scores. Moreover, a sector analysis of sparing of different portions of the white matter revealed no differences in sparing of different funiculi between the groups. Injections of Fluorogold into lumbar segments led to retrograde labeling of a larger number of neurons in the pontine micturition center (PMC) following T1 injury when compared to T4 or T9. Thus, moderate contusion lesions at T1 spare a critical descending pathway able to mediate at least reflex voiding in rats. (C) 2010 Elsevier Inc. All rights reserved.","isoflurane"
"18",31,"Jiri Sedy, Lucia Urdzikova, Katarina Likavcanova, Ales Hejcl, Martin Burian, Pavla Jendelova, Josef Zicha, Jaroslav Kunes, Eva Sykova","Low concentration of isoflurane promotes the development of neurogenic pulmonary edema in spinal cord injured rats",2007,"Journal Of Neurotrauma","Mary Ann Liebert, Inc",NA,NA,5,"2021-01-16 16:09:44","Article","10.1089/neu.2006.0252","0897-7151",NA,24,9,1487,1501,31,2.21,3,9,14,"yAnesthetics can either promote or inhibit the development of neurogenic pulmonary edema (NPE) after central nervous system (CNS) injury. The influence of isoflurane was examined in male Wistar rats using 1.5%, 2%, 2.5%, 3%, 4%, or 5% isoflurane in air. Epidural balloon compression of the thoracic spinal cord was performed. The development of NPE was examined in vivo and on histologic sections of lung tissue. Animals anesthetized with 1.5% or 3% isoflurane were behaviorally monitored using the BBB and plantar tests for 7 weeks post-injury. The spinal cord was examined using MRI and morphometry of the spared white and gray matter. All animals from the 1.5% and 2% groups developed NPE. Almost 42% of the animals in the 1.5% group died of severe pulmonary hemorrhage and suffocation; x-rays, the pulmonary index, and the histological picture revealed a massive NPE. More than 71% of the animals from the 2.5% and 3% groups did not develop any signs of NPE. Blood pressure after spinal cord compression rose more in the 1.5% group than in the 3% one. In the 1.5% group, the sympathetic ganglionic blockade prevented the neurogenic pulmonary edema development. Animals from the 3% group recovered behaviorally more rapidly than did the animals from the 1.5% group; morphometry and MRI of the lesions showed no differences. Thus, low levels of isoflurane anesthesia promote NPE in rats with a compressed spinal cord and significantly complicates their recovery. The optimal concentration of anesthesia for performing a spinal cord compression lesion is 2.5-3% isoflurane in air.","isoflurane"
