"","Cites","Authors","Title","Year","Source","Publisher","ArticleURL","CitesURL","GSRank","QueryDate","Type","DOI","ISSN","CitationURL","Volume","Issue","StartPage","EndPage","ECC","CitesPerYear","CitesPerAuthor","AuthorCount","Age","Abstract","generic_drug_name"
"28",38,"Siew-Na Lim, Wenlong Huang, Jodie C. E. Hall, Adina T. Michael-Titus, John V. Priestley","Improved outcome after spinal cord compression injury in mice treated with docosahexaenoic acid",2013,"Experimental Neurology","Academic Press Inc Elsevier Science",NA,NA,9,"2021-01-18 10:51:39","Article","10.1016/j.expneurol.2012.09.015","0014-4886",NA,239,NA,13,27,38,4.75,8,5,8,"In this study we have characterised the locomotor recovery, and temporal profile of cell loss, in a novel thoracic compression spinal cord injury (SCI) in the mouse. We have also shown that treatment with docosahexaenoic acid (DHA) is neuroprotecdve in this model of SCI, strengthening the growing literature demonstrating that omega-3 polyunsaturated fatty adds are neuroprotective after SCI.","omega3"
"29",40,"Elisa Bisicchia, Valeria Sasso, Giuseppina Catanzaro, Alessandro Leuti, Zein Mersini Besharat, Martina Chiacchiarini, Marco Molinari, Elisabetta Ferretti, Maria Teresa Viscomi, Valerio Chiurchiu","Resolvin D1 Halts Remote Neuroinflammation and Improves Functional Recovery after Focal Brain Damage Via ALX/FPR2 Receptor-Regulated MicroRNAs",2018,"Molecular Neurobiology","Springer",NA,NA,11,"2021-01-18 10:51:39","Article","10.1007/s12035-018-0889-z","0893-7648",NA,55,8,6894,6905,40,13.33,4,10,3,"Remote damage is a secondary phenomenon that usually occurs after a primary brain damage in regions that are distant, yet functionally connected, and that is critical for determining the outcomes of several CNS pathologies, including traumatic brain and spinal cord injuries. The understanding of remote damage-associated mechanisms has been mostly achieved in several models of focal brain injury such as the hemicerebellectomy (HCb) experimental paradigm, which helped to identify the involvement of many key players, such as inflammation, oxidative stress, apoptosis and autophagy. Currently, few interventions have been shown to successfully limit the progression of secondary damage events and there is still an unmet need for new therapeutic options. Given the emergence of the novel concept of resolution of inflammation, mediated by the newly identified omega 3-derived specialized pro-resolving lipid mediators, such as resolvins, we reported a reduced ability of HCb-injured animals to produce resolvin D1 (RvD1) and an increased expression of its target receptor ALX/FPR2 in remote brain regions. The in vivo administration of RvD1 promoted functional recovery and neuroprotection by reducing the activation of Iba-1+ microglia and GFAP+ astrocytes as well as by impairing inflammatory-induced neuronal cell death in remote regions. These effects were counteracted by intracerebroventricular neutralization of ALX/FPR2, whose activation by RvD1 also down-regulated miR-146b- and miR-219a-1-dependent inflammatory markers. In conclusion, we propose that innovative therapies based on RvD1-ALX/FPR2 axis could be exploited to curtail remote damage and enable neuroprotective effects after acute focal brain damage.","omega3"
"30",42,"J. D. Figueroa, K. Cordero, M. Serrano-Illan, A. Almeyda, K. Baldeosingh, F. G. Almaguel, M. De Leon","METABOLOMICS UNCOVERS DIETARY OMEGA-3 FATTY ACID-DERIVED METABOLITES IMPLICATED IN ANTI-NOCICEPTIVE RESPONSES AFTER EXPERIMENTAL SPINAL CORD INJURY",2013,"Neuroscience","Pergamon-Elsevier Science Ltd",NA,NA,8,"2021-01-18 10:51:39","Article","10.1016/j.neuroscience.2013.09.012","0306-4522",NA,255,NA,1,18,42,5.25,6,7,8,"Chronic neuropathic pain is a frequent comorbidity following spinal cord injury (SCI) and often fails to respond to conventional pain management strategies. Preventive administration of docosahexaenoic acid (DHA) or the consumption of a diet rich in omega-3 polyunsaturated fatty acids (O3PUFAs) confers potent prophylaxis against SCI and improves functional recovery. The present study examines whether this novel dietary strategy provides significant antinociceptive benefits in rats experiencing SCI-induced pain. Rats were fed control chow or chow enriched with O3PUFAs for 8 weeks before being subjected to sham or cord contusion surgeries, continuing the same diets after surgery for another 8 more weeks. The paw sensitivity to noxious heat was quantified for at least 8 weeks post-SCI using the Hargreaves test. We found that SCI rats consuming the preventive O3PUFA-enriched diet exhibited a significant reduction in thermal hyperalgesia compared to those consuming the normal diet. Functional neurometabolomic profiling revealed a distinctive deregulation in the metabolism of endocannabinoids (eCB) and related N-acyl ethanolamines (NAEs) at 8 weeks post-SCI. We found that O3PUFAs consumption led to a robust accumulation of novel NAE precursors, including the glycerophospho-containing docosahexaenoyl ethanolamine (DHEA), docosapentaenoyl ethanolamine (DPEA), and eicosapentaenoyl ethanolamine (EPEA). The tissue levels of these metabolites were significantly correlated with the antihyperalgesic phenotype. In addition, rats consuming the O3PUFA-rich diet showed reduced sprouting of nociceptive fibers containing CGRP and dorsal horn neuron p38 mitogen-activated protein kinase (MAPK) expression, well-established biomarkers of pain. The spinal cord levels of inositols were positively correlated with thermal hyperalgesia, supporting their role as biomarkers of chronic neuropathic pain. Notably, the O3PUFA-rich dietary intervention reduced the levels of these metabolites. Collectively, these results demonstrate the prophylactic value of dietary O3PUFA against SCI-mediated chronic pain. (C) 2013 The Authors. Published by Elsevier Ltd. All rights reserved.","omega3"
"31",50,"Adina T. Michael-Titus, John V. Priestly","Omega-3 fatty acids and traumatic neurological injury: from neuroprotection to neuroplasticity?",2014,"Trends In Neurosciences","Elsevier Science London",NA,NA,5,"2021-01-18 10:51:39","Review","10.1016/j.tins.2013.10.005","0166-2236",NA,37,1,30,38,50,7.14,25,2,7,"Omega-3 polyunsaturated fatty acids (PUFAs) are compounds that have a structural role in the nervous system and are essential for neurodevelopment. Results obtained with docosahexaenoic acid and eicosapentaenoic acid show therapeutic potential in neurotrauma. Traumatic brain injury (TBI) and spinal cord injury (SCI) can lead to major disability and have a significant socioeconomic cost. Thus, there is an unmet need for acute neuroprotection and for treatments that promote neuroregeneration. Acute administration of omega-3 PUFAs after injury and dietary exposure before or after injury improve neurological outcomes in experimental SCI and TBI. The mechanisms involved include decreased neuroinflammation and oxidative stress, neurotrophic support, and activation of cell survival pathways. This review raises questions that must be addressed before successful clinical translation.","omega3"
"32",50,"Ruben Lopez-Vales, Adriana Redensek, Thomas A. A. Skinner, Khizr I. Rathore, Nader Ghasemlou, Gabriella Wojewodka, Juan DeSanctis, Danuta Radzioch, Samuel David","Fenretinide Promotes Functional Recovery and Tissue Protection after Spinal Cord Contusion Injury in Mice",2010,"Journal Of Neuroscience","Soc Neuroscience",NA,NA,6,"2021-01-18 10:51:39","Article","10.1523/JNEUROSCI.5770-09.2010","0270-6474",NA,30,9,3220,3226,50,4.55,6,9,11,"The inflammatory response is thought to contribute to secondary damage after spinal cord injury (SCI). Polyunsaturated fatty acids (PUFAs) play an important role in the onset and resolution of inflammation. Arachidonic acid (AA), an omega-6 PUFA, contributes to the initiation of inflammatory responses, whereas docosahexaenoic acid (DHA), an omega-3 PUFA, has antiinflammatory effects. Therefore, decreasing AA and increasing DHA levels after SCI might be expected to attenuate inflammation after SCI and promote tissue protection and functional recovery. We show here that daily oral administration of fenretinide after spinal cord contusion injury led to a significant decrease in AA and an increase in DHA levels in plasma and injured spinal cord tissue. This was accompanied by a significant reduction in tissue damage and improvement in locomotor recovery. Fenretinide also reduced the expression of proinflammatory genes and the levels of oxidative stress markers after SCI. In addition, in vitro studies demonstrated that fenretinide reduced TNF-alpha (tumor necrosis factor-alpha) expression by reactive microglia. These results demonstrate that fenretinide treatment after SCI can reduce inflammation and tissue damage in the spinal cord and improve locomotor recovery. These beneficial effects may be mediated via the ability of fenretinide to modulate PUFA homeostasis. Since fenretinide is currently in clinical trials for the treatment of cancers, this drug might be a good candidate for the treatment of acute SCI in humans.","omega3"
"33",51,"Isaac Francos-Quijorna, Eva Santos-Nogueira, Karsten Gronert, Aaron B. Sullivan, Marcel A. Kopp, Benedikt Brommer, Samuel David, Jan M. Schwab, Ruben Lopez-Vales","Maresin 1 Promotes Inflammatory Resolution, Neuroprotection, and Functional Neurological Recovery After Spinal Cord Injury",2017,"Journal Of Neuroscience","Soc Neuroscience",NA,NA,7,"2021-01-18 10:51:39","Article","10.1523/JNEUROSCI.1395-17.2017","0270-6474",NA,37,48,11731,11743,51,12.75,6,9,4,"Resolution of inflammation is defective after spinal cord injury (SCI), which impairs tissue integrity and remodeling and leads to functional deficits. Effective pharmacological treatments for SCI are not currently available. Maresin 1 (MaR1) is a highly conserved specialized proresolving mediator (SPM) hosting potent anti-inflammatory and proresolving properties with potent tissue regenerative actions. Here, we provide evidence that the inappropriate biosynthesis of SPM in the lesioned spinal cord hampers the resolution of inflammation and leads to deleterious consequences on neurological outcome in adult female mice. We report that, after spinal cord contusion injury in adult female mice, the biosynthesis of SPM is not induced in the lesion site up to 2 weeks after injury. Exogenous administration of MaR1, a highly conserved SPM, propagated inflammatory resolution after SCI, as revealed by accelerated clearance of neutrophils and a reduction in macrophage accumulation at the lesion site. In the search of mechanisms underlying the proresolving actions of MaR1 in SCI, we found that this SPM facilitated several hallmarks of resolution of inflammation, including reduction of proinflammatory cytokines (CXCL1, CXCL2, CCL3, CCL4, IL6, and CSF3), silencing of major inflammatory intracellular signaling cascades (STAT1, STAT3, STAT5, p38, and ERK1/2), redirection of macrophage activation toward a prorepair phenotype, and increase of the phagocytic engulfment of neutrophils by macrophages. Interestingly, MaR1 administration improved locomotor recovery significantly and mitigated secondary injury progression in a clinical relevant model of SCI. These findings suggest that proresolution, immunoresolvent therapies constitute a novel approach to improving neurological recovery after acute SCI.","omega3"
"34",59,"Hongjian Pu, Yanling Guo, Wenting Zhang, Lanting Huang, Guohua Wang, Anthony K. Liou, Jia Zhang, Pengyue Zhang, Rehana K. Leak, Yun Wang, Jun Chen, Yanqin Gao","Omega-3 polyunsaturated fatty acid supplementation improves neurologic recovery and attenuates white matter injury after experimental traumatic brain injury",2013,"Journal Of Cerebral Blood Flow And Metabolism","Nature Publishing Group",NA,NA,4,"2021-01-18 10:51:39","Article","10.1038/jcbfm.2013.108","0271-678X",NA,33,9,1474,1484,59,7.38,6,12,8,"Dietary supplementation with omega-3 (omega-3) fatty acids is a safe, economical mean of preventive medicine that has shown protection against several neurologic disorders. The present study tested the hypothesis that this method is protective against controlled cortical impact (CCI). Indeed, mice fed with omega-3 polyunsaturated fatty acid (PUFA)-enriched diet for 2 months exhibited attenuated short and long-term behavioral deficits due to CCI. Although omega-3 PUFAs did not decrease cortical lesion volume, these fatty acids did protect against hippocampal neuronal loss after CCI and reduced pro-inflammatory response. Interestingly, omega-3 PUFAs prevented the loss of myelin basic protein (MPB), preserved the integrity of the myelin sheath, and maintained the nerve fiber conductivity in the CCI model. omega-3 PUFAs also directly protected oligodendrocyte cultures from excitotoxicity and blunted the microglial activation-induced death of oligodendrocytes in microglia/oligodendrocyte cocultures. In sum, omega-3 PUFAs elicit multifaceted protection against behavioral dysfunction, hippocampal neuronal loss, inflammation, and loss of myelination and impulse conductivity. The present report is the first demonstration that omega-3 PUFAs protect against white matter injury in vivo and in vitro. The protective impact of omega-3 PUFAs supports the clinical use of this dietary supplement as a prophylaxis against traumatic brain injury and other nervous system disorders.","omega3"
"35",69,"Irene Paterniti, Daniela Impellizzeri, Rosanna Di Paola, Emanuela Esposito, Stacy Gladman, Ping Yip, John V. Priestley, Adina T. Michael-Titus, Salvatore Cuzzocrea","Docosahexaenoic acid attenuates the early inflammatory response following spinal cord injury in mice: in-vivo and in-vitro studies",2014,"Journal Of Neuroinflammation","Bmc",NA,NA,3,"2021-01-18 10:51:39","Article","10.1186/1742-2094-11-6","",NA,11,NA,NA,NA,69,9.86,8,9,7,"Background: Two families of polyunsaturated fatty acid (PUFA), omega-3 (omega-3) and omega-6 (omega-6), are required for physiological functions. The long chain omega-3 PUFAs, eicosapentaenoic acid (EPA) and docosahexaenoic acid (DHA), have significant biological effects. In particular, DHA is a major component of cell membranes in the brain. It is also involved in neurotransmission. Spinal cord injury (SCI) is a highly devastating pathology that can lead to catastrophic dysfunction, with a significant reduction in the quality of life. Previous studies have shown that EPA and DHA can exert neuroprotective effects in SCI in mice and rats. The aim of this study was to analyze the mechanism of action of omega-3 PUFAs, such as DHA, in a mouse model of SCI, with a focus on the early pathophysiological processes.","omega3"
"36",125,"W. L. Huang, V. R. King, O. E. Curran, S. C. Dyall, R. E. Ward, N. Lal, J. V. Priestley, A. T. Michael-Titus","A combination of intravenous and dietary docosahexaenoic acid significantly improves outcome after spinal cord injury",2007,"Brain","Oxford Univ Press",NA,NA,2,"2021-01-18 10:51:39","Article","10.1093/brain/awm223","0006-8950",NA,130,NA,3004,3019,125,8.93,16,8,14,"Previous studies have shown that omega-3 polyunsaturated fatty acids such as alpha-linolenic acid and docosahexaenoic acid (DHA) are neuroprotective in models of spinal cord injury (SCI) in rodents. However, the mechanism of action underlying these effects has not been elucidated, and the optimum treatment regime remains to be defined. We have therefore carried out a detailed analysis of the effects of DHA in adult rats subject to thoracic compression SCI. Saline or DHA (250 nmol/kg) was administered intravenously (i.v.) 30 min after compression. After injury, the saline group received a standard control diet for 1 or 6 weeks, whereas DHA-injected animals received either a control or a DHA-enriched diet (400mg/kg/day) for 1 or 6 weeks. Other groups received a DHA-enriched diet only for 1 week following injury, or received acute DHA (250 nmol/kg; i.v.) treatment delayed up to 3 h after injury. We also assessed oxidative stress and the inflammatory reaction at the injury site, neuronal and oligodendrocyte survival and axonal damage and the locomotor recovery. At 24 h, lipid peroxidation, protein oxidation, RNA/DNA oxidation and the induction of cyclooxygenase-2 were all significantly reduced by i.v. DHA administration. At 1 week and 6 weeks, macrophage recruitment was reduced and neuronal and oligodendrocyte survival was substantially increased. Axonal injury was reduced at 6 weeks. Locomotor recovery was improved from day 4, and sustained up to 6 weeks. Rats treated with a DHA-enriched diet in addition to the acute DHA injection were not significantly different from the acute DHA-treated animals at 1 week, but at 6 weeks showed additional improvements in both functional and histological outcomes. DHA treatment was ineffective if the acute injection was delayed until 3 h post-injury, or if the DHA was administered for 1 week solely by diet. Our results in a clinically relevant model of SCI show that significant neuroprotection can be obtained by combining an initial acute i.v. injection of DHA with a sustained dietary supplementation. Given that the safety and tolerability of preparations enriched in omega- 3 fatty acids is already well-documented, such a combined DHA treatment regime deserves consideration as a very promising approach to SCI management.","omega3"
"37",149,"VR King, WL Huang, SC Dyall, OE Curran, JV Priestley, AT Michael-Titus","Omega-3 fatty acids improve recovery, whereas omega-6 fatty acids worsen outcome, after spinal cord injury in the adult rat",2006,"Journal Of Neuroscience","Soc Neuroscience",NA,NA,1,"2021-01-18 10:51:39","Article","10.1523/JNEUROSCI.5539-05.2006","0270-6474",NA,26,17,4672,4680,149,9.93,25,6,15,"Spinal cord injury (SCI) is a cause of major neurological disability, and no satisfactory treatment is currently available. Evidence suggests that polyunsaturated fatty acids (PUFAs) could target some of the pathological mechanisms that underlie damage after SCI. We examined the effects of treatment with PUFAs after lateral spinal cord hemisection in the rat. The omega-3 PUFAs alpha-linolenic acid and docosahexaenoic acid (DHA) injected 30 min after injury induced significantly improved locomotor performance and neuroprotection, including decreased lesion size and apoptosis and increased neuronal and oligodendrocyte survival. Evidence showing a decrease in RNA/DNA oxidation suggests that the neuroprotective effect of omega-3 PUFAs involved a significant antioxidant function. In contrast, animals treated with arachidonic acid, an omega-6 PUFA, had a significantly worse outcome than controls. We confirmed the neuroprotective effect of omega-3 PUFAs by examining the effects of DHA treatment after spinal cord compression injury. Results indicated that DHA administered 30 min after spinal cord compression not only greatly increased survival of neurons but also resulted in significantly better locomotor performance for up to 6 weeks after injury.","omega3"
