"","Cites","Authors","Title","Year","Source","Publisher","ArticleURL","CitesURL","GSRank","QueryDate","Type","DOI","ISSN","CitationURL","Volume","Issue","StartPage","EndPage","ECC","CitesPerYear","CitesPerAuthor","AuthorCount","Age","Abstract","generic_drug_name"
"17",151,"Barry W. Festoff, Syed Ameenuddin, Paul M. Arnold, Andrea Wong, Karen S. Santacruz, Bruce A. Citron","Minocycline neuroprotects, reduces microgliosis, and inhibits caspase protease expression early after spinal cord injury",2006,"Journal Of Neurochemistry","Wiley",NA,NA,6,"2021-01-14 20:02:37","Article","10.1111/j.1471-4159.2006.03799.x","0022-3042",NA,97,5,1314,1326,151,10.07,25,6,15,"Minocycline, a clinically used tetracycline for over 40 years, crosses the blood-brain barrier and prevents caspase up-regulation. It reduces apoptosis in mouse models of Huntington's disease and familial amyotrophic lateral sclerosis (ALS) and is in clinical trial for sporadic ALS. Because apoptosis also occurs after brain and spinal cord (SCI) injury, its prevention may be useful in improving recovery. We analyzed minocycline's neuroprotective effects over 28 days following contusion SCI and found significant functional recovery compared to tetracycline. Histology, immunocytochemistry, and image analysis indicated statistically significant tissue sparing, reduced apoptosis and microgliosis, and less activated caspase-3 and substrate cleavage. Since our original report in abstract form, others have published both positive and negative effects of minocycline in various rodent models of SCI and with various routes of administration. We have since found decreased tumor necrosis factor-alpha, as well as caspase-3 mRNA expression, as possible mechanisms of action for minocycline's ameliorative action. These results support reports that modulating apoptosis, caspases, and microglia provide promising therapeutic targets for prevention and/or limiting the degree of functional loss after CNS trauma. Minocycline, and more potent chemically synthesized tetracyclines, may find a place in the therapeutic arsenal to promote recovery early after SCI in humans.","tetracycline"
"18",163,"Nicole Bye, Mark D. Habgood, Jennifer K. Callaway, Nakisa Malakooti, Ann Potter, Thomas Kossmann, M. Cristina Morganti-Kossmann","Transient neuroprotection by minocycline following traumatic brain injury is associated with attenuated microglial activation but no changes in cell apoptosis or neutrophil infiltration",2007,"Experimental Neurology","Academic Press Inc Elsevier Science",NA,NA,5,"2021-01-14 20:02:37","Article","10.1016/j.expneurol.2006.10.013","0014-4886",NA,204,1,220,233,163,11.64,23,7,14,"Cerebral inflammation and apoptotic cell death are two processes implicated in the progressive tissue damage that occurs following traumatic brain injury (TBI), and strategies to inhibit one or both of these pathways are being investigated as potential therapies for TBI patients. The tetracycline derivative minocycline was therapeutically effective in various models of central nervous system injury and disease, via mechanisms involving suppression of inflammation and apoptosis. We therefore investigated the effect of minocycline in TBI using a closed head injury model. Following TBI, mice were treated with minocycline or vehicle, and the effect on neurological outcome, lesion volume, inflammation and apoptosis was evaluated for up to 7 days. Our results show that while minocycline decreases lesion volume and improves neurological outcome at I day post-trauma, this response is not maintained at 4 days. The early beneficial effect is likely not due to anti-apoptotic mechanisms, as the density of apoptotic cells is not affected at either time-point. However, protection by minocycline is associated with a selective anti-inflammatory response, in that microglial activation and interleukin-1 beta expression are reduced, while neutrophil infiltration and expression of multiple cytokines are not affected. These findings demonstrate that further studies on minocycline in TBI are necessary in order to consider it as a novel therapy for brain-injured patients. Crown Copyright (c) 2006 Published by Elsevier Inc. All rights reserved.","tetracycline"
"19",183,"DC Baptiste, MG Fehlings","Pharmacological approaches to repair the injured spinal cord",2006,"Journal Of Neurotrauma","Mary Ann Liebert, Inc",NA,NA,3,"2021-01-14 20:02:37","Article","10.1089/neu.2006.23.318","0897-7151",NA,23,3,318,334,183,12.2,92,2,15,"Acute traumatic spinal cord injury (SCI) results in a devastating loss of neurological function below the level of injury and adversely affects multiple systems within the body. The pathobiology of SCI involves a primary mechanical insult to the spinal cord and activation of a delayed secondary cascade of events, which ultimately causes progressive degeneration of the spinal cord. Whereas cell death from the mechanical injury is predominated by necrosis, secondary injury events trigger a continuum of necrotic and apoptotic cell death mechanisms. These secondary events include vascular abnormalities, ischemia-reperfusion, glutamate excitotoxicity and disturbances in ionic homeostasis, oxidative cell injury, and a robust inflammatory response. No gold standard therapy for SCI has been established, although clinical trials with methylprednisolone (NASCIS II and III) and GM-1 ganglioside (Maryland and Sygen) have demonstrated modest, albeit potentially important therapeutic benefits. In light of the overwhelming impact of SCI on the individual, other therapeutic interventions are urgently needed. A number of promising pharmacological therapies are currently under investigation for neuroprotective abilities in animal models of SCI. These include the sodium (Na+) channel blocker riluzole, the tetracycline derivative minocycline, the fusogen copolymer polyethylene glycol (PEG), and the tissue-protective hormone erythropoietin (EPO). Moreover, clinical trials investigating the putative neuroprotective and neuroregenerative properties ascribed to the Rho pathway antagonist, Cethrin (R) (BioAxone Therapeutic, Inc.), and implantation of activated autologous macrophages (ProCord (R); Proneuron Biotechnologies) in patients with thoracic and cervical SCI are now underway. We anticipate that these studies will harken an era of renewed interest in translational clinical trials. Ultimately, due to the multi-factorial pathophysiology of traumatic SCI, effective therapies will require combined approaches.","tetracycline"
"20",190,"Steven Casha, David Zygun, M. Dan McGowan, Ish Bains, V. Wee Yong, R. John Hurlbert","Results of a phase II placebo-controlled randomized trial of minocycline in acute spinal cord injury",2012,"Brain","Oxford Univ Press",NA,NA,4,"2021-01-14 20:02:37","Article","10.1093/brain/aws072","0006-8950",NA,135,NA,1224,1236,190,21.11,32,6,9,"Preclinical studies have attributed neuroprotective properties to the antibiotic minocycline. Animal studies and early clinical trials support its use in several neurological diseases. In animal spinal cord injury models, minocycline improved neurological and histological outcomes, reduced neuronal and oligodendroglial apoptosis, decreased microglial activation and reduced inflammation. A single-centre, human, double-blind, randomized, placebo-controlled study of minocycline administration after spinal cord injury was undertaken for the purposes of dose optimization, safety assessment and to estimate outcome changes and variance. Neurological, functional, pharmacological and adverse event outcomes were compared between subjects administered 7 days of intravenous minocycline (n = 27) or placebo (n = 25) after acute traumatic spinal cord injury. The secondary outcome used to assess neurological differences between groups that may warrant further investigation was motor recovery over 1 year using the American Spinal Cord Injury Association examination. Recruitment and analyses were stratified by injury severity and injury location a priori given the expected influence of these on the sensitivity of the motor exam. Minocycline administered at higher than previously reported human doses produced steady-state concentrations of 12.7 mu g/ml (95% confidence interval 11.6-13.8) in serum and 2.3 mu g/ml (95% confidence interval 2.1-2.5) in cerebrospinal fluid, mimicking efficacious serum levels measured in animal studies. Transient elevation of serum liver enzymes in one patient was the only adverse event likely related to the study drug. Overall, patients treated with minocycline experienced six points greater motor recovery than those receiving placebo (95% confidence interval -3 to 14; P = 0.20, n = 44). No difference in recovery was observed for thoracic spinal cord injury (n = 16). A difference of 14 motor points that approached significance was observed in patients with cervical injury (95% confidence interval 0-28; P = 0.05, n = 25). Patients with cervical motor-incomplete injury may have experienced a larger difference (results not statistically significant, n = 9). Functional outcomes exhibited differences that lacked statistical significance but that may be suggestive of improvement in patients receiving the study drug. The minocycline regimen established in this study proved feasible, safe and was associated with a tendency towards improvement across several outcome measures. Although this study does not establish the efficacy of minocycline in spinal cord injury the findings are encouraging and warrant further investigation in a multi-centre phase III trial. ClinicalTrials.gov number NCT00559494.","tetracycline"
"21",260,"YD Teng, H Choi, RC Onario, S Zhu, FC Desilets, SM Lan, EJ Woodard, EY Snyder, ME Eichler, RM Friedlander","Minocycline inhibits contusion-triggered mitochondrial cytochrome c release and mitigates functional deficits after spinal cord injury",2004,"Proceedings Of The National Academy Of Sciences Of The United States Of America","Natl Acad Sciences",NA,NA,2,"2021-01-14 20:02:37","Article","10.1073/pnas.0306239101","0027-8424",NA,101,9,3071,3076,260,15.29,26,10,17,"We investigated whether permeability transition-mediated release of mitochondrial cytochrome c is a potential therapeutic target for treating acute spinal cord injury (SCI). Based on previous reports, minocycline, a second-generation tetracycline, exerts neuroprotection partially by inhibiting mitochondrial cytochrome c release and reactive microgliosis. We first evaluated cytochrome c release at the injury epicenter after a T10 contusive SCI in rats. Cytochrome c release peaked at approximate to4-8 h postinjury. A dose-response study generated a safe pharmacological regimen that enabled i.p. minocycline to significantly lower cytosolic cytochrome c at the epicenter 4 h after SCI. In the long-term study, i.p. minocycline (90 mg/kg administered 1 h after SCI followed by 45 mg/kg administered every 12 h for 5 days) markedly enhanced long-term hind limb locomotion relative to that of controls. Coordinated motor function and hind limb reflex recoveries also were improved significantly. Histopathology suggested that minocycline treatment alleviated later-phase tissue loss, with significant sparing of white matter and ventral horn motoneurons at levels adjacent to the epicenter. Furthermore, glial fibrillary acidic protein and 2',3' cyclic nucleotide 3' phosphodiesterase immunocytochemistry showed an evident reduction in astrogliosis and enhanced survival of oligodendrocytes. Therefore, release of mitochondrial cytochrome c is an important secondary injury mechanism in SCI. Drugs with multifaceted effects in antagonizing this process and microgliosis may protect a proportion of spinal cord tissue that is clinically significant for functional recovery. Minocycline, with its proven clinical safety, capability to cross the blood-brain barrier, and demonstrated efficacy during a clinically relevant therapeutic window, may become an effective therapy for acute SCI.","tetracycline"
"22",287,"JEA Wells, RJ Hurlbert, MG Fehlings, VW Yong","Neuroprotection by minocycline facilitates significant recovery from spinal cord injury in mice",2003,"Brain","Oxford Univ Press",NA,NA,1,"2021-01-14 20:02:37","Article","10.1093/brain/awg178","0006-8950",NA,126,NA,1628,1637,287,15.94,72,4,18,"Acute spinal cord injury (SCI) produces tissue damage that continues to evolve days and weeks after the initial insult, with corresponding functional impairments. Reducing the extent of progressive tissue loss ('neuroprotection') following SCI should result in a better recovery from SCI, but treatment options have thus far been limited. In this study, we have tested the efficacy of minocycline in ameliorating damage following acute SCI in mice. This semi-synthetic tetracycline antibiotic has been reported to inhibit the expression and activity of several mediators of tissue injury, including inflammatory, cytokines, free radicals and matrix metalloproteinases, making it a suitable candidate for study. Mice were subjected to extradural compression of the spinal cord using a modified aneurysm clip, following which they received treatment with either minocycline or vehicle beginning I h after injury. Behavioural testing of hindlimb function was initiated 3 days after injury using the Basso Beattie Bresnahan locomotor rating scale, and at 1 week using the inclined plane test. Functional assessments demonstrated that minocycline administration significantly improved both hindlimb function and strength from 3 to 28 days after injury compared with vehicle controls. Furthermore, gross lesion size in the spinal cord was significantly reduced by minocycline, and there was evidence of axonal sparing as determined using fluorogold labelling of the rubrospinal tract and by Bielchowsky silver stain. Finally, a comparison of minocycline against the currently approved treatment for acute SCI in humans, methylprednisolone, demonstrated superior behavioural recovery in the minocycline-treated animals.","tetracycline"
