"","Cites","Authors","Title","Year","Source","Publisher","ArticleURL","CitesURL","GSRank","QueryDate","Type","DOI","ISSN","CitationURL","Volume","Issue","StartPage","EndPage","ECC","CitesPerYear","CitesPerAuthor","AuthorCount","Age","Abstract","generic_drug_name"
"1",0,"Leman Sencar, Dervis Mansuri Yilmaz, Abdullah Tuli, Sait Polat","Effects of combined treatment of minocycline and methylprednisolone on the expression of tumor necrosis factor alpha and interleukine-6 in experimental spinal cord injury: a light and electron microscopic study",2020,"Ultrastructural Pathology","Taylor & Francis Inc",NA,NA,22,"2021-01-14 20:02:37","Article","10.1080/01913123.2020.1771493","0191-3123",NA,44,3,283,299,0,0,0,4,1,"Spinal cord injury (SCI) is an important health problem, and there is no universal treatment protocol for it today. Following SCI pro-inflammatory mediators such as tumor necrosis factor- alpha (TNF-alpha) and interleukin-6 (IL-6) increase at the lesion site and play important roles in secondary tissue damage. Methylprednisolone (MP) is a glucocorticoid, and minocycline is a tetracycline-derived antibiotic both with neuroprotective effects on central nervous system trauma. However, there are limited studies on their effects on SCI. In this study, we aimed to evaluate effects of MP+minocycline combined treatment on cellular distribution and localization of TNF-alpha And IL-6 after SCI. Eighty Wistar rats were divided into three main groups as the intact control group, sham operation group, and experimental control group that received spinal cord compression injury. Following the injury, the experimental control group was subdivided into four groups as control, methylprednisolone treatment, minocycline treatment and, MP+minocycline combined treatment groups. Tissue samples were obtained from all groups at 24 hours and 72 hours after the injury. We found a significant decrease in TNF-alpha And IL-6 expressions in combined treatment group at 24 hours after injury. Also, there was a significant decrease in MDA and increase in SOD levels in this group. Furthermore, decreased lipid peroxidation and neuronal and glial cell death were also observed in combined treatment group. These results suggest that MP+minocycline combined treatment promotes functional recovery and, it should be considered as an effective treatment protocol following SCI.","tetracycline"
"2",4,"Liangliang Huang, Bing Xia, Xiaowei Shi, Jianbo Gao, Yujie Yang, Feng Xu, Fengyu Qi, Chao Liang, Jinghui Huang, Zhuojing Luo","Time-restricted release of multiple neurotrophic factors promotes axonal regeneration and functional recovery after peripheral nerve injury",2019,"Faseb Journal","Wiley",NA,NA,21,"2021-01-14 20:02:37","Article","10.1096/fj.201802065RR","0892-6638",NA,33,7,8600,8613,4,2,0,10,2,"Delivery of multiple neurotrophic factors (NTFs), especially with time-restricted release kinetics, holds great potential for nerve repair. In this study, we utilized the tetracycline-regulatable Tet-On 3G system to control the expression of c-Jun, which is a common regulator of multiple NTFs in Schwann cells (SCs). In vitro, Tet-On/c-Jun-modified SCs showed a tightly controllable secretion of multiple NTFs, including glial cell line-derived NTF, nerve growth factor, brain-derived NTF, and artemin, by the addition or removal of doxycycline (Dox). When Tet-On/c-Jun-transduced SCs were grafted in vivo, the expression of NTFs could also be regulated by oral administration or removal of Dox. Fluoro-Gold retrograde tracing results indicated that a biphasic NTF expression scheme (Dox+3/-9, NTFs were up-regulated for 3 wk and declined to physiologic levels for another 9 wk) achieved more axonal regeneration than continuous up-regulation of NTFs (Dox+12) or no NTF induction (Dox-12). More importantly, the Dox+3/-9-group animals showed much better functional recovery than the animals in the Dox+12 and Dox-12 groups. Our findings, for the first time, demonstrated drug-controllable expression of multiple NTFs in nerve repair cells both in vitro and in vivo. These findings provide new hope for developing an optimal therapeutic alternative for nerve repair through the time-restricted release of multiple NTFs using Tet-On/c-Jun-modified SCs.-Huang, L., Xia, B., Shi, X., Gao, J., Yang, Y., Xu, F., Qi, F., Liang, C., Huang, J., Luo, Z. Time-restricted release of multiple neurotrophic factors promotes axonal regeneration and functional recovery after peripheral nerve injury.","tetracycline"
"3",7,"Mohamad Samir Samour, Saad Saulat Nagi, Peter John Shortland, David Anthony Mahns","Minocycline Prevents Muscular Pain Hypersensitivity and Cutaneous Allodynia Produced by Repeated Intramuscular Injections of Hypertonic Saline in Healthy Human Participants",2017,"Journal Of Pain","Churchill Livingstone",NA,NA,20,"2021-01-14 20:02:37","Article","10.1016/j.jpain.2017.03.009","1526-5900",NA,18,8,994,1005,7,1.75,2,4,4,"Minocycline, a glial suppressor, prevents behavioral hypersensitivities in animal models of peripheral nerve injury. However, clinical trials of minocycline in human studies have produced mixed results. This study addressed 2 questions: can repeated injections of hypertonic saline (HS) in humans induce persistent hypersensitivity? Can pretreatment with minocycline, a tetracycline antibiotic with microglial inhibitory effects, prevent the onset of hypersensitivity? Twenty-seven healthy participants took part in this double-blind, placebo-controlled study, consisting of 6 test sessions across 2 weeks. At the beginning of every session, pressure-pain thresholds of the anterior muscle compartment of both legs were measured to determine the region distribution and intensity of muscle soreness. To measure changes in thermal sensitivity in the skin overlying the anterior muscle compartment of both legs, quantitative sensory testing was used to measure the cutaneous thermal thresholds (cold sensation, cold pain, warm sensation, and heat pain) and a mild cooling stimulus was applied to assess the presence of cold allodynia. To induce ongoing hypersensitivity, repeated injections of HS were administered into the right tibialis anterior muscle at 48-hour intervals. In the final 2 sessions (days 9 and 14), only sensory assessments were done to plot the recovery after cessation of HS administrations and drug washout. By day 9, nontreated participants experienced a significant bilateral increase in muscle soreness (P < .0001), accompanied by the emergence of bilateral cold allodynia in 44% of participants, thus confirming the effectiveness of the model. Placebo-treated participants experienced a bilateral 35% alleviation in muscle soreness (P < .0001), with no changes to the prevalence of cold allodynia. In contrast, minocycline-treated participants experienced a bilateral 70% alleviation in muscle soreness (P < .0001), additionally, only 10% of minocycline-treated participants showed cold allodynia. This study showed that repeated injections of HS can induce a hypersensitivity that outlasts the acute response, and the development of this hypersensitivity can be reliably attenuated with minocycline pretreatment. Perspective: Four repeated Injections of HS at 48-hour intervals induce a state of persistent hypersensitivity in healthy human participants. This hypersensitivity was characterized by bilateral muscular hyperalgesia and cutaneous cold allodynia, symptoms commonly reported in many chronic pain conditions. Minocycline pretreatment abolished the development of this state. Crown Copyright (C) 2017 Published by Elsevier Inc. on behalf of the American Pain Society","tetracycline"
"4",12,"N. Askari, M. M. Yaghoobi, M. Shamsara, S. Esmaeili-Mahani","TETRACYCLINE-REGULATED EXPRESSION OF OLIG2 GENE IN HUMAN DENTAL PULP STEM CELLS LEAD TO MOUSE SCIATIC NERVE REGENERATION UPON TRANSPLANTATION",2015,"Neuroscience","Pergamon-Elsevier Science Ltd",NA,NA,19,"2021-01-14 20:02:37","Article","10.1016/j.neuroscience.2015.07.088","0306-4522",NA,305,NA,197,208,12,2,3,4,6,"Numerous studies have indicated dental pulp stem cells (DPSCs) potency to differentiate into several types of cell lineages. Oligodendrocyte lineage transcription factor 2 (OLIG2) plays an important role in the oligodendrogenic pathway. In this study, a tetracycline (Tet)-inducible system expressing OLIG2 gene was transfected into human DPSCs to direct their differentiation toward oligodendrocyte progenitor cells (OPCs). Following induction, the expression of stage-specific markers was studied by Reverse Transcription quantitative Polymerase Chain Reaction (RT-qPCR), immunocytochemistry and western blotting. In the following, the cells were transplanted into the mouse model of local sciatic demyelination damage by lysolecithin. Recovery of lysolecithin-induced lesions in sciatic nerve was studied by treadmill exercise, von Frey filament test and hind paw withdrawal in response to a thermal stimulus. Improvement of behavioral symptoms was efficiently observed from the second week to the sixth week post-transplantation. Our findings showed that exogenous expression of the OLIG2 gene by a Tet-regulated system could be used as an efficient way to induce the differentiation of DPSCs into functional oligodendrocytes. Meanwhile, the DPSC-derived OPCs have relevant therapeutic potential in the animal model of sciatic nerve injury and therefore might represent a valuable tool for stem cell-based therapy in inflammatory and degenerative diseases of the peripheral and central nervous systems (CNSs). (C) 2015 IBRO. Published by Elsevier Ltd. All rights reserved.","tetracycline"
"5",25,"Josephine Pinkernelle, Hisham Fansa, Uwe Ebmeyer, Gerburg Keilhoff","Prolonged Minocycline Treatment Impairs Motor Neuronal Survival and Glial Function in Organotypic Rat Spinal Cord Cultures",2013,"Plos One","Public Library Science",NA,NA,17,"2021-01-14 20:02:37","Article","10.1371/journal.pone.0073422","1932-6203",NA,8,8,NA,NA,25,3.13,6,4,8,"Background: Minocycline, a second-generation tetracycline antibiotic, exhibits anti-inflammatory and neuroprotective effects in various experimental models of neurological diseases, such as stroke, Alzheimer's disease, amyotrophic lateral sclerosis and spinal cord injury. However, conflicting results have prompted a debate regarding the beneficial effects of minocycline.","tetracycline"
"6",26,"Kamila Saganova, Judita Orendacova, Dasa Cizkova, Ivo Vanicky","Limited minocycline neuroprotection after balloon-compression spinal cord injury in the rat",2008,"Neuroscience Letters","Elsevier Ireland Ltd",NA,NA,18,"2021-01-14 20:02:37","Article","10.1016/j.neulet.2008.01.041","0304-3940",NA,433,3,246,249,26,2,7,4,13,"Minocycline (MC), a second-generation tetracycline and anti- inflammatory agent reportedly provides neuroprotection following CNS injury. The objective of this study was to examine the neuroprotective effects of short and long-term MC treatment using balloon -compres si on spinal cord injury (SCI) in the rat. Rats subjected to SCI were treated with MC for 1 day (IDMC group; total dose 180 mg/kg) or 5 days (5DMC group; total dose 450 mg/kg) or placebo. The effects of MC treatment on locomotor recovery (BBB scale) and spinal cord white and gray matter sparing were evaluated for up to 28 days. Morphometric analysis showed that while MC treatment spared spinal cord white and gray matter rostral to the lesion epicenter in both, 1DMC and 5DMC groups, sparing of white and gray matter areas was not observed caudal to the traumatic lesion. In addition, MC treatment had no effect on final locomotor recovery. Limited improvement of spinal cord post-compression consequences raises questions about the neuroprotection efficiency of MC treatment following compression SO in the rat. (C) 2008 Elsevier Ireland Ltd. All rights reserved.","tetracycline"
"7",34,"Dong Charn Cho, Jin Hwan Cheong, Moon Sul Yang, Se Jin Hwang, Jae Min Kim, Choong Hyun Kim","The Effect of Minocycline on Motor Neuron Recovery and Neuropathic Pain in a Rat Model of Spinal Cord Injury",2011,"Journal Of Korean Neurosurgical Society","Korean Neurosurgical Soc",NA,NA,14,"2021-01-14 20:02:37","Article","10.3340/jkns.2011.49.2.83","2005-3711",NA,49,2,83,91,34,3.4,6,6,10,"Objective : Minocycline, a second-generation tetracycline-class antibiotic, has been well established to exert a neuroprotective effect in animal models and neurodegenerative disease through the inhibition of microglia. Here, we investigated the effects of minocycline on motor recovery and neuropathic pain in a rat model of spinal cord injury.","tetracycline"
"8",34,"Jae H. T. Lee, Seth Tigchelaar, Jie Liu, Anthea M. T. Stammers, Femke Streijger, Wolfram Tetzlaff, Brian K. Kwon","Lack of neuroprotective effects of simvastatin and minocycline in a model of cervical spinal cord injury",2010,"Experimental Neurology","Academic Press Inc Elsevier Science",NA,NA,16,"2021-01-14 20:02:37","Article","10.1016/j.expneurol.2010.06.018","0014-4886",NA,225,1,219,230,34,3.09,5,7,11,"Minocycline, a commonly prescribed tetracycline antibiotic, has shown promise as a potential therapeutic agent in animal models of numerous neurologic disorders such as amyotrophic lateral sclerosis, multiple sclerosis, Parkinson's disease, Huntington's disease, stroke, and spinal cord injury (SCI). Simvastatin is one of many hydroxymethylglutaryl-coenzyme-A reductase inhibitors prescribed to lower cholesterol. These drugs are also known to reduce inflammation and oxidative stress, improve endothelial function, and modulate the immune system in stroke, traumatic brain injury, and SCI. As both drugs have translational potential, we evaluated their neuroprotective properties here in a clinically relevant model of contusive cervical spinal cord injury.","tetracycline"
"9",35,"A Lakatos, RJM Franklin","Transplant mediated repair of the central nervous system: an imminent solution?",2002,"Current Opinion In Neurology","Lippincott Williams & Wilkins",NA,NA,15,"2021-01-14 20:02:37","Article","10.1097/00019052-200212000-00007","1350-7540",NA,15,6,701,705,35,1.84,18,2,19,"Purpose of review","tetracycline"
"10",38,"Robert B. Shultz, Yinghui Zhong","Minocycline targets multiple secondary injury mechanisms in traumatic spinal cord injury",2017,"Neural Regeneration Research","Wolters Kluwer Medknow Publications",NA,NA,12,"2021-01-14 20:02:37","Review","10.4103/1673-5374.206633","1673-5374",NA,12,5,702,NA,38,9.5,19,2,4,"Minocycline hydrochloride (MH), a semi-synthetic tetracycline derivative, is a clinically available antibiotic and anti-inflammatory drug that also exhibits potent neuroprotective activities. It has been shown to target multiple secondary injury mechanisms in spinal cord injury, via its anti-inflammatory, anti-oxidant, and anti-apoptotic properties. The secondary injury mechanisms that MH can potentially target include inflammation, free radicals and oxidative stress, glutamate excitotoxicity, calcium influx, mitochondrial dysfunction, ischemia, hemorrhage, and edema. This review discusses the potential mechanisms of the multifaceted actions of MH. Its anti-inflammatory and neuroprotective effects are partially achieved through conserved mechanisms such as modulation of p38 mitogen-activated protein kinase (MAPK) and phosphoinositide 3-kinase (PI3K)/Akt signaling pathways as well as inhibition of matrix metalloproteinases (MMPs). Additionally, MH can directly inhibit calcium influx through the N-methyl-D-aspartate (NMDA) receptors, mitochondrial calcium uptake, poly(ADP-ribose) polymerase-1 (PARP-1) enzymatic activity, and iron toxicity. It can also directly scavenge free radicals. Because it can target many secondary injury mechanisms, MH treatment holds great promise for reducing tissue damage and promoting functional recovery following spinal cord injury.","tetracycline"
"11",40,"Shengwen Liu, Beatrice Sandner, Thomas Schackel, LaShae Nicholson, Abdelwahed Chtarto, Liliane Tenenbaum, Radhika Puttagunta, Rainer Mueller, Norbert Weidner, Armin Blesch","Regulated viral BDNF delivery in combination with Schwann cells promotes axonal regeneration through capillary alginate hydrogels after spinal cord injury",2017,"Acta Biomaterialia","Elsevier Sci Ltd",NA,NA,13,"2021-01-14 20:02:37","Article","10.1016/j.actbio.2017.07.024","1742-7061",NA,60,NA,167,180,40,10,4,10,4,"Grafting of cell-seeded alginate capillary hydrogels into a spinal cord lesion site provides an axonal bridge while physically directing regenerating axonal growth in a linear pattern. However, without an additional growth stimulus, bridging axons fail to extend into the distal host spinal cord. Here we examined whether a combinatory strategy would support regeneration of descending axons across a cervical (C5) lateral hemisection lesion in the rat spinal cord. Following spinal cord transections, Schwann cell (SC)-seeded alginate hydrogels were grafted to the lesion site and AAV5 expressing brain-derived neurotrophic factor (BDNF) under control of a tetracycline-regulated promoter was injected caudally. In addition, we examined whether SC injection into the caudal spinal parenchyma would further enhance regeneration of descending axons to re-enter the host spinal cord. Our data show that both serotonergic and descending axons traced by biotinylated dextran amine (BDA) extend throughout the scaffolds. The number of regenerating axons is significantly increased when caudal BDNF expression is activated and transient BDNF delivery is able to sustain axons after gene expression is switched off. Descending axons are confined to the caudal graft/host interface even with continuous BDNF expression for 8 weeks. Only with a caudal injection of SCs, a pathway facilitating axonal regeneration through the host/graft interface is generated allowing axons to successfully re-enter the caudal spinal cord.","tetracycline"
"12",50,"A Blesch, JM Conner, MH Tuszynski","Modulation of neuronal survival and axonal growth in vivo by tetracycline-regulated neurotrophin expression",2001,"Gene Therapy","Nature Publishing Group",NA,NA,11,"2021-01-14 20:02:37","Article","10.1038/sj.gt.3301480","0969-7128",NA,8,12,954,960,50,2.5,17,3,20,"Vector systems for the regulated and reversible expression of therapeutic genes are likely to improve the safety and efficacy of gene therapy for medical disease. In the present study, we investigated whether the expression of genes transferred into the central nervous system by ex vivo gene therapy can be regulated in vivo leading to controlled neuronal survival and axonal growth. Primary rat fibroblasts were transfected with a retrovirus containing a tetracycline responsive promoter for the expression of the neurotrophin nerve growth factor (NGF) or green fluorescent protein as a control (GFP). After lesions of basal forebrain cholinergic neurons, NGF-mediated neuronal rescue and axonal growth could be completely controlled over a P-week period by the addition or removal of the tetracycline modulator doxycycline in the animals' drinking wafer. Further, continued expression of the reporter gene GFP could be reliably and repeatedly turned on and off in the injured CNS for at least 3 months post-grafting, the longest time point investigated These data constitute the first report of regulated neuronal rescue and axonal growth by controlled neurotrophin gene delivery and long-term, regulated expression using ex vivo CNS gene therapy.","tetracycline"
"13",65,"C Pot, M Simonen, O Weinmann, L Schnell, F Christ, S Stoeckle, P Berger, T Rulicke, U Suter, ME Schwab","Nogo-A expressed in Schwann cells impairs axonal regeneration after peripheral nerve injury",2002,"Journal Of Cell Biology","Rockefeller Univ Press",NA,NA,10,"2021-01-14 20:02:37","Article","10.1083/jcb.200206068","0021-9525",NA,159,1,29,35,65,3.42,7,10,19,"Injured axons in mammalian peripheral nerves often regenerate successfully over long distances, in contrast to axons in the brain and spinal cord (CNS). Neurite growth-inhibitory proteins, including the recently cloned membrane protein Nogo-A, are enriched in the CNS, in particular in myelin. Nogo-A is not detectable in peripheral nerve myelin. Using regulated transgenic expression of Nogo-A in peripheral nerve Schwann cells, we show that axonal regeneration and functional recovery are impaired after a sciatic nerve crush. Nogo-A thus overrides the growth-permissive and -promoting effects of the lesioned peripheral nerve, demonstrating its in vivo potency as an inhibitor of axonal regeneration.","tetracycline"
"14",71,"Armin Blesch, Mark H. Tuszynski","Transient growth factor delivery sustains regenerated axons after spinal cord injury",2007,"Journal Of Neuroscience","Soc Neuroscience",NA,NA,9,"2021-01-14 20:02:37","Article","10.1523/JNEUROSCI.1903-07.2007","0270-6474",NA,27,39,10535,10545,71,5.07,36,2,14,"Growth factors influence the topography of axonal projections during nervous system development and facilitate axonal sprouting and regeneration after injury in the adult. However, in the absence of target reinnervation and reestablishment of synaptic activity, we hypothesized that continuing delivery of neurotrophins would be required to sustain regenerating axons for prolonged times points after neurotrophin-induced axon growth after spinal cord injury ( SCI) in the adult. Using tetracycline-inducible expression of brain-derived neurotrophic factor by genetically modified fibroblasts, we were able to extensively and significantly turn growth factor expression ""on"" or ""off"" in vitro and in vivo within sites of SCI. Notably, we find that transient growth factor delivery is sufficient to sustain regenerated axons for prolonged time periods within spinal cord lesion sites. Immunohistochemical analysis demonstrated an absence of neuronal targets or synapses within transient growth factor expressing grafts but the persistent presence of Schwann cells. Thus, the adult CNS appears capable of sustaining axons that have extended after transient growth factor delivery, an effect potentially attributable to the persistence of Schwann cells in lesion/graft sites.","tetracycline"
"15",112,"Tritia R. Yamasaki, Mathew Blurton-Jones, Debbi A. Morrissette, Masashi Kitazawa, Salvatore Oddo, Frank M. LaFerla","Neural stem cells improve memory in an inducible mouse model of neuronal loss",2007,"Journal Of Neuroscience","Soc Neuroscience",NA,NA,8,"2021-01-14 20:02:37","Article","10.1523/JNEUROSCI.1627-07.2007","0270-6474",NA,27,44,11925,11933,112,8,19,6,14,"Neuronal loss is a major pathological outcome of many common neurological disorders, including ischemia, traumatic brain injury, and Alzheimer disease. Stem cell-based approaches have received considerable attention as a potential means of treatment, although it remains to be determined whether stem cells can ameliorate memory dysfunction, a devastating component of these disorders. We generated a transgenic mouse model in which the tetracycline-off system is used to regulate expression of diphtheria toxin A chain. After induction, we find progressive neuronal loss primarily within the hippocampus, leading to specific impairments in memory. We find that neural stem cells transplanted into the brain after neuronal ablation survive, migrate, differentiate and, most significantly, improve memory. These results show that stem cells may have therapeutic value in diseases and conditions that result in memory loss.","tetracycline"
"16",132,"Darryl C. Baptiste, Michael G. Fehlings","Update on the treatment of spinal cord injury",2007,"Neurotrauma: New Insights Into Pathology And Treatment","Elsevier Science Bv",NA,NA,7,"2021-01-14 20:02:37","Review","10.1016/S0079-6123(06)61015-7","0079-6123",NA,161,NA,217,233,132,9.43,66,2,14,"Acute spinal cord injury (SCI) is a devastating neurological disorder that can affect any individual at a given instance. Current treatment options for SCI include the use of high dose methylprednisolone sodium succinate, a corticosteroid, surgical interventions to stabilize and decompress the spinal cord, intensive multisystem medical management, and rehabilitative care. While utility of these therapeutic options provides modest benefits, there is a critical need to identify novel approaches to treat or repair the injured spinal cord in hope to, at the very least, improve upon the patient's quality of life. Thankfully, several discoveries at the preclinical level are now transitioning into the clinical arena. These include the Surgical Treatment for Acute Spinal Cord Injury Study (STASCIS) Trial to evaluate the role and timing of surgical decompression for acute SCI, neuroprotection with the semisynthetic second generation tetracycline derivative, minocycline; aiding axonal conduction with the potassium channel blockers, neuroregenerative/neuroprotective approaches with the Rho antagonist, Cethrin (R); the use of anti-NOGO monoclonal antibodies to augment plasticity and regeneration; as well as cell-mediated repair with stem cells, bone marrow stromal cells, and olfactory ensheathing cells. This review overviews the pathobiology of SCI and current treatment choices before focusing the rest of the discussion on the variety of promising neuroprotective and cell-based approaches that have recently moved, or are very close, to clinical testing.","tetracycline"
