Cites,Authors,Title,Year,Source,Publisher,ArticleURL,CitesURL,GSRank,QueryDate,Type,DOI,ISSN,CitationURL,Volume,Issue,StartPage,EndPage,ECC,CitesPerYear,CitesPerAuthor,AuthorCount,Age,Abstract
0,"E. Holsboer-Trachsler","Therapy of depression in neurorehabilitation and neurobiological mechanisms of action",2003,"Schweizer Archiv fur Neurologie und Psychiatrie","","https://www.scopus.com/inward/record.uri?partnerID=HzOxMe3b&scp=0346727106&origin=inward","https://www.scopus.com/inward/citedby.uri?partnerID=HzOxMe3b&scp=0346727106&origin=inward",4,"2021-01-16 15:47:47","Review","10.4414/sanp.2003.01431","0258-7661","https://api.elsevier.com/content/abstract/scopus_id/0346727106",154,8,431,439,0,0.00,0,1,18,""
0,"E. Norwitz","Obstetric issues in women with neurologic diseases",1997,"Current Problems in Obstetrics, Gynecology and Fertility","","https://www.scopus.com/inward/record.uri?partnerID=HzOxMe3b&scp=0031471597&origin=inward","https://www.scopus.com/inward/citedby.uri?partnerID=HzOxMe3b&scp=0031471597&origin=inward",5,"2021-01-16 15:47:47","Review","","8756-0410","https://api.elsevier.com/content/abstract/scopus_id/0031471597",20,6,190,230,0,0.00,0,1,24,""
1,"M. Çaliş","Clinical evaluation and treatment of neurogenic bladder",2004,"Journal of Rheumatology and Medical Rehabilitation","","https://www.scopus.com/inward/record.uri?partnerID=HzOxMe3b&scp=29544433857&origin=inward","https://www.scopus.com/inward/citedby.uri?partnerID=HzOxMe3b&scp=29544433857&origin=inward",3,"2021-01-16 15:47:47","Article","","1300-0691","https://api.elsevier.com/content/abstract/scopus_id/29544433857",15,2,129,136,1,0.06,1,1,17,""
3,"Y. Wu","Methylprednisolone worsening neuropathic pain in non-traumatic thoracic myelopathy",2010,"Journal of Clinical Pharmacy and Therapeutics","","https://www.scopus.com/inward/record.uri?partnerID=HzOxMe3b&scp=77954493527&origin=inward","https://www.scopus.com/inward/citedby.uri?partnerID=HzOxMe3b&scp=77954493527&origin=inward",2,"2021-01-16 15:47:47","Article","10.1111/j.1365-2710.2009.01121.x","0269-4727","https://api.elsevier.com/content/abstract/scopus_id/77954493527",35,4,491,496,3,0.27,3,1,11,""
45,"A. Domingo","A systematic review of the effects of pharmacological agents on walking function in people with spinal cord injury",2012,"Journal of Neurotrauma","","https://www.scopus.com/inward/record.uri?partnerID=HzOxMe3b&scp=84858423381&origin=inward","https://www.scopus.com/inward/citedby.uri?partnerID=HzOxMe3b&scp=84858423381&origin=inward",1,"2021-01-16 15:47:47","Review","10.1089/neu.2011.2052","0897-7151","https://api.elsevier.com/content/abstract/scopus_id/84858423381",29,5,865,879,45,5.00,45,1,9,""
