Cites,Authors,Title,Year,Source,Publisher,ArticleURL,CitesURL,GSRank,QueryDate,Type,DOI,ISSN,CitationURL,Volume,Issue,StartPage,EndPage,ECC,CitesPerYear,CitesPerAuthor,AuthorCount,Age,Abstract
87,"S.M. Onifer","Plasticity After Spinal Cord Injury: Relevance to Recovery and Approaches to Facilitate It",2011,"Neurotherapeutics","","https://www.scopus.com/inward/record.uri?partnerID=HzOxMe3b&scp=79955054030&origin=inward","https://www.scopus.com/inward/citedby.uri?partnerID=HzOxMe3b&scp=79955054030&origin=inward",7,"2021-01-16 15:33:13","Review","10.1007/s13311-011-0034-4","1933-7213","https://api.elsevier.com/content/abstract/scopus_id/79955054030",8,2,283,293,87,8.70,87,1,10,""
91,"J. Lee","Fluoxetine inhibits matrix metalloprotease activation and prevents disruption of blood-spinal cord barrier after spinal cord injury",2012,"Brain","","https://www.scopus.com/inward/record.uri?partnerID=HzOxMe3b&scp=84864650244&origin=inward","https://www.scopus.com/inward/citedby.uri?partnerID=HzOxMe3b&scp=84864650244&origin=inward",5,"2021-01-16 15:33:13","Article","10.1093/brain/aws171","0006-8950","https://api.elsevier.com/content/abstract/scopus_id/84864650244",135,8,2375,2389,91,10.11,91,1,9,""
114,"C. Etz","Paraplegia after extensive thoracic and thoracoabdominal aortic aneurysm repair: Does critical spinal cord ischemia occur postoperatively?",2008,"Journal of Thoracic and Cardiovascular Surgery","","https://www.scopus.com/inward/record.uri?partnerID=HzOxMe3b&scp=38649119140&origin=inward","https://www.scopus.com/inward/citedby.uri?partnerID=HzOxMe3b&scp=38649119140&origin=inward",4,"2021-01-16 15:33:13","Article","10.1016/j.jtcvs.2007.11.002","0022-5223","https://api.elsevier.com/content/abstract/scopus_id/38649119140",135,2,324,330,114,8.77,114,1,13,""
120,"C. Hafer-Macko","Skeletal muscle changes after hemiparetic stroke and potential beneficial effects of exercise intervention strategies",2008,"Journal of Rehabilitation Research and Development","","https://www.scopus.com/inward/record.uri?partnerID=HzOxMe3b&scp=63249136123&origin=inward","https://www.scopus.com/inward/citedby.uri?partnerID=HzOxMe3b&scp=63249136123&origin=inward",3,"2021-01-16 15:33:13","Review","10.1682/JRRD.2007.02.0040","0748-7711","https://api.elsevier.com/content/abstract/scopus_id/63249136123",45,2,261,272,120,9.23,120,1,13,""
170,"T. Gordon","The basis for diminished functional recovery after delayed peripheral nerve repair",2011,"Journal of Neuroscience","","https://www.scopus.com/inward/record.uri?partnerID=HzOxMe3b&scp=79955723039&origin=inward","https://www.scopus.com/inward/citedby.uri?partnerID=HzOxMe3b&scp=79955723039&origin=inward",2,"2021-01-16 15:33:13","Article","10.1523/JNEUROSCI.6156-10.2011","0270-6474","https://api.elsevier.com/content/abstract/scopus_id/79955723039",31,14,5325,5334,170,17.00,170,1,10,""
274,"J. Kim","Nogo-66 receptor prevents raphespinal and rubrospinal axon regeneration and limits functional recovery from spinal cord injury",2004,"Neuron","","https://www.scopus.com/inward/record.uri?partnerID=HzOxMe3b&scp=7044246002&origin=inward","https://www.scopus.com/inward/citedby.uri?partnerID=HzOxMe3b&scp=7044246002&origin=inward",1,"2021-01-16 15:33:13","Article","10.1016/j.neuron.2004.10.015","0896-6273","https://api.elsevier.com/content/abstract/scopus_id/7044246002",44,3,439,451,274,16.12,274,1,17,""
