Cites,Authors,Title,Year,Source,Publisher,ArticleURL,CitesURL,GSRank,QueryDate,Type,DOI,ISSN,CitationURL,Volume,Issue,StartPage,EndPage,ECC,CitesPerYear,CitesPerAuthor,AuthorCount,Age,Abstract
1,"J.H. Pelletier","Therapeutic systemic hypothermia for a pediatric patient with an isolated cervical spinal cord injury",2020,"Journal of Spinal Cord Medicine","","https://www.scopus.com/inward/record.uri?partnerID=HzOxMe3b&scp=85053538225&origin=inward","https://www.scopus.com/inward/citedby.uri?partnerID=HzOxMe3b&scp=85053538225&origin=inward",5,"2021-01-17 15:36:23","Article","10.1080/10790268.2018.1520524","1079-0268","https://api.elsevier.com/content/abstract/scopus_id/85053538225",43,2,264,267,1,1.00,1,1,1,""
2,"V. Fanelli","Anesthetic optimization for nonheartbeating donors",2010,"Current Opinion in Anaesthesiology","","https://www.scopus.com/inward/record.uri?partnerID=HzOxMe3b&scp=77951988331&origin=inward","https://www.scopus.com/inward/citedby.uri?partnerID=HzOxMe3b&scp=77951988331&origin=inward",4,"2021-01-17 15:36:23","Review","10.1097/ACO.0b013e3283395352","0952-7907","https://api.elsevier.com/content/abstract/scopus_id/77951988331",23,3,406,410,2,0.18,2,1,11,""
4,"E.R. Theriault","Antispasmodic medications may be associated with reduced recovery during inpatient rehabilitation after traumatic spinal cord injury",2018,"Journal of Spinal Cord Medicine","","https://www.scopus.com/inward/record.uri?partnerID=HzOxMe3b&scp=84994905096&origin=inward","https://www.scopus.com/inward/citedby.uri?partnerID=HzOxMe3b&scp=84994905096&origin=inward",3,"2021-01-17 15:36:23","Article","10.1080/10790268.2016.1245010","1079-0268","https://api.elsevier.com/content/abstract/scopus_id/84994905096",41,1,63,71,4,1.33,4,1,3,""
25,"H. Kumru","Effects of high-frequency repetitive transcranial magnetic stimulation on motor and gait improvement in incomplete spinal cord injury patients",2013,"Neurorehabilitation and Neural Repair","","https://www.scopus.com/inward/record.uri?partnerID=HzOxMe3b&scp=84877269605&origin=inward","https://www.scopus.com/inward/citedby.uri?partnerID=HzOxMe3b&scp=84877269605&origin=inward",2,"2021-01-17 15:36:23","Article","10.1177/1545968312471901","1545-9683","https://api.elsevier.com/content/abstract/scopus_id/84877269605",27,5,421,429,25,3.13,25,1,8,""
30,"A.F. Douglas","Prolonged intrathecal baclofen withdrawal syndrome",2005,"Journal of Neurosurgery","","https://www.scopus.com/inward/record.uri?partnerID=HzOxMe3b&scp=23144449727&origin=inward","https://www.scopus.com/inward/citedby.uri?partnerID=HzOxMe3b&scp=23144449727&origin=inward",1,"2021-01-17 15:36:23","Article","10.3171/jns.2005.102.6.1133","0022-3085","https://api.elsevier.com/content/abstract/scopus_id/23144449727",102,6,1133,1136,30,1.88,30,1,16,""
