Cites,Authors,Title,Year,Source,Publisher,ArticleURL,CitesURL,GSRank,QueryDate,Type,DOI,ISSN,CitationURL,Volume,Issue,StartPage,EndPage,ECC,CitesPerYear,CitesPerAuthor,AuthorCount,Age,Abstract
1,"H. Shoji","Mechanisms of noradrenergic modulation of synaptic transmission and neuronal excitability in ventral horn neurons of the rat spinal cord",2019,"Neuroscience","","https://www.scopus.com/inward/record.uri?partnerID=HzOxMe3b&scp=85064703407&origin=inward","https://www.scopus.com/inward/citedby.uri?partnerID=HzOxMe3b&scp=85064703407&origin=inward",7,"2021-01-15 16:57:34","Article","10.1016/j.neuroscience.2019.03.026","0306-4522","https://api.elsevier.com/content/abstract/scopus_id/85064703407",408,,161,176,1,0.50,1,1,2,""
1,"M. Çaliş","Clinical evaluation and treatment of neurogenic bladder",2004,"Journal of Rheumatology and Medical Rehabilitation","","https://www.scopus.com/inward/record.uri?partnerID=HzOxMe3b&scp=29544433857&origin=inward","https://www.scopus.com/inward/citedby.uri?partnerID=HzOxMe3b&scp=29544433857&origin=inward",8,"2021-01-15 16:57:34","Article","","1300-0691","https://api.elsevier.com/content/abstract/scopus_id/29544433857",15,2,129,136,1,0.06,1,1,17,""
9,"N. Zidan","A randomized, blinded, prospective clinical trial of postoperative rehabilitation in dogs after surgical decompression of acute thoracolumbar intervertebral disc herniation",2018,"Journal of Veterinary Internal Medicine","","https://www.scopus.com/inward/record.uri?partnerID=HzOxMe3b&scp=85045097063&origin=inward","https://www.scopus.com/inward/citedby.uri?partnerID=HzOxMe3b&scp=85045097063&origin=inward",6,"2021-01-15 16:57:34","Article","10.1111/jvim.15086","0891-6640","https://api.elsevier.com/content/abstract/scopus_id/85045097063",32,3,1133,1144,9,3.00,9,1,3,""
13,"T.A. Linsenmeyer","Impact of α<inf>1</inf>-blockers in men with spinal cord injury and upper tract stasis",2002,"Journal of Spinal Cord Medicine","","https://www.scopus.com/inward/record.uri?partnerID=HzOxMe3b&scp=0036595811&origin=inward","https://www.scopus.com/inward/citedby.uri?partnerID=HzOxMe3b&scp=0036595811&origin=inward",5,"2021-01-15 16:57:34","Article","10.1080/10790268.2002.11753612","1079-0268","https://api.elsevier.com/content/abstract/scopus_id/0036595811",25,2,124,128,13,0.68,13,1,19,""
22,"S. Grasmueck","Survival rates and outcomes in cats with thoracic and lumbar spinal cord injuries due to external trauma",2004,"Journal of Small Animal Practice","","https://www.scopus.com/inward/record.uri?partnerID=HzOxMe3b&scp=3042564048&origin=inward","https://www.scopus.com/inward/citedby.uri?partnerID=HzOxMe3b&scp=3042564048&origin=inward",4,"2021-01-15 16:57:34","Article","10.1111/j.1748-5827.2004.tb00236.x","0022-4510","https://api.elsevier.com/content/abstract/scopus_id/3042564048",45,6,284,288,22,1.29,22,1,17,""
26,"R. Basson","Sexual function of women with chronic illness and cancer",2010,"Women's Health","","https://www.scopus.com/inward/record.uri?partnerID=HzOxMe3b&scp=77952119823&origin=inward","https://www.scopus.com/inward/citedby.uri?partnerID=HzOxMe3b&scp=77952119823&origin=inward",3,"2021-01-15 16:57:34","Review","10.2217/whe.10.23","1745-5057","https://api.elsevier.com/content/abstract/scopus_id/77952119823",6,3,407,429,26,2.36,26,1,11,""
40,"F. De Assis Aquino Gondim","Neural mechanisms involved in the delay of gastric emptying and gastrointestinal transit of liquid after thoracic spinal cord transection in awake rats",2001,"Autonomic Neuroscience: Basic and Clinical","","https://www.scopus.com/inward/record.uri?partnerID=HzOxMe3b&scp=0035916428&origin=inward","https://www.scopus.com/inward/citedby.uri?partnerID=HzOxMe3b&scp=0035916428&origin=inward",2,"2021-01-15 16:57:34","Article","10.1016/S1566-0702(00)00261-7","1566-0702","https://api.elsevier.com/content/abstract/scopus_id/0035916428",87,1,52,58,40,2.00,40,1,20,""
67,"A. Rabchevsky","Pharmacological interventions for spinal cord injury: Where do we stand? How might we step forward?",2011,"Pharmacology and Therapeutics","","https://www.scopus.com/inward/record.uri?partnerID=HzOxMe3b&scp=79960570561&origin=inward","https://www.scopus.com/inward/citedby.uri?partnerID=HzOxMe3b&scp=79960570561&origin=inward",1,"2021-01-15 16:57:34","Review","10.1016/j.pharmthera.2011.05.001","0163-7258","https://api.elsevier.com/content/abstract/scopus_id/79960570561",132,1,15,29,67,6.70,67,1,10,""
