Cites,Authors,Title,Year,Source,Publisher,ArticleURL,CitesURL,GSRank,QueryDate,Type,DOI,ISSN,CitationURL,Volume,Issue,StartPage,EndPage,ECC,CitesPerYear,CitesPerAuthor,AuthorCount,Age,Abstract
0,"E. Holsboer-Trachsler","Therapy of depression in neurorehabilitation and neurobiological mechanisms of action",2003,"Schweizer Archiv fur Neurologie und Psychiatrie","","https://www.scopus.com/inward/record.uri?partnerID=HzOxMe3b&scp=0346727106&origin=inward","https://www.scopus.com/inward/citedby.uri?partnerID=HzOxMe3b&scp=0346727106&origin=inward",5,"2021-01-12 11:47:59","Review","10.4414/sanp.2003.01431","0258-7661","https://api.elsevier.com/content/abstract/scopus_id/0346727106",154,8,431,439,0,0.00,0,1,18,""
12,"Y. Chen","Current research outcomes from the spinal cord injury model systems",2011,"Archives of Physical Medicine and Rehabilitation","","https://www.scopus.com/inward/record.uri?partnerID=HzOxMe3b&scp=79952055530&origin=inward","https://www.scopus.com/inward/citedby.uri?partnerID=HzOxMe3b&scp=79952055530&origin=inward",4,"2021-01-12 11:47:59","Article","10.1016/j.apmr.2010.12.011","0003-9993","https://api.elsevier.com/content/abstract/scopus_id/79952055530",92,3,329,331,12,1.20,12,1,10,""
20,"K. Margetis","Intrathecal baclofen associated with improvement of consciousness disorders in spasticity patients",2014,"Neuromodulation","","https://www.scopus.com/inward/record.uri?partnerID=HzOxMe3b&scp=84920763641&origin=inward","https://www.scopus.com/inward/citedby.uri?partnerID=HzOxMe3b&scp=84920763641&origin=inward",3,"2021-01-12 11:47:59","Article","10.1111/ner.12147","1094-7159","https://api.elsevier.com/content/abstract/scopus_id/84920763641",17,7,699,704,20,2.86,20,1,7,""
25,"H. Kumru","Effects of high-frequency repetitive transcranial magnetic stimulation on motor and gait improvement in incomplete spinal cord injury patients",2013,"Neurorehabilitation and Neural Repair","","https://www.scopus.com/inward/record.uri?partnerID=HzOxMe3b&scp=84877269605&origin=inward","https://www.scopus.com/inward/citedby.uri?partnerID=HzOxMe3b&scp=84877269605&origin=inward",2,"2021-01-12 11:47:59","Article","10.1177/1545968312471901","1545-9683","https://api.elsevier.com/content/abstract/scopus_id/84877269605",27,5,421,429,25,3.13,25,1,8,""
67,"A. Rabchevsky","Pharmacological interventions for spinal cord injury: Where do we stand? How might we step forward?",2011,"Pharmacology and Therapeutics","","https://www.scopus.com/inward/record.uri?partnerID=HzOxMe3b&scp=79960570561&origin=inward","https://www.scopus.com/inward/citedby.uri?partnerID=HzOxMe3b&scp=79960570561&origin=inward",1,"2021-01-12 11:47:59","Review","10.1016/j.pharmthera.2011.05.001","0163-7258","https://api.elsevier.com/content/abstract/scopus_id/79960570561",132,1,15,29,67,6.70,67,1,10,""
