Cites,Authors,Title,Year,Source,Publisher,ArticleURL,CitesURL,GSRank,QueryDate,Type,DOI,ISSN,CitationURL,Volume,Issue,StartPage,EndPage,ECC,CitesPerYear,CitesPerAuthor,AuthorCount,Age,Abstract
0,"Hiroki Iwai, Hiroko Shimada, Soraya Nishimura, Yoshiomi Kobayashi, Go Itakura, Keiko Hori, Keigo Hikishima, Hayao Ebise, Naoko Negishi, Shinsuke Shibata, Sonoko Habu, Yoshiaki Toyama, Masaya Nakamura, Hideyuki Okano","Allogeneic Neural Stem/Progenitor Cells Derived From Embryonic Stem Cells Promote Functional Recovery After Transplantation Into Injured Spinal Cord of Nonhuman Primates.",2015,"Stem cells translational medicine","","","",44,"2021-01-18 11:26:34","Journal Article","10.5966/sctm.2014-0215","2157-6564","",4,7,708,719,0,0.00,0,14,6,": Previous studies have demonstrated that neural stem/progenitor cells (NS/PCs) promote functional recovery in rodent animal models of spinal cord injury (SCI). Because distinct differences exist in the neuroanatomy and immunological responses between rodents and primates, it is critical to determine the effectiveness and safety of allografted embryonic stem cell (ESC)-derived NS/PCs (ESC-NS/PCs) in a nonhuman primate SCI model. In the present study, common marmoset ESC-NS/PCs were grafted into the lesion epicenter 14 days after contusive SCI in adult marmosets (transplantation group). In the control group, phosphate-buffered saline was injected instead of cells. In the presence of a low-dose of tacrolimus, several grafted cells survived without tumorigenicity and differentiated into neurons, astrocytes, or oligodendrocytes. Significant differences were found in the transverse areas of luxol fast blue-positive myelin sheaths, neurofilament-positive axons, corticospinal tract fibers, and platelet endothelial cell adhesion molecule-1-positive vessels at the lesion epicenter between the transplantation and control groups. Immunoelectron microscopic examination demonstrated that the grafted ESC-NS/PC-derived oligodendrocytes contributed to the remyelination of demyelinated axons. In addition, some grafted neurons formed synaptic connections with host cells, and some transplanted neurons were myelinated by host cells. Eventually, motor functional recovery significantly improved in the transplantation group compared with the control group. In addition, a mixed lymphocyte reaction assay indicated that ESC-NS/PCs modulated the allogeneic immune rejection. Taken together, our results indicate that allogeneic transplantation of ESC-NS/PCs from a nonhuman primate promoted functional recovery after SCI without tumorigenicity. This study demonstrates that allogeneic embryonic stem cell (ESC)-derived neural stem/progenitor cells (NS/PCs) promoted functional recovery after transplantation into the injured spinal cord in nonhuman primates. ESC-NS/PCs were chosen because ESC-NS/PCs are one of the controls for induced pluripotent stem cell-derived NS/PCs and because ESC derivatives are possible candidates for clinical use. This translational research using an allograft model of a nonhuman primate is critical for clinical application of grafting NS/PCs derived from various allogeneic pluripotent stem cells, especially induced pluripotent stem cells, into injured spinal cord at the subacute phase."
0,"Koshi Ninomiya, Koichi Iwatsuki, Yu-ichiro Ohnishi, Toshika Ohkawa, Toshiki Yoshimine","Intranasal delivery of bone marrow stromal cells to spinal cord lesions.",2015,"Journal of neurosurgery. Spine","","","",45,"2021-01-18 11:26:34","Journal Article","10.3171/2014.10.SPINE14690","1547-5646","",23,1,111,119,0,0.00,0,5,6,"The intranasal delivery of bone marrow stromal cells (BMSCs) or mesenchymal stem cells to the injured brains of rodents has been previously reported. In this study, the authors investigated whether BMSCs migrate to spinal cord lesions through an intranasal route and whether the administration affected functional recovery. Forty Sprague-Dawley rats that were subjected to spinal cord injuries at the T7-8 level were divided into 5 groups (injured + intranasal BMSC-treated group, injured + intrathecal BMSC-treated group, injured-only group, injured + intranasal vehicle-treated group, and injured + intrathecal vehicle-treated group). The Basso-Beattie-Bresnahan (BBB) scale was used to assess hind limb motor functional recovery for 2 or 4 weeks. Intralesionally migrated BMSCs were examined histologically and counted at 2 and 4 weeks. To evaluate the neuroprotective and trophic effects of BMSCs, the relative volume of the lesion cavity was measured at 4 weeks. In addition, nerve growth factor (NGF) and brain-derived neurotrophic factor (BDNF) levels in the CSF were evaluated at 2 weeks. Intranasally administered BMSCs were confirmed within spinal cord sections at both 2 and 4 weeks. The highest number, which was detected in the intrathecal BMSC-treated group at 2 weeks, was significantly higher than that in all the other groups. The BBB score of the intranasal BMSC-treated group showed statistically significant improvements by 1 week compared with the control group. However, in the final BBB scores, there was a statistically significant difference only between the intrathecal BMSC-treated group and the control group. The cavity ratios in the BMSC-treated groups were smaller than those of the control groups, but the authors did not find any significant differences in the NGF and BDNF levels in the CSF among the treatment and control groups. BMSCs reached the injured spinal cord through the intranasal route and contributed to the recovery of hind limb motor function and lesion cavity reduction. However, the effects were not as significant as those seen in the intrathecal BMSC-treated group."
0,"Seiji Yamaya, Hiroshi Ozawa, Haruo Kanno, Koshi N Kishimoto, Akira Sekiguchi, Satoshi Tateda, Kenichiro Yahata, Kenta Ito, Hiroaki Shimokawa, Eiji Itoi","Low-energy extracorporeal shock wave therapy promotes vascular endothelial growth factor expression and improves locomotor recovery after spinal cord injury.",2014,"Journal of neurosurgery","","","",46,"2021-01-18 11:26:34","Journal Article","10.3171/2014.8.JNS132562","1933-0693","",121,6,1514,1525,0,0.00,0,10,7,"Extracorporeal shock wave therapy (ESWT) is widely used for the clinical treatment of various human diseases. Recent studies have demonstrated that low-energy ESWT upregulates the expression of vascular endothelial growth factor (VEGF) and promotes angiogenesis and functional recovery in myocardial infarction and peripheral artery disease. Many previous reports suggested that VEGF produces a neuroprotective effect to reduce secondary neural tissue damage after spinal cord injury (SCI). The purpose of the present study was to investigate whether low-energy ESWT promotes VEGF expression and neuroprotection and improves locomotor recovery after SCI. Sixty adult female Sprague-Dawley rats were randomly divided into 4 groups: sham group (laminectomy only), sham-SW group (low-energy ESWT applied after laminectomy), SCI group (SCI only), and SCI-SW group (low-energy ESWT applied after SCI). Thoracic spinal cord contusion injury was inflicted using an impactor. Low-energy ESWT was applied to the injured spinal cord 3 times a week for 3 weeks. Locomotor function was evaluated using the Basso, Beattie, and Bresnahan (BBB) Scale (open field locomotor score) at different time points over 42 days after SCI. Hematoxylin and eosin staining was performed to assess neural tissue damage in the spinal cord. Neuronal loss was investigated by immunostaining for NeuN. The mRNA expressions of VEGF and its receptor, Flt-1, in the spinal cord were assessed using real-time polymerase chain reaction. Immunostaining for VEGF was performed to evaluate VEGF protein expression in the spinal cord. In both the sham and sham-SW groups, no animals showed locomotor impairment on BBB scoring. Histological analysis of H & E and NeuN stainings in the sham-SW group confirmed that no neural tissue damage was induced by the low-energy ESWT. Importantly, animals in the SCI-SW group demonstrated significantly better locomotor improvement than those in the SCI group at 7, 35, and 42 days after injury (p < 0.05). The number of NeuN-positive cells in the SCI-SW group was significantly higher than that in the SCI group at 42 days after injury (p < 0.05). In addition, mRNA expressions of VEGF and Flt-1 were significantly increased in the SCI-SW group compared with the SCI group at 7 days after injury (p < 0.05). The expression of VEGF protein in the SCI-SW group was significantly higher than that in the SCI group at 7 days (p < 0.01). The present study showed that low-energy ESWT significantly increased expressions of VEGF and Flt-1 in the spinal cord without any detrimental effect. Furthermore, it significantly reduced neuronal loss in damaged neural tissue and improved locomotor function after SCI. These results suggested that low-energy ESWT enhances the neuroprotective effect of VEGF in reducing secondary injury and leads to better locomotor recovery following SCI. This study provides the first evidence that low-energy ESWT can be a safe and promising therapeutic strategy for SCI."
0,"Joonho Chung, Moon Hang Kim, Yong Je Yoon, Kil Hwan Kim, So Ra Park, Byung Hyune Choi","Effects of granulocyte colony-stimulating factor and granulocyte-macrophage colony-stimulating factor on glial scar formation after spinal cord injury in rats.",2014,"Journal of neurosurgery. Spine","","","",47,"2021-01-18 11:26:34","Journal Article","10.3171/2014.8.SPINE131090","1547-5646","",21,6,966,973,0,0.00,0,6,7,"This study investigated the effects of granulocyte colony-stimulating factor (G-CSF) on glial scar formation after spinal cord injury (SCI) in rats and compared the therapeutic effects between G-CSF and granulocytemacrophage colony-stimulating factor (GM-CSF) to evaluate G-CSF as a potential substitute for GM-CSF in clinical application. Rats were randomly assigned to 1 of 4 groups: a sham-operated group (Group 1), an SCI group without treatment (Group 2), an SCI group treated with G-CSF (Group 3), and an SCI group treated with GM-CSF (Group 4). G-CSF and GM-CSF were administered via intraperitoneal injection immediately after SCI. The effects of G-CSF and GM-CSF on functional recovery, glial scar formation, and axonal regeneration were evaluated and compared. The rats in Groups 3 and 4 showed better functional recovery and more decreased cavity sizes than those in Group 2 (p < 0.05). Both G-CSF and GM-CSF suppressed intensive expression of glial fibrillary acidic protein around the cavity at 4 weeks and reduced the expression of chondroitin sulfate proteoglycans (p < 0.05). Also, early administration of G-CSF and GM-CSF protected axon fibers from destructive injury and facilitated axonal regeneration. There were no significant differences in comparisons of functional recovery, glial scar formation, and axonal regeneration between G-CSF and GM-CSF. G-CSF suppressed glial scar formation after SCI in rats, possibly by restricting the expression of glial fibrillary acidic protein and chondroitin sulfate proteoglycans, which might facilitate functional recovery from SCI. GM-CSF and G-CSF had similar effects on glial scar formation and functional recovery after SCI, suggesting that G-CSF can potentially be substituted for GM-CSF in the treatment of SCI."
0,"Z Li, G-H Guo, G-S Wang, C-X Guan, L Yue","Influence of neural stem cell transplantation on angiogenesis in rats with spinal cord injury.",2014,"Genetics and molecular research : GMR","","","",48,"2021-01-18 11:26:34","Journal Article","10.4238/2014.August.7.23","1676-5680","",13,3,6083,6092,0,0.00,0,5,7,"We examined the influence of neural stem cell transplantation on angiogenesis in rats with spinal cord injury. Sixty rats with spinal cord injury were divided into an experimental group and a control group and given neural stem cells or an equivalent amount of phosphate-buffered saline by intravenous transplantation, respectively. Basso, Beattie, and Bresnahan (BBB) motor function assessment was performed in rats at different times after transplantation, and von Willebrand factor (vWF) immunofluorescence and Western blot analysis of vascular endothelial growth factor (VEGF) protein were also performed. The BBB scores of rats in the 2 groups were both zero before transplantation. The BBB score gradually increased over time. The BBB score of the experimental group showed no significant difference compared with that of the control group (P > 0.05) 7 days after transplantation. The BBB score of the experimental group was significantly improved compared with that of the control group 14 days after transplantation (P < 0.05). vWF-positive cells and VEGF protein expression in the experimental group were significantly increased compared with those in the control group 7 and 14 days after transplantation, respectively (P < 0.05). Neural stem cell transplantation may promote angiogenesis by inducing VEGF expression as well as improve functional recovery of limb movements."
0,"Yijia Jia, Dou Wu, Ruiping Zhang, Weibing Shuang, Jiping Sun, Haihu Hao, Qijun An, Qiang Liu","Bone marrow-derived mesenchymal stem cells expressing the Shh transgene promotes functional recovery after spinal cord injury in rats.",2014,"Neuroscience letters","","","",49,"2021-01-18 11:26:34","Journal Article","10.1016/j.neulet.2014.05.010","1872-7972","",573,,46,51,0,0.00,0,8,7,"Spinal cord injury (SCI) is one of the most disabling diseases. Cell-based gene therapy is becoming a major focus for the treatment of SCI. Bone marrow-derived mesenchymal stem cells (BMSCs) are a promising stem cell type useful for repairing SCI. However, the effects of BMSCs transplants are likely limited because of low transplant survival after SCI. Sonic hedgehog (Shh) is a multifunctional growth factor which can facilitate neuronal and BMSCs survival, promote axonal growth, prevent activation of the astrocyte lineage, and enhance the delivery of neurotrophic factors in BMSCs. However, treatment of SCI with Shh alone also has limited effects on recovery, because the protein is cleared quickly. In this study, we investigated the use of BMSCs overexpressing the Shh transgene (Shh-BMSCs) in the treatment of rats with SCI, which could stably secrete Shh and thereby enhance the effects of BMSCs, in an attempt to combine the advantages of Shh and BMSCs and so to promote functional recovery. After Shh-BMSCs treatment of SCI via the subarachnoid, we detected significantly greater damage recovery compared with that seen in rats treated with phosphate-buffered saline (PBS) and BMSCs. Use of Shh-BMSCs increased the expression and secretion of Shh, basic fibroblast growth factor (bFGF) and vascular endothelial growth factor (VEGF), improved the behavioral function, enhanced the BMSCs survival, promoted the expression level of neurofilament 200 (NF200), and reduced the expression of glial fibrillary acidic protein (GFAP). Thus, our results indicated that Shh-BMSCs enhanced recovery of neurological function after SCI in rats and could be a potential valuable therapeutic intervention for SCI in humans."
0,"Amit D Kandhare, V Shivakumar, Anuchandra Rajmane, Pinaki Ghosh, Subhash L Bodhankar","Evaluation of the neuroprotective effect of chrysin via modulation of endogenous biomarkers in a rat model of spinal cord injury.",2014,"Journal of natural medicines","","","",50,"2021-01-18 11:26:34","Journal Article","10.1007/s11418-014-0840-1","1861-0293","",68,3,586,603,0,0.00,0,5,7,"The objective of the present investigation was to evaluate the neuroprotective efficacy of chrysin in an experimental rat model of spinal cord injury (SCI). SCI was induced in male Sprague-Dawley rats by placing an aneurysm clip extradurally for 60 s at T10. The rats received treatment with either vehicle (SCI control) or chrysin (10, 20 and 40 mg/kg, p.o.) for 28 days. The various behavioral, biochemical and molecular parameters were determined. Chronic treatment with chrysin (20 and 40 mg/kg) significantly and dose-dependently (P < 0.05) attenuated the decrease in body weight, urine output, footprint analysis, sperm count and organ weight (testis, seminal vesicle and urinary bladder). It significantly improved (P < 0.05) the nociceptive threshold, motor and sensory nerve conduction velocity. The decreased activity of superoxide dismutase, reduced glutathione and membrane-bound inorganic phosphate were significantly (P < 0.05) restored by chrysin treatment. SCI resulted in a significant increase (P < 0.05) in lipid peroxidase, nitric oxide, tumor necrosis factor alpha, interleukin-1β, and bax whereas expression of bcl-2 and caspase-3 were significantly (P < 0.05) reduced. These changes were significantly reduced by treatment with chrysin (20 and 40 mg/kg, P < 0.05). Histological aberration induced after SCI in spinal cord, testis, kidney and urinary bladder were restored by treatment with chrysin (20 and 40 mg/kg). In conclusion, chrysin is a potential flavone-possessing antioxidant and its antiapoptotic property caused the subsequent recovery of both motor and sensory functions via modulation of endogenous biomarkers and neuronal apoptosis to inhibit the incidence of neurological deficits due to SCI."
0,"Satoshi Ujigo, Naosuke Kamei, Hikmat Hadoush, Yuki Fujioka, Shigeru Miyaki, Tomoyuki Nakasa, Nobuhiro Tanaka, Kazuyoshi Nakanishi, Akiko Eguchi, Toru Sunagawa, Mitsuo Ochi","Administration of microRNA-210 promotes spinal cord regeneration in mice.",2014,"Spine","","","",51,"2021-01-18 11:26:34","Journal Article","10.1097/BRS.0000000000000356","1528-1159","",39,14,1099,1107,0,0.00,0,11,7,"Experimental animal study of treatment of spinal cord injury (SCI). To investigate the therapeutic effects of administering microRNA-210 (miR-210) to promote angiogenesis in a mouse SCI model. Despite many previous studies regarding SCI, there is no established treatment in clinical practice. miRNAs have attracted immense attention because of their crucial role in human disease, and they have been proposed as potential new therapeutic targets for SCI. At specific times after administration, mice were analyzed by several methods to examine the distribution of miR-210, histological angiogenesis and neurogenesis, functional recovery from SCI, and the expression levels of target genes of miR-210. After injection of miR-210 into the lesion of the injured spinal cord, expression of endogenous miR-210 increased until 6 days after injection. The administration of miR-210 promoted angiogenesis and astrogliosis, and improved functional recovery after SCI compared with the noninjected controls. Furthermore, the area made up of axons and myelin in the spinal cord tissues caudal to the injury site was larger in mice injected with miR-210 than those of the controls. Apoptotic cell death was lower in mice administered miR-210. After administration of miR-210, the expressions of protein-tyrosine phosphate 1B and ephrin-A3, both gene targets of miR-210, were downregulated at the protein level and protein-tyrosine phosphate 1B expression was also downregulated at the transcriptional level. MiR-210 might contribute to spinal cord repair by promoting angiogenesis via the inhibition of protein-tyrosine phosphate 1B and ephrin-A3. N/A."
0,"H Arima, M Hanada, T Hayasaka, N Masaki, T Omura, D Xu, T Hasegawa, D Togawa, Y Yamato, S Kobayashi, T Yasuda, Y Matsuyama, M Setou","Blockade of IL-6 signaling by MR16-1 inhibits reduction of docosahexaenoic acid-containing phosphatidylcholine levels in a mouse model of spinal cord injury.",2014,"Neuroscience","","","",52,"2021-01-18 11:26:34","Journal Article","10.1016/j.neuroscience.2014.03.012","1873-7544","",269,,1,10,0,0.00,0,13,7,"The interleukin (IL)-6 pathway plays an important role in recovery after spinal cord injury (SCI). The anti-IL-6 receptor antibody MR16-1 has been shown to suppress inflammation after SCI and promote recovery of motor function. The purpose of this study was to analyze the effects of MR16-1 on the expression patterns of phospholipids in the spinal cord in a mouse model of SCI. Eight-week-old C57BL/6JJmsSlc mice were used in this study. Laminectomy was performed at the ninth and tenth thoracic levels (T9-T10), and contusion injury of the spinal cord was induced at level T10. Immediately after SCI, mice were intraperitoneally injected with a single dose of MR16-1 (MR16-1 group) or a single dose of phosphate-buffered saline of the same volume (control group). Imaging mass spectrometry was performed to visualize phosphatidylcholine (PC) expression in the spinal cord 7 days after SCI. We found that MR16-1 treatment suppressed the infiltration of immune cells after SCI, and was able to increase the locomotor function post-injury. Phospholipid imaging revealed that the MR16-1 was able to prevent the reduction of docosahexaenoic acid (DHA)-containing PC in comparison with the control group. We also observed high levels of glial fibrillary acidic protein (GFAP) at the site of DHA-containing PC expression in the MR16-1 group. These results suggest that MR16-1 treatment influences the DHA-containing PC composition of GFAP-positive cells at the injury site as early as 7 days post-SCI."
0,"Nai-Kui Liu, Ling-Xiao Deng, Yi Ping Zhang, Qing-Bo Lu, Xiao-Fei Wang, Jian-Guo Hu, Eddie Oakes, Joseph V Bonventre, Christopher B Shields, Xiao-Ming Xu","Cytosolic phospholipase A2 protein as a novel therapeutic target for spinal cord injury.",2014,"Annals of neurology","","","",53,"2021-01-18 11:26:34","Journal Article","10.1002/ana.24134","1531-8249","",75,5,644,658,0,0.00,0,10,7,"The objective of this study was to investigate whether cytosolic phospholipase A2 (cPLA2 ), an important isoform of PLA2 that mediates the release of arachidonic acid, plays a role in the pathogenesis of spinal cord injury (SCI). A combination of molecular, histological, immunohistochemical, and behavioral assessments were used to test whether blocking cPLA2 activation pharmacologically or genetically reduced cell death, protected spinal cord tissue, and improved behavioral recovery after a contusive SCI performed at the 10th thoracic level in adult mice. SCI significantly increased cPLA2 expression and activation. Activated cPLA2 was localized mainly in neurons and oligodendrocytes. Notably, the SCI-induced cPLA2 activation was mediated by the extracellular signal-regulated kinase signaling pathway. In vitro, activation of cPLA2 by ceramide-1-phosphate or A23187 induced spinal neuronal death, which was substantially reversed by arachidonyl trifluoromethyl ketone, a cPLA2 inhibitor. Remarkably, blocking cPLA2 pharmacologically at 30 minutes postinjury or genetically deleting cPLA2 in mice ameliorated motor deficits, and reduced cell loss and tissue damage after SCI. cPLA2 may play a key role in the pathogenesis of SCI, at least in the C57BL/6 mouse, and as such could be an attractive therapeutic target for ameliorating secondary tissue damage and promoting recovery of function after SCI."
