Cites,Authors,Title,Year,Source,Publisher,ArticleURL,CitesURL,GSRank,QueryDate,Type,DOI,ISSN,CitationURL,Volume,Issue,StartPage,EndPage,ECC,CitesPerYear,CitesPerAuthor,AuthorCount,Age,Abstract
0,"Gustavo Ieno Judas, Sueli Gomes Ferreira, Rafael Simas, Paulina Sannomiya, Anderson Benício, Luiz Fernando Ferraz da Silva, Luiz Felipe Pinho Moreira","Intrathecal injection of human umbilical cord blood stem cells attenuates spinal cord ischaemic compromise in rats.",2014,"Interactive cardiovascular and thoracic surgery","","","",54,"2021-01-18 11:26:34","Journal Article","10.1093/icvts/ivu021","1569-9285","",18,6,757,762,0,0.00,0,7,7,"Spinal cord ischaemia with resulting paraplegia remains a devastating and unpredictable complication after thoraco-abdominal aortic surgery. With the advent of stem cell therapy and its potential to induce nervous tissue regeneration processes, the interest in the use of these cells as a treatment for neurological disorders has increased. Human stem cells, derived from the umbilical cord, are one of the strong candidates used in cell therapy for spinal cord injury because of weak immunogenicity and ready availability. We sought to evaluate the use of human umbilical cord blood stem cells (HUCBSCs) to attenuate the neurological effects of spinal cord ischaemia induced by high thoracic aorta occlusion. Forty Wistar rats were randomized to receive intrathecal injection of 10 µl phosphate buffered saline (PBS) solution containing 1 × 10(4) HUCBSCs, 30 min before (Tpre group: n = 10) and 30 min after (Tpos group: n = 10) descending thoracic aorta occlusion by intraluminal balloon during 12 min. Control groups received only PBS solution (Cpre group: n = 10; and Cpos group: n = 10). During a 28-day observational period, motor function was assessed by a functional grading scale (Basso, Beattie and Bresnahan). Segments of thoracolumbar spinal cord specimens were analysed for histological and immunohistochemical assessment for detection and quantification of human haematopoietic cells (CD45(+)) and apoptosis (transferase-mediated deoxyuridine triphosphate-biotin nick-end labelling). Overall mortality was 12 animals (30%). Therefore, the observational sample was composed of 28 animals. All groups showed similar incidence of paraplegia and mortality. The mean motor function scores showed no difference during time between the animals of each group, excepting for the Tpos group, which improved from 8.14 (±8.6) to 14.28 (±9.8) (P < 0.01). A treatment-by-time interaction was detected among animals that received HUCBSCs 30 min after ischaemia, with BBB scores higher from Days 14 to 28 compared with the first observational day with statistical difference (P = 0.01). Number of viable neurons was higher in the Tpos group (P = 0.14) and the incidence of apoptosis was lower in the same animals (P = 0.048), but showed no difference with its respective control. We confirmed the presence of CD45(+) cells 4 weeks after intrathecal injection in both therapeutic groups but mainly in the Tpos group. Intrathecal transplantation of HUCBSCs is feasible, and it improved spinal cord function, when they were delivered 30 min after spinal cord ischaemia, in a model of endovascular descending thoracic aorta occlusion in rats. Human umbilical cord blood is one of the potentially useful sources of stem cells for therapy of spinal cord ischaemia."
0,"Lei Lu, Arnavaz Hajizadeh Barfejani, Tao Qin, Qiang Dong, Cenk Ayata, Christian Waeber","Fingolimod exerts neuroprotective effects in a mouse model of intracerebral hemorrhage.",2014,"Brain research","","","",55,"2021-01-18 11:26:34","Journal Article","10.1016/j.brainres.2014.01.048","1872-6240","",1555,,89,96,0,0.00,0,6,7,"Recent studies have shown that fingolimod (FTY720) is neuroprotective in CNS injury models of cerebral ischemia and spinal cord injury. The purpose of the study was to examine the effect of fingolimod in a mouse model of intracerebral hemorrhage. ICH was produced in adult CD1 mice by injecting collagenase VII-S (0.5 µL, 0.06 U) into the basal ganglia. Fingolimod (or saline) was given 30 min after surgery and once daily for two days. Three days after intracerebral hemorrhage, brain edema, hematoma volume and the number of apoptotic cells were quantified. In another cohort of mice, brain atrophy was evaluated two weeks following intracerebral hemorrhage. Neurobehavioral tests were performed on the 3rd, the 7th and the 14th day. Fingolimod significantly decreased edema, apoptosis and brain atrophy. More importantly, fingolimod enhanced neurobehavioral recovery. Preliminary experiments showed no difference in the number of inflammatory (CD68-positive) cells between the two groups. In conclusion, fingolimod exerts protective effects in a mouse model of intracerebral hemorrhage; the mechanisms underlying these neuroprotective effects deserve further study."
0,"J D Figueroa, K Cordero, M Serrano-Illan, A Almeyda, K Baldeosingh, F G Almaguel, M De Leon","Metabolomics uncovers dietary omega-3 fatty acid-derived metabolites implicated in anti-nociceptive responses after experimental spinal cord injury.",2013,"Neuroscience","","","",56,"2021-01-18 11:26:34","Journal Article","10.1016/j.neuroscience.2013.09.012","1873-7544","",255,,1,18,0,0.00,0,7,8,"Chronic neuropathic pain is a frequent comorbidity following spinal cord injury (SCI) and often fails to respond to conventional pain management strategies. Preventive administration of docosahexaenoic acid (DHA) or the consumption of a diet rich in omega-3 polyunsaturated fatty acids (O3PUFAs) confers potent prophylaxis against SCI and improves functional recovery. The present study examines whether this novel dietary strategy provides significant antinociceptive benefits in rats experiencing SCI-induced pain. Rats were fed control chow or chow enriched with O3PUFAs for 8weeks before being subjected to sham or cord contusion surgeries, continuing the same diets after surgery for another 8 more weeks. The paw sensitivity to noxious heat was quantified for at least 8weeks post-SCI using the Hargreaves test. We found that SCI rats consuming the preventive O3PUFA-enriched diet exhibited a significant reduction in thermal hyperalgesia compared to those consuming the normal diet. Functional neurometabolomic profiling revealed a distinctive deregulation in the metabolism of endocannabinoids (eCB) and related N-acyl ethanolamines (NAEs) at 8weeks post-SCI. We found that O3PUFAs consumption led to a robust accumulation of novel NAE precursors, including the glycerophospho-containing docosahexaenoyl ethanolamine (DHEA), docosapentaenoyl ethanolamine (DPEA), and eicosapentaenoyl ethanolamine (EPEA). The tissue levels of these metabolites were significantly correlated with the antihyperalgesic phenotype. In addition, rats consuming the O3PUFA-rich diet showed reduced sprouting of nociceptive fibers containing CGRP and dorsal horn neuron p38 mitogen-activated protein kinase (MAPK) expression, well-established biomarkers of pain. The spinal cord levels of inositols were positively correlated with thermal hyperalgesia, supporting their role as biomarkers of chronic neuropathic pain. Notably, the O3PUFA-rich dietary intervention reduced the levels of these metabolites. Collectively, these results demonstrate the prophylactic value of dietary O3PUFA against SCI-mediated chronic pain."
0,"Hiroki Iwai, Satoshi Nori, Soraya Nishimura, Akimasa Yasuda, Morito Takano, Osahiko Tsuji, Kanehiro Fujiyoshi, Yoshiaki Toyama, Hideyuki Okano, Masaya Nakamura","Transplantation of neural stem/progenitor cells at different locations in mice with spinal cord injury.",2014,"Cell transplantation","","","",57,"2021-01-18 11:26:34","Journal Article","10.3727/096368913X670967","1555-3892","",23,11,1451,1464,0,0.00,0,10,7,"Transplantation of neural stem/progenitor cells (NS/PCs) promotes functional recovery after spinal cord injury (SCI); however, few studies have examined the optimal site of NS/PC transplantation in the spinal cord. The purpose of this study was to determine the optimal transplantation site of NS/PCs for the treatment of SCI. Wild-type mice were generated with contusive SCI at the T10 level, and NS/PCs were derived from fetal transgenic mice. These NS/PCs ubiquitously expressed ffLuc-cp156 protein (Venus and luciferase fusion protein) and so could be detected by in vivo bioluminescence imaging 9 days postinjury. NS/PCs (low: 250,000 cells per mouse; high: 1 million cells per mouse) were grafted into the spinal cord at the lesion epicenter (E) or at rostral and caudal (RC) sites. Phosphate-buffered saline was injected into E as a control. Motor functional recovery was better in each of the transplantation groups (E-Low, E-High, RC-Low, and RC-High) than in the control group. The photon counts of the grafted NS/PCs were similar in each of the four transplantation groups, suggesting that the survival of NS/PCs was fairly uniform when more than a certain threshold number of cells were transplanted. Quantitative RT-PCR analyses demonstrated that brain-derived neurotropic factor expression was higher in the RC segment than in the E segment, and this may underlie why NS/PCs more readily differentiated into neurons than into astrocytes in the RC group. The location of the transplantation site did not affect the area of spared fibers, angiogenesis, or the expression of any other mediators. These findings indicated that the microenvironments of the E and RC sites are able to support NS/PCs transplanted during the subacute phase of SCI similarly. Optimally, a certain threshold number of NS/PCs should be grafted into the E segment to avoid damaging sites adjacent to the lesion during the injection procedure."
0,"I Jakovcevski, N Djogo, L S Hölters, E Szpotowicz, M Schachner","Transgenic overexpression of the cell adhesion molecule L1 in neurons facilitates recovery after mouse spinal cord injury.",2013,"Neuroscience","","","",58,"2021-01-18 11:26:34","Journal Article","10.1016/j.neuroscience.2013.07.067","1873-7544","",252,,1,12,0,0.00,0,5,8,"It has been shown that the X-chromosome-linked neural cell adhesion molecule L1 plays a beneficial role in regeneration after spinal cord injury (SCI) in young adult rodents when applied in various molecular and cellular forms. In an attempt to further characterize the multiple functions of L1 after severe SCI we analyzed locomotor functions and measured axonal regrowth/sprouting and sparing, glial scarring, and synaptic remodeling at 6 weeks after severe spinal cord compression injury at the T7-9 levels of L1-deficient mice (L1-/y) and their wild-type (L1+/y) littermates, as well as mice that overexpress L1 under the control of the neuron-specific Thy-1 promoter (L1tg) and their wild-type littermates (L1+/+). No differences were found in the locomotor scale score and single frame motion analysis between L1-/y and L1+/y mice during 6 weeks after SCI, most likely due to the very low expression of L1 in the adult spinal cord of wild-type mice. L1tg mice, however, showed better locomotor recovery than their L1+/+ littermates, being associated with enhanced numbers of catecholaminergic axons in the lumbar spinal cord, but not of cholinergic, GABAergic or glutamatergic terminals around motoneuron cell bodies in the lumbar spinal cord. Additionally, no difference between L1tg and L1+/+ mice was detectable in dieback of corticospinal tract axons. Neuronal L1 overexpression did not influence the size of the glial fibrillary acidic protein-immunoreactive astrocytic scar 6 weeks after injury. We conclude that neuronal overexpression of L1 improves functional recovery from SCI by increasing catecholaminergic axonal regrowth/sprouting and/or sparing of severed axons without affecting the glial scar size."
0,"Tomoo Inoue, Amity Lin, Xiaokui Ma, Stephen L McKenna, Graham H Creasey, Geoffrey T Manley, Adam R Ferguson, Jacqueline C Bresnahan, Michael S Beattie","Combined SCI and TBI: recovery of forelimb function after unilateral cervical spinal cord injury (SCI) is retarded by contralateral traumatic brain injury (TBI), and ipsilateral TBI balances the effects of SCI on paw placement.",2013,"Experimental neurology","","","",59,"2021-01-18 11:26:34","Journal Article","10.1016/j.expneurol.2013.06.006","1090-2430","",248,,136,147,0,0.00,0,9,8,"A significant proportion (estimates range from 16 to 74%) of patients with spinal cord injury (SCI) have concomitant traumatic brain injury (TBI), and the combination often produces difficulties in planning and implementing rehabilitation strategies and drug therapies. For example, many of the drugs used to treat SCI may interfere with cognitive rehabilitation, and conversely drugs that are used to control seizures in TBI patients may undermine locomotor recovery after SCI. The current paper presents an experimental animal model for combined SCI and TBI to help drive mechanistic studies of dual diagnosis. Rats received a unilateral SCI (75 kdyn) at C5 vertebral level, a unilateral TBI (2.0 mm depth, 4.0 m/s velocity impact on the forelimb sensori-motor cortex), or both SCI+TBI. TBI was placed either contralateral or ipsilateral to the SCI. Behavioral recovery was examined using paw placement in a cylinder, grooming, open field locomotion, and the IBB cereal eating test. Over 6weeks, in the paw placement test, SCI+contralateral TBI produced a profound deficit that failed to recover, but SCI+ipsilateral TBI increased the relative use of the paw on the SCI side. In the grooming test, SCI+contralateral TBI produced worse recovery than either lesion alone even though contralateral TBI alone produced no observable deficit. In the IBB forelimb test, SCI+contralateral TBI revealed a severe deficit that recovered in 3 weeks. For open field locomotion, SCI alone or in combination with TBI resulted in an initial deficit that recovered in 2 weeks. Thus, TBI and SCI affected forelimb function differently depending upon the test, reflecting different neural substrates underlying, for example, exploratory paw placement and stereotyped grooming. Concurrent SCI and TBI had significantly different effects on outcomes and recovery, depending upon laterality of the two lesions. Recovery of function after cervical SCI was retarded by the addition of a moderate TBI in the contralateral hemisphere in all tests, but forepaw placements were relatively increased by an ipsilateral TBI relative to SCI alone, perhaps due to the dual competing injuries influencing the use of both forelimbs. These findings emphasize the complexity of recovery from combined CNS injuries, and the possible role of plasticity and laterality in rehabilitation, and provide a start towards a useful preclinical model for evaluating effective therapies for combine SCI and TBI."
0,"Nicholas J Kuypers, Kurtis T James, Gaby U Enzmann, David S K Magnuson, Scott R Whittemore","Functional consequences of ethidium bromide demyelination of the mouse ventral spinal cord.",2013,"Experimental neurology","","","",60,"2021-01-18 11:26:34","Journal Article","10.1016/j.expneurol.2013.02.014","1090-2430","",247,,615,622,0,0.00,0,5,8,"Ethidium bromide (EB) has been extensively used in the rat as a model of spinal cord demyelination. However, this lesion has not been addressed in the adult mouse, a model with unlimited genetic potential. Here we characterize behavioral function, inflammation, myelin status and axonal viability following bilateral injection of 0.20 mg/mL ethidium bromide or saline into the ventral white matter (VWM) of female C57Bl/6 mice. EB-induced VWM demyelination significantly reduced spared VWM and Basso Mouse Scale (BMS) scores persisting out to 2 months. Chronic hindlimb dysfunction was accompanied by a persistent inflammatory response (demonstrated by CD45(+) immunofluorescence) and axonal loss (demonstrated by NF-M immunofluorescence and electron microscopy; EM). These cellular responses differ from the rat where inflammation resolves by 3-4 weeks and axon loss is minimal following EB demyelination. As these data suggest that EB-injection in the mouse spinal cord is a non-remyelinating lesion, we sought to ask whether wheel running could promote recovery by enhancing plasticity of local lumbar circuitry independent of remyelination. This did not occur as BMS and Treadscan assessment revealed no significant effect of wheel running on recovery. However, this study defines the importance of descending ventral motor pathways to locomotor function in the mouse as VWM loss results in a chronic hindlimb deficit."
0,"Ji Yong Kim, Chang Hyun Oh, Xian Huang, Moon Hang Kim, Seung Hwan Yoon, Kil Hwan Kim, Hyeonseon Park, Hyung Chun Park, So Ra Park, Byung Hyune Choi","Improvement in sensory function via granulocyte-macrophage colony-stimulating factor in rat spinal cord injury models.",2013,"Journal of neurosurgery. Spine","","","",61,"2021-01-18 11:26:34","Journal Article","10.3171/2012.9.SPINE1235","1547-5646","",18,1,69,75,0,0.00,0,10,8,"The aim in this study was to determine whether granulocyte-macrophage colony-stimulating factor (GM-CSF) leads to sensory improvement in rat spinal cord injury (SCI) models. Thirty male Sprague-Dawley rats were included in this study: 10 in the sham group (laminectomy alone without SCI), 10 in the SCI group (SCI treated with phosphate-buffered saline), and 10 in the GM-CSF treatment group (SCI treated with GM-CSF). A locomotor function test and pain sensitivity test were conducted weekly for 9 weeks after SCI or sham injury. Spinal tissue samples from all rats were immunohistochemically examined for the expression of calcitonin gene-related peptide (CGRP) and abnormal sprouting at Week 9 post-SCI. Granulocyte-macrophage colony-stimulating factor treatment improves functional recovery after SCI. In the tactile withdrawal threshold and frequency of the hindlimb paw, the GM-CSF group always responded with a statistically significant lower threshold than the SCI group 9 weeks after SCI (p < 0.05). The response of the forelimb and hindlimb paws to cold in the GM-CSF group always reflected a statistically significant lower threshold than in the SCI group 9 weeks after injury (p < 0.05). Decreased CGRP expression, observed by density and distribution area, was noted in the GM-CSF group (optical density 113.5 ± 20.4) compared with the SCI group (optical density 143.1 ± 18.7; p < 0.05). Treatment with GM-CSF results in functional recovery, improving tactile and cold sense recovery in a rat SCI model. Granulocyte-macrophage colony-stimulating factor also minimizes abnormal sprouting of sensory nerves after SCI."
0,"Amol Raheja, Vaishali Suri, Ashish Suri, Chitra Sarkar, Arti Srivastava, Sujata Mohanty, Krishan G Jain, Meher C Sharma, Hruda N Mallick, Pradeep K Yadav, Mani Kalaivani, Ravindra M Pandey","Dose-dependent facilitation of peripheral nerve regeneration by bone marrow-derived mononuclear cells: a randomized controlled study: laboratory investigation.",2012,"Journal of neurosurgery","","","",62,"2021-01-18 11:26:34","Journal Article","10.3171/2012.8.JNS111446","1933-0693","",117,6,1170,1181,0,0.00,0,12,9,"Bone marrow-derived stem cells enhance the rate of regeneration of neuronal cells leading to clinical improvement in nerve injury, spinal cord injury, and brain infarction. Recent experiments in the local application of bone marrow-derived mononuclear cells (BM-MNCs) in models of sciatic nerve transection in rats have suggested their beneficial role in nerve regeneration, although the effects of variable doses of stem cells on peripheral nerve regeneration have never been specifically evaluated in the literature. In this paper, the authors evaluated the dose-dependent role of BM-MNCs in peripheral nerve regeneration in a model of sciatic nerve transection in rats. The right sciatic nerve of 60 adult female Wistar rats (randomized into 2 test groups and 1 control group, 20 rats in each group) underwent transection under an operating microscope. The cut ends of the nerve were approximated using 2 epineural microsutures. The gap was filled with low-dose (5 million BM-MNCs/100 μl phosphate-buffered saline [PBS]) rat BM-MNCs in one group, high-dose (10 million BM-MNCs/100 μl PBS) rat BM-MNCs in another group, and only PBS in the control group, and the approximated nerve ends were sealed using fibrin glue. Histological assessment was performed after 30 days by using semiquantitative and morphometric analyses and was done to assess axonal regeneration, percentage of myelinated fibers, axonal diameter, fiber diameter, and myelin thickness at distal-most sites (10 mm from site of repair), intermediate distal sites (5 mm distal to the repair site), and site of repair. The recovery of nerve cell architecture after nerve anastomosis was far better in the high-dose BM-MNC group than in the low-dose BM-MNC and control groups, and it was most evident (p < 0.02 in the majority of the parameters [3 of 4]) at the distal-most site. Overall, the improvement in myelin thickness was most significant with incremental dosage of BM-MNCs, and was evident at the repair, intermediate distal, and distal-most sites (p = 0.001). This study emphasizes the role of BM-MNCs, which can be isolated easily from bone marrow aspirates, in peripheral nerve injury and highlights their dose-dependent facilitation of nerve regeneration."
0,"Zhou Zhilai, Zhang Hui, Jin Anmin, Min Shaoxiong, Yu Bo, Chen Yinhai","A combination of taxol infusion and human umbilical cord mesenchymal stem cells transplantation for the treatment of rat spinal cord injury.",2012,"Brain research","","","",63,"2021-01-18 11:26:34","Journal Article","10.1016/j.brainres.2012.08.051","1872-6240","",1481,,79,89,0,0.00,0,6,9,"Studies have shown that the administration of Taxol, an anti-cancer drug, inhibited scar formation, promoted axonal elongation and improved locomotor recovery in rats after spinal cord injury (SCI). We hypothesized that combining Taxol with another promising therapy, transplantation of human umbilical mesenchymal stem cells (hUCMSCs), might further improve the degree of locomotor recovery. The present study examined whether Taxol combined with transplantation of hUCMSCs would produce synergistic effects on recovery and which mechanisms were involved in the effect. A total of 32 rats subjected to SCI procedures were assigned to one of the following four treatment groups: phosphate-buffered saline (PBS, control), hUCMSCs, Taxol, or Taxol+hUCMSCs. Immediately after injury, hUCMSCs were transplanted into the injury site and Taxol was administered intrathecally for 4 weeks. Locomotor recovery was evaluated using the Basso, Beattie and Bresnahan locomotor (BBB) rating scale. Survival of the transplanted human cells and the host glial reaction in the injured spinal cord were studied by immunohistochemistry. Treatment with Taxol, hUCMSCs or Taxol+hUCMSCs reduced the extent of astrocytic activation, increased axonal preservation and decreased the number of caspase-3(+) and ED-1(+) cells, but these effects were more pronounced in the Taxol+hUCMSCs group. Behavioral analyses showed that rats in the Taxol+hUCMSCs group showed better motor performance than rats treated with hUCMSCs or Taxol only. The combination of Taxol and hUCMSCs produced beneficial effects in rats with regard to functional recovery following SCI through the enhancement of anti-inflammatory, anti-astrogliosis, anti-apoptotic and axonal preservation effects."
0,"Yusuke Norimatsu, Tsukasa Ohmori, Atsushi Kimura, Seiji Madoiwa, Jun Mimuro, Atsushi Seichi, Yutaka Yatomi, Yuichi Hoshino, Yoichi Sakata","FTY720 improves functional recovery after spinal cord injury by primarily nonimmunomodulatory mechanisms.",2012,"The American journal of pathology","","","",64,"2021-01-18 11:26:34","Journal Article","10.1016/j.ajpath.2011.12.012","1525-2191","",180,4,1625,1635,0,0.00,0,9,9,"Spinal cord injury (SCI) is an incapacitating injury that can result in limited functional recovery. We have previously shown increases in the lysophospholipid mediator, sphingosine-1-phosphate (S1P), in the spinal cord after contusion injury. To apply S1P receptor modulation to the treatment of SCI, we examined the therapeutic effects of FTY720, an S1P receptor agonist, on locomotor recovery after SCI in mice. Oral administration of FTY720 shortly after contusion SCI significantly improved motor function recovery, as assessed by both Basso Mouse Scale scores and Rotarod Performance test results. FTY720 induced lymphopenia and reduced T-cell infiltration in the spinal cord after SCI but did not affect the early infiltration of neutrophils and the activation of microglia. In addition, plasma levels and mRNA expression of inflammatory cytokines in the spinal cord after SCI were not attenuated by FTY720. Vascular permeability and astrocyte accumulation were both decreased by FTY720 in the injured spinal cord. The therapeutic effects of FTY720 were not solely dependent on immune modulation, as confirmed by the demonstration that FTY720 also ameliorated motor function after SCI in mice with severe combined immunodeficiency. Finally, the S1P(1) receptor agonist, SEW2871, partly mimicked the therapeutic effect of FTY720. Our data highlight the importance of immune-independent functions of FTY720 in decreasing vascular permeability and astrogliosis in the injured spinal cord and promoting locomotor function recovery after SCI."
