Cites,Authors,Title,Year,Source,Publisher,ArticleURL,CitesURL,GSRank,QueryDate,Type,DOI,ISSN,CitationURL,Volume,Issue,StartPage,EndPage,ECC,CitesPerYear,CitesPerAuthor,AuthorCount,Age,Abstract
0,"K D Nantwi, H G Goshgarian","Actions of specific adenosine receptor A1 and A2 agonists and antagonists in recovery of phrenic motor output following upper cervical spinal cord injury in adult rats.",2002,"Clinical and experimental pharmacology & physiology","","","",11,"2021-01-14 20:02:18","Journal Article","10.1046/j.1440-1681.2002.03750.x","0305-1870","",29,10,915,923,0,0.00,0,2,19,"1. Previous studies from our laboratory have established that a latent respiratory motor pathway can be activated to restore function to a hemidiaphragm paralysed by upper cervical (C2) spinal cord hemisection during a reflex known as the 'crossed phrenic phenomenon'. In addition, theophylline, a general adenosine A1 and A2 receptor antagonist, can activate the latent pathway by acting centrally through antagonism at adenosine receptors. 2. The present study was designed to assess the relative contributions of adenosine A1 and A2 receptors in inducing functional recovery in our model of spinal cord injury. Specific adenosine A1 and A2 agonists and antagonists were used in an electrophysiological study. 3. Our results demonstrate that, in hemisected rats, systemic administration of the adenosine A1 receptor-specific antagonist 1,3-dipropyl-8-cyclopentylxanthine (DPCPX) restores, in a dose-dependent manner, phrenic nerve respiratory related output that is lost following hemisection. Furthermore, DPCPX augments respiratory activity in non-injured animals. The A2 receptor agonist CGS-21680 mediates its effects by predominantly acting on peripheral rather than central nervous system (CNS) receptors. CGS-21680 modulates respiratory related phrenic nerve activity in non-injured animals by enhancing tonic activity, but does not induce recovery of phrenic nerve activity in hemisected animals in the majority of cases. When CGS-21680 was administered prior to DPCPX in hemisected rats, the magnitude of recovery of respiratory function was significantly greater than that elicited by DPCPX alone. However, when the A2 receptor agonist was administered after DPCPX, the magnitude of recovery was virtually unchanged, whereas activity in the right phrenic nerve was significantly enhanced. The A1 receptor agonist N6-cyclohexyladenosine depressed respiratory activity in non-injured, as well as hemisected, rats. The A2 receptor antagonist 3,7-dimethyl-1-propargylxanthine did not affect respiratory activity. 4. We conclude that while antagonism at central adenosine A1 receptors mediates functional restitution in hemisected animals, activation of A2 receptors located outside of the CNS subserves the A1 receptor-mediated respiratory recovery."
0,"J W Phillis, H G Goshgarian","Adenosine and neurotrauma: therapeutic perspectives.",2001,"Neurological research","","","",12,"2021-01-14 20:02:18","Journal Article","10.1179/016164101101198316","0161-6412","",23,2,183,189,0,0.00,0,2,20,"Cerebral ischemia studies demonstrating that stimulation of adenosine A1 receptors by either endogenously released adenosine or the administration of selective receptor agonists causes significant reductions in the morbidity and mortality associated with focal or global brain ischemias have triggered interest in the potential of purinergic therapies for the treatment of traumatic injuries to the brain and spinal cord. Preliminary findings indicate that activation of A1 adenosine receptors can ameliorate trauma-induced death of central neurons. Other avenues of approach include the administration of agents which elevate local concentrations of adenosine at injury sites by inhibiting its metabolism to inosine by adenosine deaminase, rephosphorylation to adenosine triphosphate by adenosine kinase; or re-uptake into adjacent cells. Amplification of the levels of endogenously released adenosine in such a 'site and event specific' fashion has the advantage of largely restricting the effect of such inhibitors to areas of injury-induced adenosine release. Another approach involving purinergic therapy has been applied to the problem of respiratory paralysis following high spinal cord injuries. In this instance, the adenosine antagonist theophylline has been used to enhance residual synaptic drive to spinal respiratory neurons by blocking adenosine A1 receptors. Theophylline induced, and maintained, hemidiaphragmatic recovery for prolonged periods after C2 spinal cord hemisection in rats and may prove to be beneficial in assisting respiration in spinal cord injury patients."
0,"K D Nantwi, H G Goshgarian","Alkylxanthine-induced recovery of respiratory function following cervical spinal cord injury in adult rats.",2001,"Experimental neurology","","","",13,"2021-01-14 20:02:18","Journal Article","10.1006/exnr.2000.7581","0014-4886","",168,1,123,134,0,0.00,0,2,20,"Previous investigations from our laboratory have demonstrated qualitatively that a latent respiratory pathway can be activated by systemic theophylline administration to restore function to a hemidiaphragm paralyzed by an upper (C2) cervical spinal cord hemisection in adult rats. The present study seeks to extend the previous investigations by contrasting and quantitating the actions of theophylline, 8-phenyltheophylline, enprofylline, and 8(p-Sulfophenyl)theophylline in restoring function 24 h after hemidiaphragm paralysis. The alkylxanthines were selected based on their diverse pharmacologic profiles to elucidate the mechanisms that underlie functional recovery after spinal cord injury. To quantitatively assess the magnitude of recovery, electrophysiological experiments were conducted on pancuronium-paralyzed, hemisected animals under standardized recording conditions. The total absence of respiratory-related activity in the phrenic nerve ipsilateral to the hemisection and paralyzed hemidiaphragm was used as the index of a functionally complete hemisection. Thereafter, drug-induced recovered activity in the phrenic nerve ipsilateral to hemisection was quantified and expressed either as a percentage of contralateral phrenic nerve activity in the same animal prior to drug administration or as a percentage of predrug activity in the homolateral nerve in noninjured animals. With either approach, theophylline (5-15 mg/kg) and 8-phenyltheophylline (5-10 mg/kg) dose-dependently induced respiratory-related recovered activity. Enprofylline, a potent bronchodilator, and 8(p-Sulfophenyl)theophylline, an adenosine receptor antagonist with limited access to the central nervous system, were ineffective. Maximal recovery was attained with theophylline (15 mg/kg) and 8-phenyltheophylline (10 mg/kg). At these doses, theophylline and 8-phenyltheophylline induced recovery that was 70.0 +/- 2.5 and 69.3 +/- 4.1% of predrug contralateral nerve activity respectively. When expressed as a percentage of activity in the homolateral nerve in noninjured animals, the magnitude changed to 32.9 +/- 4.9 and 35.7 +/- 6.9%, respectively. Involvement of adenosine receptors in the alkylxanthine-induced actions was confirmed in experiments with the adenosine analog, N6 (l-2-phenylisopropyl) adenosine (L-PIA). It is concluded that central adenosine receptor-mediated mechanisms are implicated in the recovery of respiratory-related activity after spinal cord injury. Furthermore, our results suggest a potential for a new therapeutic approach in the rehabilitation of spinal cord patients with respiratory deficits."
0,"K D Nantwi, H G Goshgarian","Effects of chronic systemic theophylline injections on recovery of hemidiaphragmatic function after cervical spinal cord injury in adult rats.",1998,"Brain research","","","",14,"2021-01-14 20:02:18","Journal Article","10.1016/s0006-8993(98)00024-9","0006-8993","",789,1,126,129,0,0.00,0,2,23,"Based on a previous demonstration that acutely administered theophylline induces respiratory-related recovery in an animal model of spinal cord injury, the influence of chronically administered theophylline on maintaining recovery was assessed. The absence of respiratory-related activity in the left phrenic nerve and hemidiaphragm of rats subjected to an ipsilateral C2 spinal cord hemisection was confirmed electrophysiologically 24 h after injury. Theophylline was then injected i.p. for 3-30 consecutive days. Recovery of respiratory-related activity was observed in the majority (29 out of 32) of the experimental animals. We conclude that theophylline not only induces, but also maintains recovery for prolonged periods after cervical spinal cord injury."
0,"K D Nantwi, A El-Bohy, H G Goshgarian","Actions of systemic theophylline on hemidiaphragmatic recovery in rats following cervical spinal cord hemisection.",1996,"Experimental neurology","","","",15,"2021-01-14 20:02:18","Journal Article","10.1006/exnr.1996.0114","0014-4886","",140,1,53,59,0,0.00,0,3,25,"This study assesses the effects of theophylline on enhancing phrenic nerve discharge and functional hemidiaphragmatic recovery after C2 spinal cord hemisection in adult female rats. There were three separate groups of spinal hemisected rats and one nonhemisected group studied. Twenty-four hours following C2 spinal hemisection, ipsilateral phrenic nerve activity was recorded under standardized, normoxic and then hypoxic conditions. After 30 min, theophylline was administered and the recordings were repeated in group 1 animals. In group 2, activity in both phrenic nerves was recorded simultaneously before and after drug administration. In a third group of rats, both ipsilateral phrenic nerve and hemidiaphragmatic activities were monitored before and after the drug. In control nonhemisected animals under standardized recording conditions, the effects of theophylline were quantitatively assessed by determining the mean area under integrated phrenic nerve discharge waveforms before and after drug administration. Generally, theophylline induced biphasic effects; i.e., at a low dose (15 mg/kg) it evoked excitation, while at a high dose (30 mg/kg) depression of respiratory activity predominated. In group 2 animals, respiratory activity was induced in the nerve ipsilateral to the hemisection and enhanced in the contralateral phrenic nerve for up to 3 h after a single standard dose of theophylline (15 mg/kg). Prior to drug administration, there was an absence of respiratory-related activity in both the phrenic nerve and hemidiaphragm ipsilateral to C2 spinal cord hemisection. A standard dose of theophylline, however, induced recovery of activity in both the phrenic nerve and the left hemidiaphragm ipsilateral to the hemisection in group 3 animals. In control (nonhemisected) animals, theophylline enhanced phrenic nerve activity, but decreased the duration of respiratory bursts. These results show for the first time that theophylline can activate latent respiratory motor pathways and thus restore the respiratory drive to phrenic motoneurons lost by spinal cord injury. Respiratory activity is not only reestablished in the phrenic nerve made quiescent by hemisection, but it is also enhanced in the contralateral phrenic nerve. The drug also restores function to the hemidiaphragm paralyzed by the spinal cord hemisection. The findings may have clinical relevance to human cases of cervical spinal cord injury in which respiratory function is compromised."
